Company Name,Job Title,Location,Country,Job Description,Salary Estimate,Avg Salary,Size,Industry,Sector,Revenue,Rating,Recommend,CEO,Benefits,Opportunities,Comp Benefits,Culture,Management,WorkLife Balance,Pros,Cons,Num Listings,Reviews URL,Benefits URL
Tellux,Data Scientist H/F,Petit-Couronne,France,"À propos de TELLUX :
TELLUX est une startup rouennaise fondée en 2019.
Tellux développe des systèmes automatiques de mesure pour améliorer la préservation de l'environnement sur les chantiers de BTP. Tellux accélère l'analyse des sols en la rendant plus facile, plus précise et permet de réduire les risques d'erreurs, les coûts et les délais des grands chantiers de revalorisation des friches industrielles. Nous sommes au cœur des enjeux environnementaux de préservation et de réutilisation des sols. Nous sommes les premiers à réaliser des analyses numériques de matériaux, de strates de sols et de polluants à partir d’imagerie hyperspectrale et d’algorithmes de deep learning.
TELLUX c'est aussi un collectif de 14 personnes aux compétences et aux parcours variés, fédérés autours de valeurs fortes à la fois humaines et environnementales !",35 k € - 50 k € (Estimation de l'employeur),42,,,,,,,,,,,,,,,,1093,,
"Métropole Rouen Normandie
3.2",Data scientist (H/F),Petit-Couronne,France,"Offre n°142JCTX
Créée le 12/10/2022
Actualisée le 12/10/2022

76 - PETIT COURONNE
L'Hyperlab est un outil innovant d'analyse de sols, en temps réel, mobile et à haute précision. La plate-forme est composée de modules d'acquisition de données hyperspectrales, de modules d'analyse de ces données par IA, et de modules de restitution métier.
Rattaché(e) au directeur de la Technologie, vous participez au développement des algorithmes et des pipelines d'analyse de données utilisés au cœur de cette plateforme. Au sein de l'équipe tech data et au coeur du réacteur de la technologie développée par Tellux, vous serez amené(e) à travailler avec d'autres data scientists, mais également avec les Machine Learning Engineers, et les utilisateurs métiers tels que chimistes, ingénieurs Sites et Sols Pollués ou encore géologues.

Missions :

Profil recherché :
Disposant d'expériences significatives dans la modélisation en Intelligence Artificielle, vous êtes issu(e) d'une formation BAC + 5 type école d'ingénieur ou équivalent universitaire en Data Sciences.

Compétences techniques et aptitudes recherchées :
Votre maîtrise des techniques de modélisation en python ( sikitlearn, pytorch, tensorflow ) est primordiale
Votre culture dans le monde du traitement de signal et de l'image vous permettra d'être force de proposition
Vous avez un bon esprit d'analyse et de synthèse
Vous fonctionnez de manière collaborative et disposez d'un esprit souple et curieux
Vous êtes rigoureux(se), organisé(e), dynamique et autonome
Vous aimez relever des challenges et vous avez le sens du travail en équipe

Contrat à durée indéterminée

35H Horaires normaux



2 ans Exigé


TELLUX
Ingénierie, études techniques
76 - PETIT COURONNE
TELLUX accélère l'analyse de la pollution des sols en la rendant plus facile, plus précise et permet de réduire les risques d'erreurs, les coûts et les délais des grands chantiers. Elle est la première entreprise au monde à utiliser l'imagerie hyperspectrale pour l'analyse des sols.",35 k € - 50 k € (Estimation de l'employeur),,Inconnu,,,,3.2,56 %,N/A,5.0,2.5,2.8,3.1,2.8,4.1,,,1093,,https://www.glassdoor.fr/Benefits/M%C3%A9tropole-Rouen-Normandie-Benefits-E1545229.htm
Sightengine,Audio & Speech Recognition Data scientist,Télétravail,France,"Remote
RESPONSIBILITIES
Architect, design and implement solutions to process and understand spoken languages
Propose and build solutions to analyze non-speech audio
Supervise model training, model updates and continuous improvement strategies
Work with native speakers to improve support for smaller languages
Stay at the forefront of advances in Audio, NLP and Speech Processing
REQUIREMENTS
you have experience running research experiments and are familiar with Tensorflow, PyTorch or equivalents",35 k € - 50 k € (Estimation de l'employeur),,Inconnu,,,,,,,,,,,,,,,1093,,
"BNP Paribas
3.8",Data Scientist Etudes et Modèles Statistiques H/F,Paris,France,"Data Scientist Etudes et Modèles Statistiques- H/F
Le Département Etudes & Management de la Connaissance Client (EMC2) de BCEF RETAIL recherche son prochain Data Scientist Etudes et Modèles Statistiques - H/F

Sur le terrain, ça donne quoi ?
Le département EMC2 a pour mission d’analyser et modéliser les données de nos clients et de l’environnement afin d’optimiser la prise de décision business tout au long de la chaîne de valeur.
Le périmètre d’intervention est l’ensemble des métiers et fonctions de la Banque Commerciale En France ().



Capacité à communiquer - à l'oral et par écrit
Capacité d'adaptation
Capacité d'organisation
Rigueur
Capacité à collaborer / travail d'équipe
Analyse de données
Connaissances en matière de Data
Mathématiques appliquées et algorithmes
Modèles prédictifs",35 k € - 50 k € (Estimation de l'employeur),,Plus de 10 000 employés,Services bancaires et de prêts,Finance,Plus de 10 milliards de dollars US,3.8,77 %,86 %,4.0,3.5,3.4,3.7,3.3,3.8,,,1093,https://www.glassdoor.fr/Avis/BNP-Paribas-Avis-E10342.htm,https://www.glassdoor.fr/Benefits/BNP-Paribas-Benefits-E10342.htm
"Inetum
3.4",Data Scientist Junior – Energie H/F,Saint-Ouen,France,"Mission
Acteur majeur de la transformation digitale, Inetum Consulting est le cabinet de Conseil en Management du Groupe Inetum, fer de lance de son approche sectorielle. Composé de plus de 200 collaborateurs, nous accompagnons nos clients des secteurs publics et privés dans leurs projets de transformation et de recherche de solutions innovantes à forte valeur ajoutée. Nous intervenons en déclinaison de leurs stratégies opérationnelles.

Intégré(e) dans une équipe projet et sous la supervision d’un responsable d’Inetum Consulting, vous assurez le pilotage et la réalisation de projets de gestion et de valorisation de la donnée dans le domaine de l’Energie.",35 k € - 50 k € (Estimation de l'employeur),,Plus de 10 000 employés,Services d’assistance informatique,Informatique,Entre 1 et 5 milliards de dollars US,3.4,68 %,67 %,2.9,3.2,2.9,3.2,3.1,3.5,,,1093,https://www.glassdoor.fr/Avis/Inetum-Avis-E9028.htm,https://www.glassdoor.fr/Benefits/Inetum-Benefits-E9028.htm
"Groupe Yves Rocher
3.6",Data Scientist,Paris,France,"Réf: 105688

Lieu:
FR - Paris, FR

Type de contrat: CDI / Unlimited Term
Marque: Yves Rocher
Equipe: Direction Customer Experience Transformation
Data Scientist

Voulez-vous faire partie d’une entreprise à mission qui reconnecte les femmes & les hommes à la Nature ?

Prêt(e) à découvrir une nouvelle opportunité au sein du Groupe Rocher ?

Rejoignez la marque Yves Rocher ! De la plante à la peau, nous maîtrisons l’ensemble du cycle de vie de nos produits. Devenir salarié Yves Rocher, c’est faire partie d’un réseau de personnes passionnées et positives, engagées dans la protection de la biodiversité tout en servant avec excellence tous nos consommateurs.

CDI – Data Scientist – Yves Rocher

Le monde change, se transforme et Yves Rocher s’inscrit pleinement dans cette évolution.
Au sein de l’équipe Data for Business, venez écrire une nouvelle page de son histoire !


Vous voulez être un acteur de la data, vous savez tout ce que la data peut apporter et voulez contribuer à la création d’une nouvelle équipe focussée sur le business, c’est pourquoi :

Vous garantissez la qualité de nos data nous permettant une relation parfaite avec nos clientes
Vous êtes le contact privilégié de nos équipes d’analyse commerciale pour la préparation des données, leur permettant des analyses plus fines
Vous assurez la détection des clientes fraudeuses sur nos marchés et communiquez avec les services Clients et Fraude pour mettre en œuvre les plans d’action
Vous alertez les Equipes Centrales de la marque en cas de dysfonctionnement des outils data et vérifier l’adéquation de la solution apportée


Vous avez une bonne connaissance de SQL et Python.
Vous avez une première expérience en Data Science/Data Engineering dans un environnement Big Data
Vous avez une bonne pratique de l’anglais vous permettant d’évoluer dans un contexte international
Vous aimez les responsabilités et voulez être notre référent qualité de la donnée
Vous travaillez avec efficacité avec d’autres services, même non expert, et êtes notre ambassadeur pour améliorer nos process
avec vous, nos problèmes trouvent une solution !

Prêt à faire bouger les lignes avec nous ? N’attendez plus et postulez !

Le Groupe Rocher accueille tous les talents et analyse chaque candidature avec la même attention sans distinction de genre, d’orientation sexuelle, d’âge, de culture, ou de handicap.

Comme pour la Nature, nous sommes convaincus que la diversité est une force pour nos entreprises.

https://groupe-rocher.com/nos-valeurs",35 k € - 50 k € (Estimation de l'employeur),,Plus de 10 000 employés,Magasins d’accessoires personnels et de beauté,Commerce de détail et de gros,Entre 1 et 5 milliards de dollars US,3.6,65 %,74 %,4.1,3.0,3.0,4.1,3.2,3.7,,,1093,https://www.glassdoor.fr/Avis/Groupe-Rocher-Avis-E846136.htm,https://www.glassdoor.fr/Benefits/Groupe-Rocher-Benefits-E846136.htm
"McKinsey & Company
4.4","Data Scientist (full time, all seniority levels) - QuantumBlack",Paris,France,"Who You'll Work With
Based in Paris and working across the region, as a consultant data scientist you will work closely with our clients, data engineers and all types of McKinsey consultants on interdisciplinary projects, using maths, stats and machine learning to derive structure and knowledge from raw data across various industry sectors.
This hybrid client-facing/technical role will allow you to use state of the art technologies to solve highly impactful business problems, whilst also leveraging your strong communication skills to convey complex intractable ideas to non-technical audiences.
Who you are
This full time position is for a data scientist across all seniority levels with strong intrinsic technical ability and an aptitude to solving complex problems using technology.",35 k € - 50 k € (Estimation de l'employeur),,Plus de 10 000 employés,Conseil aux entreprises,Management et conseil aux entreprises,Ne sait pas / non applicable,4.4,91 %,94 %,4.5,4.5,4.4,4.3,4.1,3.0,,,1093,https://www.glassdoor.fr/Avis/McKinsey-and-Company-Avis-E2893.htm,https://www.glassdoor.fr/Benefits/McKinsey-and-Company-Benefits-E2893.htm
"Fnac Darty
3.3",Data Scientist F/H,Ivry,France,"Nous sommes les partenaires de vos cartes cadeaux à Noël, de vos moments de pause lecture en gare, vous avez sûrement déjà acheté une machine à laver dans l'un de nos magasins ou même commandé votre première machine à café sur l’un de nos sites. Aujourd’hui on vos propose de nous rejoindre au sein de la Digital Factory FNAC DARTY.
Nous recherchons un.e Data Scientist pour rejoindre le pôle Data de la Digital Factory. Les missions du pôle Data sont la collecte de données de navigation et de données produits, leur traitement, consolidation et stockage et enfin leur exploitation via des visualisations et des algorithmes de machine learning à forte valeur ajoutée (par exemple le moteur de recherche interne du site fnac.com ou le moteur de recommandation de produits).
Nous recherchons un.e data scientist pour participer à la valorisation des données web du groupe au travers du développement (de la conception à la mise en production) d’algorithmes variés de machine learning : recommandation, classification, prédiction, NLP et prochainement computer vision.",35 k € - 50 k € (Estimation de l'employeur),,Inconnu,,,,3.3,60 %,N/A,4.2,2.9,3.2,3.3,3.5,3.3,,,1093,https://www.glassdoor.fr/Avis/Groupe-Fnac-Darty-Avis-E4867843.htm,https://www.glassdoor.fr/Benefits/Groupe-Fnac-Darty-Benefits-E4867843.htm
"Louis Vuitton
3.5",Data Scientist (F/H),Paris,France,"Poste
Louis Vuitton s’est engagé depuis plusieurs années dans sa transformation digitale avec au cœur de cette transformation, l’innovation digitale.

Aujourd’hui, Louis Vuitton souhaite s’organiser et renforcer ses équipes afin de pouvoir dégager tout le potentiel de valeur de ses données, à l’échelle pour l’ensemble des métiers de l’entreprise, et notamment sur les problématiques en zones (Amériques, Japon, Chine, Europe…).

Il s’agit de transformer les métiers en étant au cœur de l’activité et en collaborant au quotidien avec les équipes, tout en bénéficiant du support, des outils, des méthodes, des capacités d’industrialisation et de l’accompagnement de la Direction Data Science et Intelligence Artificielle de la maison Louis Vuitton.
Le/la candidate sera amené(e) à travailler directement avec les équipes métiers, en se localisant dans les mêmes bureaux lorsque cela est nécessaire.",35 k € - 50 k € (Estimation de l'employeur),,Plus de 10 000 employés,Industrie des biens de consommation,Industrie manufacturière,Plus de 10 milliards de dollars US,3.5,56 %,73 %,4.2,3.1,3.3,3.3,3.0,2.9,,,1093,https://www.glassdoor.fr/Avis/Louis-Vuitton-Avis-E667150.htm,https://www.glassdoor.fr/Benefits/Louis-Vuitton-Benefits-E667150.htm
"Airbus
4.0",Data Scientist H/F,Marignane,France,"Job Description:
Et si VOTRE aventure commençait avec NOUS !
Nous vous proposons de travailler dans une entreprise leader mondial dans son domaine, tournée vers le digital, à la pointe de la recherche et de l’innovation.
Êtes-vous intéressé(e) par la vision stratégique qui contribue à alimenter les hélicoptères Airbus existants et futurs ? Dans la transformation digitale d'Airbus pour nos familles d'hélicoptères ?
Nous recherchons un ""scientifique des données h/f"" très motivé(e), possédant des compétences techniques de base et une expérience en analyse de données et en science des données possédant un fort esprit intrapreneurial.
Airbus Helicopters SAS
Permanent Contract / CDI / Unbefristet / Contrato indefinido
Professional / Expérimenté(e) / Professionell / Profesional
Information Mgmt and Digital Technology <JF-IM-DI>",35 k € - 50 k € (Estimation de l'employeur),,Plus de 10 000 employés,Aérospatiale et Défense,Aérospatiale et défense,Plus de 10 milliards de dollars US,4.0,86 %,89 %,4.4,3.6,3.8,3.8,3.5,4.0,,,1093,https://www.glassdoor.fr/Avis/Airbus-Avis-E3059.htm,https://www.glassdoor.fr/Benefits/Airbus-Benefits-E3059.htm
"Renault Group
3.8",Data Scientist (H/F),Guyancourt,France,"Société
RENAULT s.a.s.
Descriptif du poste
Votre environement
Le Groupe Renault se transforme depuis plusieurs années pour devenir une société technologique, mettant au cœur de sa stratégie les problématiques autour du Digital, de la Data et de l’Intelligence Artificielle. Sur la voie de la transformation digitale depuis 15 ans, la direction de la Qualité est à la pointe de l’innovation au sein du groupe sur les sujets de la Data, des Statistiques et de l’Intelligence Artificielle. Par exemple des techniques avancées se basant sur la théorie de l’analyse de survie ont été développées pour l’étude des défaillances de composants/systèmes et répondre à des besoins en incidentologie. Des techniques très récentes de traitement automatique du langage sont également implémentées et utilisées pour analyser et comprendre les retours clients. De façon plus générale, la direction de la Qualité, par sa nature très transverse avec toutes les directions métiers de l’entreprise, a pour vocation d’être un leader sur la Data Science et l’Intelligence Artificielle.
Vos missions
Qualité",35 k € - 50 k € (Estimation de l'employeur),,Plus de 10 000 employés,Production de machines,Industrie manufacturière,Plus de 10 milliards de dollars US,3.8,74 %,85 %,4.0,3.4,3.3,3.6,3.3,3.5,,,1093,https://www.glassdoor.fr/Avis/Renault-Group-Avis-E3275.htm,https://www.glassdoor.fr/Benefits/Renault-Group-Benefits-E3275.htm
"Peaks
4.2",Data Scientist H/F,Aix,France,"Qui sommes nous? Peaks Méditerranée, partenaire local en conseil et création de solutions numériques innovantes basée à Aix en Provence rayonne dans le sud de la France.
Riche de consultants passionnés dans leurs domaines et par les nouvelles technologies, nous accompagnons nos partenaires dans leurs projets digitaux pour co-réaliser leurs défis.
« Beyond the Codes » n’est pas qu’un jeu de mots, c’est l’essence même de notre société : engagement sociétal, éco-responsabilité, management humaniste et une passion pour relever les challenges du digital de demain.
Nos expertises : Prestation technologique, Conseil en direction de projet & Centre de formation agréé.
La mission :
Comprendre les besoins du projet que vous aurez à mener pour les traduire en termes de problématiques ""Data"" et proposer des solutions opérationnelles avec l’aide du Product Owner.
Identifier et Participer à la collecte les données requises, en conformité avec les règles de sécurité de l'information.",35 k € - 50 k € (Estimation de l'employeur),,De 51 à 200 employés,Services d’assistance informatique,Informatique,Ne sait pas / non applicable,4.2,82 %,80 %,3.3,3.8,3.4,4.1,4.0,4.1,,,1093,https://www.glassdoor.fr/Avis/Peaks-Avis-E1278304.htm,https://www.glassdoor.fr/Benefits/Peaks-Benefits-E1278304.htm
"METRO France
3.8",Data Scientist Junior H/F,Nanterre,France,"Description de l'entreprise

N°1 en France et partenaire omnicanal préféré des restaurateurs et commerçants indépendants, nous sommes 9 000 collaborateurs au service des entrepreneurs du goût !


Ce qui nous tient à cœur ? La qualité de nos produits, la relation de confiance avec les producteurs et le conseil que nous apportons à nos clients professionnels.
Notre volonté : permettre à tous d’ accéder à une alimentation et à une restauration authentiques, saines, savoureuses et créatives.

Rejoignez METRO et venez partager notre passion des terroirs, de la cuisine et de la gastronomie.",35 k € - 50 k € (Estimation de l'employeur),,De 5 001 à 10 000 employés,Grandes surfaces,Commerce de détail et de gros,Entre 1 et 5 milliards de dollars US,3.8,77 %,N/A,4.3,3.8,3.7,3.8,3.4,3.0,,,1093,https://www.glassdoor.fr/Avis/METRO-Avis-E3125471.htm,https://www.glassdoor.fr/Benefits/METRO-Benefits-E3125471.htm
"CBA Informatique Libérale
3.7",Docteur Data Scientist F-H,Avignon,France,"Nous cherchons un.e jeune Docteur R&D issue de formation technique (Informatique, Mathématiques appliquées, Data Science).

Au sein du futur département R&D dont vous aurez la charge, et, en lien permanent avec les équipes opérationnelles de CBA votre rôle de « Jeune docteur » sera d’identifier et utiliser les techniques, technologie et travaux de Recherche les plus récents en matière de Data Science et/ou Intelligence Artificielle.

Grace à votre connaissance de l’état de l’art, vous saisirez les opportunités et mènerez des projets de R&D visant à améliorer l’efficacité opérationnelle via l’exploitation de données complexes (mêlant souvent l’IA, la Data Science, le Big Data)

Nos réalisations tournent autour de thématiques telles que :
Vision 360 : segmentation client, détection de churn, scoring client…

Vous êtes un Jeune docteur spécialisé en Data Science ou Intelligence Artificielle (votre sujet de thèse était dans thématique Data Science/IA)

Vous maîtrisez la programmation informatique permettant de concevoir et d’implémenter les solutions et des plateformes récentes de Machine Learning (Python, R, C, …) ainsi que les techniques d’analyses statistiques, de modélisations prédictives, de Machine Learning, de Deep Learning, de data management.

Vous faîtes preuve d'autonomie, d'organisation et de sens du partage avec un bon esprit de synthèse.

Vous êtes plutôt créatif avec un esprit d’initiative affirmé.",35 k € - 50 k € (Estimation de l'employeur),50,De 51 à 200 employés,,,,3.7,66 %,N/A,,3.6,3.1,4.0,3.1,5.0,,,1093,https://www.glassdoor.fr/Avis/CBA-Informatique-Lib%C3%A9rale-Avis-E2512094.htm,
Lobster communication,Data Scientist / Engineer,Boulogne-Billancourt,France,"Nous recherchons pour notre client un(e) Data Scientist/Engineer (H/F)
Notre client développe une base de données unique de santé de vie réelle (base de données THIN®) pour proposer de nouvelles solutions innovantes de détection et prévention de pathologies basées sur l’Intelligence Artificielle et répondre aux besoins d’études et d’analyses de l'industrie pharmaceutique, des universitaires, des organismes de réglementation, des payeurs, des fournisseurs, des professionnels de la santé et des patients.
Localisation : Boulogne-Billancourt
Missions principales :
Au sein d’une équipe à taille humaine (8 personnes), sous la responsabilité du Technical leader, vous êtes garant(e) de la création de solutions et d’outils développés sur notre base de données THIN®, et participez à l’élaboration de projets de développement d’envergure (indicateur de qualité de base, outils analytiques, projets de datascience notamment).",35 k € - 50 k € (Estimation de l'employeur),55,,,,,,,,,,,,,,,,1093,,
"Boursorama
4.0",Data Scientist - Boursorama-(H/F),Boulogne-Billancourt,France,"Vos missions au quotidien
Rattaché à la Direction Marketing Stratégique, et plus précisément au sein de l’équipe Data Anticipation, vous aurez pour mission de valoriser l’ensemble des données clients et prospects pour en extraire de la connaissance utile à l’optimisation des offres et services de Boursorama.
En tant que Data Scientist, vous menez des analyses quantitatives et proposez des approches innovantes pour construire de nouveaux modèles exploitant au mieux les sources de données et les solutions technologiques issues du Big Data.
Votre rôle est de mettre en œuvre des cas d’usage Data Science de bout en bout : de la définition du besoin métier à la restitution des résultats, en passant par la mise en place des algorithmes de Machine Learning.",35 k € - 50 k € (Estimation de l'employeur),,De 501 à 1 000 employés,Services bancaires et de prêts,Finance,Entre 100 et 500 millions de dollars US,4.0,87 %,93 %,4.4,3.9,3.5,4.0,3.7,3.9,,,1093,https://www.glassdoor.fr/Avis/Boursorama-Avis-E12221.htm,https://www.glassdoor.fr/Benefits/Boursorama-Benefits-E12221.htm
"Groupe Yves Rocher
3.6",Data Scientist H/F - GROUPE ROCHER,Issy-les-Moulineaux,France,"Réf: 105898

Lieu:
FR - Issy-les-Moulineaux, FR

Type de contrat: CDI / Unlimited Term
Marque: Groupe Rocher
Equipe: RH et Communication
Data Scientist H/F - GROUPE ROCHER

Voulez-vous faire partie d’une entreprise à mission qui reconnecte les femmes & les hommes à la Nature ? Prêt(e) à découvrir une nouvelle opportunité au sein du Groupe Rocher ?

Le Groupe Rocher est un groupe familial français d’origine bretonne présent dans plus de 114 pays et qui compte aujourd’hui 9 marques (Yves Rocher, Arbonne, Petit Bateau, Stanhome, Kiotis, Dr Pierre Ricaud, ID Parfums, Sabon et Flormar), plus de 16 000 collaborateurs, 50 millions de clientes et plus de 2,5 milliards d’euros de chiffre d’affaires.

Dans le cadre de sa transformation digitale, le Groupe Rocher cherche à renforcer ses équipes au sein de ses différentes marques.

La Data fait partie de l'ADN du Groupe Rocher qui a, en particulier, été pionnier dans son application au CRM. De la Data Science au Data Engineering nos équipes Data exploitent tout notre capital de données pour améliorer la performance de nos différentes équipes business.

Par exemple, les équipes Data construisent en collaboration avec les équipes marketing CRM, une expérience client toujours plus personnalisée, en se basant sur les données de nos clientes et leur comportement d’achat.

Nos business models omnicanaux (retail, e-commerce, social selling…), et la transformation digitale que nous menons sont autant de défis pour nos équipes Data pour qui les enjeux sont de plus en plus importants.


Data Visualisation, Data Science, Data Engineering, Data Quality, Product Manager, les postes sont nombreux au sein de nos différentes marques. Ils vous permettront d’apprendre au sein d'une communauté dynamique et de diversifier votre parcours.


Première expérience en Data Science/Data Engineering
Niveau d'anglais courant

Passionné(e) par les chiffres, à l’affût des innovations, vous avez à cœur de créer un impact positif sur les autres métiers du groupe et de faire progresser nos marques.

Vous voulez être un acteur de la data, vous savez tout ce que la data peut apporter et voulez contribuer à la transformation du Groupe, alors n'attendez plus, postulez!

Le Groupe Rocher accueille tous les talents et analyse chaque candidature avec la même attention sans distinction de genre, d’orientation sexuelle, d’âge, de culture, ou de handicap.

Comme pour la Nature, nous sommes convaincus que la diversité est une force pour nos entreprises.

https://groupe-rocher.com/nos-valeurs",35 k € - 50 k € (Estimation de l'employeur),,Plus de 10 000 employés,Magasins d’accessoires personnels et de beauté,Commerce de détail et de gros,Entre 1 et 5 milliards de dollars US,3.6,65 %,74 %,4.1,3.0,3.0,4.1,3.2,3.7,,,1093,https://www.glassdoor.fr/Avis/Groupe-Rocher-Avis-E846136.htm,https://www.glassdoor.fr/Benefits/Groupe-Rocher-Benefits-E846136.htm
