Company Name,Job Title,Location,Country,Job Description,Salary Estimate,Avg Salary,Size,Industry,Sector,Revenue,Rating,Recommend,CEO,Benefits,Opportunities,Comp Benefits,Culture,Management,WorkLife Balance,Pros,Cons,Num Listings,Reviews URL,Benefits URL
ROCKEN,Professional Data Scientist (m/w/d),Bern,Schweiz (German),"Dein zukünftiger Arbeitgeber und die ROCKEN sind enge Partner. In der Zusammenarbeit agieren wir sehr dynamisch, flexibel und optimal aufeinander eingestimmt. Aufgrund des hohen Vertrauens werden wir in jegliche Prozesse rund um die Rekrutierung und Wachstum einbezogen.
Der ROCKEN Partner berät seit über 25 Jahren seine Kunden in Innovation und Technologie. Für seine Kunden die unternehmerische Leistungsfähigkeit und damit den Weg ins digitale Morgen zu ebnen ist das grosse Ziel von unserem ROCKEN Partner. Ein fortgeschrittenes, dynamisches und offenes Mindset ist der Schlüssel zum Erfolg unseres Partners in einem globalen Markt. Unser Partner will, dass seine Kunden effektiver und innovativer sind. Gemeinsam werden hochgesteckte Ziele erreicht, weil unser ROCKEN Partner auch mit seinen Kunden auf partnerschaftliche Zusammenarbeit setzt. Unser ROCKEN Partner gestaltet Prozesse so einfach und smart wie möglich - international mit über 800 Mitarbeitenden.
Lebe deine Leidenschaft, werde Teil des Teams!





2 - 5 years",,,1 bis 50 Mitarbeiter,Unbekannt/Nicht zutreffend,,,,,,,,,,,,,,225,,
"Hays
3.7",(Senior) Medical Affairs Scientist- Inflammation & Immunology (m/w/d),Zürich,Schweiz (German),"Meine Aufgaben
Kommunikation von Medizinern zu Medizinern in diesem Bereich führen
Wissenschaftlicher Experte für Vertreter des Gesundheitswesens, medizinische Fachgesellschaften, Hochschulen usw.
Medizinisches Stakeholder-Management
Proaktive Kontaktaufnahme und Projektinitiierung/Zusammenarbeit
Planung und Durchführung medizinisch-wissenschaftlicher strategischer Pläne entsprechend der jeweiligen Spezialisierungsrolle
Abstimmung, Zusammenarbeit und Beiträge für verschiedene Interessengruppen
Bereitstellung von strategischem medizinischem Input für die Geschäftsbereiche und Beitrag zu den Plänen des Unternehmens durch umsetzbare medizinische Erkenntnisse der Kunden",,,5''001 bis 10''000 Mitarbeiter,Personalberatung,Personalwesen,1 bis 5 Milliarden $ (USD),3.7,72 %,84 %,2.8,3.8,3.3,3.7,3.5,3.4,,,225,https://de.glassdoor.ch/Bewertungen/Hays-Bewertungen-E10166.htm,https://de.glassdoor.ch/Benefits/Hays-Benefits-E10166.htm
"Roche
4.3","Drug Transport & DDI Scientist, ADME Chapter, PS, pRED",Basel,Schweiz (German),"The Position
In Roche’s Pharmaceutical Research and Early Development organisation (pRED), we make transformative medicines for patients in order to tackle some of the world’s toughest unmet healthcare needs. At pRED, we are united by our mission to transform science into medicines. Together, we create a culture defined by curiosity, responsibility and humility, where our talented people are empowered and inspired to bring forward extraordinary life-changing innovation at speed.
This position is located in ADME, a chapter within global Pharmaceutical Sciences, where the fate of new chemical entities and biologics is a primary focus. The ADME Chapter works throughout all stages of compound development, from lead optimization to candidate selection, all clinical development phases to the filing of new drug applications. We closely collaborate with our therapeutic areas and functions to convert hypotheses into innovative therapeutics.
Job mission",,,Mehr als 10''000 Mitarbeiter,Biotechnologie & Arzneimittel,Pharmazeutika & Biotechnologie,Mehr als 10 Milliarden $ (USD),4.3,88 %,96 %,4.4,3.9,4.1,4.2,3.7,4.1,,,225,https://de.glassdoor.ch/Bewertungen/Roche-Bewertungen-E3480.htm,https://de.glassdoor.ch/Benefits/Roche-Benefits-E3480.htm
"Idorsia Pharmaceuticals Ltd.
3.6",Scientist - Computer-aided Drug Design (CADD),Basel,Schweiz (German),"About Idorsia Pharmaceuticals Ltd

Idorsia Ltd is reaching out for more - We have more ideas, we see more opportunities and we want to help more patients.
In order to achieve this, we want to develop Idorsia into one of Europe’s leading biopharmaceutical companies, with a strong scientific core.
Headquartered in Switzerland - a European biotech hub - Idorsia is specialized in the discovery and development of small molecules, to transform the horizon of therapeutic options. Idorsia has a broad portfolio of innovative drugs in the pipeline, an experienced team, a fully-functional research center, and a strong balance sheet – the ideal constellation to bringing R&D efforts to business success.
Idorsia was listed on the SIX Swiss Exchange (ticker symbol: IDIA) in June 2017 and has over 1,200 highly qualified specialists dedicated to realizing our ambitious targets.


- Structure- and ligand-based drug design",,,501 bis 1''000 Mitarbeiter,Biotechnologie & Arzneimittel,Pharmazeutika & Biotechnologie,Unbekannt/Nicht zutreffend,3.5,63 %,99 %,3.6,2.5,3.0,3.5,3.4,3.0,,,225,https://de.glassdoor.ch/Bewertungen/Idorsia-Pharmaceuticals-Bewertungen-E1806477.htm,https://de.glassdoor.ch/Benefits/Idorsia-Pharmaceuticals-Benefits-E1806477.htm
"Hays
3.7",Teamlead Data Analytics (m/f/d),Zürich,Schweiz (German),"My duties
You lead a team of 7 people consisting of data engineers, data scientists and data analysts
You work within a hybrid Scrum framework where you take the project lead on the technical, organizational and stakeholder-management level
Given your long-term experience in Data (as an engineer or scientist), you set the strategy for (Big) Data Analytics technology
Besides strategically leading the team of experts, you assist with solving technical issues when the need arises
You collaborate with other IT departments to ensure operational consistency
You interact with different business departments and provide them with meaningful data for major decision making",,,5''001 bis 10''000 Mitarbeiter,Personalberatung,Personalwesen,1 bis 5 Milliarden $ (USD),3.7,72 %,84 %,2.8,3.8,3.3,3.7,3.5,3.4,,,225,https://de.glassdoor.ch/Bewertungen/Hays-Bewertungen-E10166.htm,https://de.glassdoor.ch/Benefits/Hays-Benefits-E10166.htm
"Universal-Job
5.0",Clinical Trial Specialist (m/f/d),Basel,Schweiz (German),"In this position, you are responsible for the management and clinical execution of assigned clinical trials within Translational Medicine (TM). Your accountabilities include: - Function as Clinical Trial Leader for assigned studies (scientific and/or operational complexity) including multi-country / multi-center trials - Responsible for leading and matrix managing the multidisciplinary CTT and support functions as assigned to ensure all trial deliverables are met according to timelines, budget, quality standards and operational best practices - In collaboration with the Medical Expert and CTT, coordinate the ongoing medical / scientific review of the clinical trial data (as needed), and coordinate the data analysis and interpretation
Motivation
Are you looking to work in a global growth company where you can make a real difference? Then you are right with us!
Firmenprofil
Global Pharma Company.",,,51 bis 200 Mitarbeiter,Personalberatung,Personalwesen,100 bis 500 Millionen $ (USD),5.0,100 %,N/A,,4.0,5.0,5.0,5.0,4.0,,,225,,
"Unit8 SA
4.6",Young Graduate Programme in Data and Software Engineering (Lausanne),Lausanne,Schweiz (German),"Unit8 is welcoming Young Graduates for our tailor-made programme in Data and Software Engineering! Join us for a 5-6 month first paid professional experience in building industrial Data and AI solutions. This programme is perfect for:

translating your data science education into an industry ready full stack data scientist/machine learning engineer skill set
making those with computer science/software engineering backgrounds fluent in the modern data science and engineering tech stack to work closely with data scientists
The programme is starting in early January - first week of February 2023, with direct exposure to clients and opportunities to take part in learning activities such as reading groups and knowledge-sharing sessions. In addition, all young graduates will be accompanied by a mentor who will guide and help them in building their technical growth vision.",,,51 bis 200 Mitarbeiter,Unternehmensberatung,Management & Beratung,Unbekannt/Nicht zutreffend,4.6,100 %,N/A,4.0,4.8,4.1,4.9,4.7,4.8,,,225,https://de.glassdoor.ch/Bewertungen/Unit8-Bewertungen-E2908131.htm,https://de.glassdoor.ch/Benefits/Unit8-Benefits-E2908131.htm
"GITR
3.3",(Junior / Senior) Data Scientist,Zürich,Schweiz (German),"INTRODUCTION:
For our client who is located in the German part of Switzerland, we are looking for an individual as
(Junior / Senior) Data Scientist
The start date is as soon as possible.

ASSIGNMENT DESCRIPTION:
In-depth analyses of topics covering all aspects of business.
Examples range from new customer acquisition and initiatives to reduce customer churn to product experience and strategy.
Accountability for the end-to-end analytical process; from data cleaning and manipulation through design of appropriate analysis and carrying it out, to preparation and ultimate delivery of findings and recommendations to the end client.",,,Unbekannt,Personalwesen,Unbekannt/Nicht zutreffend,,3.3,N/A,N/A,,2.0,1.0,2.0,2.0,2.0,,,225,,
"GITR
3.3",Digital Biomarker Machine Learning Scientist,Basel,Schweiz (German),"EINFÜHRUNG:
As a preferred supplier for Roche Basel, we are looking for an individual as
Digital Biomarker Machine Learning Scientist
(contract for 12 months, with possible extension). The earliest start date is within 3 months.

AUFGABENBESCHREIBUNG:
Build research-grade deep learning models for human activity recognition, anomalous behavior detection and clinical outcome prediction, to apply to highly complex sensor data from smartphones, wearables and other devices in clinical studies.
Identify relevant recent advances in statistical and/or machine learning methods for longitudinal, high dimensional and sensor data, and adapt them for our analysis needs.",,,Unbekannt,Personalwesen,Unbekannt/Nicht zutreffend,,3.3,N/A,N/A,,2.0,1.0,2.0,2.0,2.0,,,225,,
"Paul Scherrer Institut
4.2",PSI-FELLOW-III-3i / Postdoctoral Fellows (f/m/d),Villigen,Schweiz (German),"The Paul Scherrer Institute PSI is the largest research institute for natural and engineering sciences within Switzerland. We perform cutting-edge research in the fields of matter and materials, energy and environment and human health. By performing fundamental and applied research, we work on sustainable solutions for major challenges facing society, science and economy. PSI is committed to the training of future generations. Therefore, about one quarter of our staff are post-docs, post-graduates or apprentices.

Altogether, PSI employs 2200 people. In the framework of the international fellowship program with the acronym: “PSI-FELLOW-III-3i”, the PSI is inviting experienced researchers (f/m/d) (Postdocs) from all over the world to submit their applications for research positions that are part of our new postdoctoral program. Our “3i or triple i” postdoctoral program offers unique opportunities for scientific and career development with international, interdisciplinary and inter-sectoral prospects. Our third (since 2012) postdoctoral program is a Horizon2020 Marie Skłodowska-Curie COFUND Action (grant agreement 884104).

Within the framework of our latest PSI-FELLOW-III-3i Program, we are looking for",,,1''001 bis 5''000 Mitarbeiter,Forschung & Entwicklung,Management & Beratung,25 bis 100 Millionen $ (USD),4.2,88 %,91 %,4.4,3.9,3.9,4.1,3.8,3.8,,,225,https://de.glassdoor.ch/Bewertungen/Paul-Scherrer-Institut-Bewertungen-E341747.htm,https://de.glassdoor.ch/Benefits/Paul-Scherrer-Institut-Benefits-E341747.htm
ROCKEN,Data Scientist (m/w/d),Zürich,Schweiz (German),"ROCKEN® ist in der digitalen Rekrutierung von Talenten und Experten in der Informatik spezialisiert und zählt etablierte Unternehmungen zu den Partnern.
Diese Partner bieten spannende Tätigkeiten in vielfältigen Branchen.
Profitiere als Bewerber von unserer breiten Vernetzung und lass dir unverbindlich eine Marktübersicht der spannendsten Herausforderungen bieten.
Wir behandeln Deine Bewerbung respektvoll, um Vertraulichkeit, Privatsphäre und Datenschutz zu wahren.
Deine Rolle
Dein zukünftiger Arbeitgeber und die ROCKEN sind enge Partner. In der Zusammenarbeit agieren wir sehr dynamisch, flexibel und optimal aufeinander eingestimmt. Aufgrund des hohen Vertrauens werden wir in jegliche Prozesse rund um die Rekrutierung und Wachstum einbezogen.





2 - 5 years",,,1 bis 50 Mitarbeiter,Unbekannt/Nicht zutreffend,,,,,,,,,,,,,,225,,
"Reishauer
4.3",Azure IoT Software Engineer 80 – 100% (f/m/d),Wallisellen,Schweiz (German),"Our new ""Digital"" team within Reishauer AG has the task of implementing innovative and digital services around the Reishauer gear grinding machine tools. By networking the machines using current IoT technologies, utilizing existing data and assets, and Azure Cloud Services, we are developing solutions to make the work processes of our best-in-class machines more efficient and user-friendly. But that's not all: by combining sensor technology and data analysis on the machines and in the cloud, we alert our customers to problems at an early stage and help them achieve better results.
To this end, we are looking for further reinforcement! Given the small team size, we are looking for a team member who enjoys taking on different roles as
Azure IoT Software Engineer 80 – 100% (f/m/d)
Your responsibilities include:
Develop new applications or modules of all system elements (machine tools, edge devices, web applications, Azure Cloud Services), mainly in a Microsoft environment.",,,Unbekannt,100 bis 500 Millionen $ (USD),,,4.3,100 %,N/A,,3.0,4.0,4.5,4.0,3.5,,,225,,
"CTC Resourcing Solutions
2.9",Clinical Project Scientist (4849),Basel,Schweiz (German),"The Life Science Career Network
CTC are specialised industry experts who can help companies source the best talent and provide reliable HR and consulting services, support varied candidates in finding promising career opportunities and offer the latest in skill development training programmes.
Clinical Project Scientist
Our client, an innovative and dynamic bio-pharmaceutical company headquartered in Switzerland, covering multiple therapeutic areas, is looking a Clinical Project Scientist for permanent role based in Basel, Switzerland.
Responsibilities:
Provide scientific input into relevant documents such as the Clinical Development Plans, Communication Plans, Investigators Brochures, clinical overviews and summaries, etc.;",,,Unbekannt,Personalberatung,Personalwesen,Unbekannt/Nicht zutreffend,2.9,76 %,100 %,,2.2,4.0,3.2,2.9,4.4,,,225,https://de.glassdoor.ch/Bewertungen/CTC-Clinical-Trial-Consulting-Bewertungen-E638886.htm,
"Proclinical
4.1",(Senior) Scientist Analytical Development,Basel,Schweiz (German),"Proclinical are recruiting a (Senior) Scientist Analytical Development for a biotech establishment. This role is on a permanent basis and is located in Switzerland. The client is focused on developing a new class of cell therapy to treat cancer.
Responsibilities:
Evolve analytical strategies for engineered T Cells and starting resources.
Implement multiple analytical strategies, which involves cell-based assays, flow cytometry, d/qPCR and ELISAS.
To meet deadlines, you will offer training to junior personnel, as well as organise and prioritise workload.
You will analyse data, make figures to display, and present at group as well as at company meetings.",,,51 bis 200 Mitarbeiter,Personalberatung,Personalwesen,Unbekannt/Nicht zutreffend,4.1,83 %,89 %,,4.1,3.9,4.1,4.0,3.8,,,225,https://de.glassdoor.ch/Bewertungen/Proclinical-Bewertungen-E995374.htm,
"Universität Basel
4.0",Scientist or Postdoctoral Scientist in malaria modelling with a focus on vector control,Basel,Schweiz (German),"The Swiss Tropical and Public Health Institute (Swiss TPH) is a world-leading institute in global health with a particular focus on low- and middle-income countries. Associated with the University of Basel, Swiss TPH com-bines research, education and services at local, national and international levels. 900 people from 80 nations work at Swiss TPH focusing on infectious and non-communicable diseases, environment, society and health as well as health systems and interventions.

The Department of Epidemiology and Public Health (EPH), within the Swiss Tropical and Public Health Institute, develops and applies epidemiological, statistical and mathematical methods to advance innovation, validation, and application in the field of public health. Within the Disease Modelling Unit of EPH we are looking for a: Senior Scientist or Postdoctoral Scientist in malaria modelling with a focus on vector control (80-100%) for an exciting opportunity to develop and implement disease and vector biology models to support decision making in health.

There are many open questions concerning the assessment of new and current vector control interventions for the control and elimination of malaria that can only be answered through quantitative analysis, disease modelling and simulation.

The successful candidate will join, and collaborate with a multidisciplinary team within Swiss TPH and external partners, to provide evidence to global decision-makers, funders and product developers. The project is funded the Bill & Melinda Gates Foundation.",,,Unbekannt,,,,4.0,86 %,N/A,3.5,3.3,3.1,3.6,3.0,3.3,,,225,https://de.glassdoor.ch/Bewertungen/Universit%C3%A4t-Basel-Bewertungen-E3216289.htm,https://de.glassdoor.ch/Benefits/Universit%C3%A4t-Basel-Benefits-E3216289.htm
"wega Informatik
5.0",Lab Automation Consultant,Basel,Schweiz (German),"We are a Pharma and Life Science IT service provider that has been successfully carrying out 'state-of-the-art' projects for international customers for more than 28 years, now. Our consultants work in
our office in Basel
from home
on our customer’s premises
We are a dynamic forward-thinking and expanding organization with a great team spirit and always on the look out for like-minded individuals. If you are driven by ambition and highly motivated by challenging jobs, as well as financial incentives, you have come to the right place.
With our attractive compensation and fringe benefits model, this is a great opportunity to maximize your earning potential. The further development of our colleagues and team members coupled with an excellent work atmosphere are amongst the top values of our company.",,,Unbekannt,,,,5.0,100 %,N/A,4.0,4.0,4.0,5.0,4.0,5.0,,,225,https://de.glassdoor.ch/Bewertungen/wega-Informatik-Bewertungen-E2860697.htm,https://de.glassdoor.ch/Benefits/wega-Informatik-Benefits-E2860697.htm
"Global Kader Personal
3.3","(Senior) Scientist, Computational Biology – NGS",Basel,Schweiz (German),"INTRODUCTION:
For our client an applied gene editing, cellular, and immunotherapy company located in Basel, we are looking for an individual as
(Senior) Scientist, Computational Biology – NGS
(Permanent employment, fulltime). The earliest start date is as soon as possible.

ASSIGNMENT DESCRIPTION:
Define and develop Next Generation Sequencing (NGS) analysis pipelines for quantifying CRISPR based on-target and off-target events as well as algorithms for computational prediction of guide RNA specificity and efficiency
Routinely, analyze and interpret NGS sequencing data to determine gene editing efficiencies and off-target events",,,Unbekannt,Personalwesen,Unbekannt/Nicht zutreffend,,3.3,N/A,N/A,,2.0,1.0,2.0,2.0,2.0,,,225,,
"Roche
4.3",PhD internship -Developing assessments of fine motor skill in rodent models for neurodevelopmental disorders - RiSE (m/f/d),Basel,Schweiz (German),"The Position
Title: Developing assessments of fine motor skill in rodent models for neurodevelopmental disorders
PhD Internship / RiSE - (Neuroscience Research) (9 months)
Who we are
At Roche, 98.000 people across 150 countries are pushing back the frontiers of healthcare. Working together, we`ve become one of the world`s leading research focused healthcare groups. Our success is built on innovation, curiosity and diversity, and on seeing each other`s differences as an advantage. To innovate healthcare, Roche has ambitious plans to keep learning and growing – and is seeking people who have the same goals for themselves.
At Roche, we believe it’s urgent to deliver medical solutions right now – even as we develop innovations for the future. We are passionate about transforming patients’ lives and we are fearless in both decision and action. And we believe that good business means a better world.",,,Mehr als 10''000 Mitarbeiter,Biotechnologie & Arzneimittel,Pharmazeutika & Biotechnologie,Mehr als 10 Milliarden $ (USD),4.3,88 %,96 %,4.4,3.9,4.1,4.2,3.7,4.1,,,225,https://de.glassdoor.ch/Bewertungen/Roche-Bewertungen-E3480.htm,https://de.glassdoor.ch/Benefits/Roche-Benefits-E3480.htm
"Global Kader Personal
3.3",Clinical Scientist,Schweiz,Schweiz (German),"EINFÜHRUNG:
As a preferred supplier for Roche Diagnostics Int Ltd in Rotkreuz, we are looking for an individual as
Clinical Scientist
(contract until 31.07.2023, with possible extension). The earliest start date is within one month. Homeoffice will be possible.

AUFGABENBESCHREIBUNG:
The incumbent works proactively with CPS and global functions to analyze products of the CPS portfolio with regards to clinical evidence requirements according to the IVD-Regulations across all indication areas, and develops strategies to fill eventual evidence gaps.
Work with Regulatory, Clinical Operations, Lifecycle teams, and R&D to generate Scientific Validity Assessments, Clinical Performance reports, and support the development of product requirements and specifications according to the IVD-Regulations (in vitro diagnostics).",,,Unbekannt,Personalwesen,Unbekannt/Nicht zutreffend,,3.3,N/A,N/A,,2.0,1.0,2.0,2.0,2.0,,,225,,
"Manpower
4.1",Clinical Scientist (m/w/d) in Rotkreuz,Schweiz,Schweiz (German),"MANPOWER AG specializes in temporary and permanent positions and offers comprehensive personnel services. With locations throughout Switzerland, we support our customers in order to successfully implement their orders and projects. For our customer in the region we are looking for a
Your mission
Tasks & Responsibilities
The incumbent works proactively with CPS and global functions to analyze products of the CPS portfolio with regards to clinical evidence requirements according to the IVD-Regulations across all indication areas, and develops strategies to fill eventual evidence gaps.
Work with Regulatory, Clinical Operations, Lifecycle teams, and R&D to generate Scientific Validity Assessments, Clinical Performance reports, and support the development of product requirements and specifications according to the IVD-Regulations (in vitro diagnostics).",,,Mehr als 10''000 Mitarbeiter,Personalberatung,Personalwesen,Mehr als 10 Milliarden $ (USD),4.1,83 %,86 %,3.2,3.9,3.7,4.0,3.8,4.0,,,225,,https://de.glassdoor.ch/Benefits/Manpower-Benefits-E2548.htm
"Universal-Job
5.0",Data Scientist machine learning / big data 80-100%,Zürich,Schweiz (German),"In Ihr Kerngeschäft gehört die Erarbeitung von Lösungen für komplexe Probleme. Sie testen, implementieren und erklären die erarbeiteten Lösungen und übersetzen die Geschäftsbedürfnisse in Projektziele. In diesem Zusammenhang steuern Sie die verschiedenen Phasen von Data Science Projekten end-to-end. Auch der Bau von produktionsreifen advanced analytics / machine learning Modellen in R oder Python, sowie die Integration in Geschäfts-Applikationen via APIs gehören zu Ihren Aufgaben. Das Entwickeln von Ansätzen zur Prognose von Messgrössen und Unterstützung von Entscheidungen, die für das Business wichtig sind macht Ihnen Spass. Abrundend sind Sie zuständig für das Zusammentragen und qualifizieren aussagekräftiger interner und externer Daten.
Motivation
Sie dürfen sich auf moderne Anstellungsbedingungen und sehr gute Sozialleistungen freuen! Ausserdem erwartet Sie hier ein tolles Team, Entwicklungsmöglichkeiten und eine gute Work-Life Balance. Die Möglichkeit auch Remote zu arbeiten gehört ebenfalls zu diesem Angebot. Hier haben Sie die Chance eine verantwortungsvolle Tätigkeit in einem dynamischen Arbeitsumfeld zu übernehmen!",,,51 bis 200 Mitarbeiter,Personalberatung,Personalwesen,100 bis 500 Millionen $ (USD),5.0,100 %,N/A,,4.0,5.0,5.0,5.0,4.0,,,225,,
Zerofy,Data Scientist / Researcher,Heimarbeit,Schweiz (German),"We are looking for a Data Scientist / Researcher to lead our analytics, data, and research efforts as part of our small and powerful remote-first team.

Zerofy is an early-stage startup with a big mission. We just shipped our first product and completed our first funding round. We are an experienced founding team with significant expertise both in technology and renewable energy with companies such as Apple, Meta, ABB etc. You’ll be joining the founders and a small technical team. If you are looking to join an impactful consumer product company early on, this is for you!

What you’ll do:
You’ll cover a pretty broad range of data-science related topics from researching up to implementing:",,,,,,,,,,,,,,,,,,225,,
