Company Name,Job Title,Location,Country,Job Description,Salary Estimate,Avg Salary,Size,Industry,Sector,Revenue,Rating,Recommend,CEO,Benefits,Opportunities,Comp Benefits,Culture,Management,WorkLife Balance,Pros,Cons,Num Listings,Reviews URL,Benefits URL
"Varian Medical Systems
4.0",Instructor Clinical Apps,Jundiaí,Brasil,"Together, we can beat cancer.
At Varian, a Siemens Healthineers Company, we bring together the world's best talent to realize our vision of a world without fear of cancer. Together, we work passionately to develop and deliver easy-to-use, efficient oncology solutions.
We are part of an incredible community of scientists, clinicians, developers, researchers, professionals, and skilled specialists pushing the boundaries of what’s possible, to improve people’s lives around the world. We embrace a culture of inclusivity in which the power and potential of every individual can be unleashed. We spark ideas that lead to positive impact and continued success.
If you want to be part of this important mission, we want to hear from you.
Educate new users on proprietary healthcare oncology software and hardware system products. Assist Varian and its customers in fully utilizing the complex functionality of the technology to meet their business needs. Conduct product training for customers and employees, in particular training for complex situations involving multiple products. Lead classroom lectures and laboratory sessions to ensure customers are trained to operate Varian equipment according to safety guidelines with the highest level of satisfaction. Prepare lesson plans based on standards and content documentation, engineering documentation, field service requirements, and software documentation to address customers’ specific implementation questions. Provide feedback to standards and content based on feedback from customers as well as the sales, product marketing, and technical support departments to ensure course material reflects current product features, and address customer inquiries including testing scenarios using Varian products. Work directly with Radiation Therapists, Dosimetrists, Physicist and Engineers in the training environment. Applicable to the Oncology Systems business only: Position must have full access to VMS client sites to perform the essential functions of this position. Many VMS clients require VMS employees and representatives to meet certain “Vendor Credentialing” requirements before they will be allowed to have access to their sites. Unless prohibited by law, position must meet all Vendor Credentialing requirements necessary to have full client access, and must continue to meet those requirements during the course of VMS employment in this position.

Minimum Required Skills and Knowledge: Clinical Radiation experience essential. Commissioning Linear accelerators Commissioning Radiotherapy treatment planning systems Calibration and quality assurance of imaging systems and for Linear accelerators and Halcyon experience. Experience in IGRT, IMRT, VMAT, SBRT, HDR, brachytherapy Treatment planning execution and oversight Excellent presentation and customer service skills. Ability to communicate effectively with various levels of users. Must have strong troubleshooting, analytic, and problem-solving skills. Works effectively in teams. Self-directed. Demonstrates ability and work under pressure situations. Must be able to multitask, be organized. Other Desired Skills and Knowledge: Formal teaching experience preferred. Required Certifications and Training: Must have a Masters’ degree in Medical Physics or international equivalent Obtains and completes LMS training plan specific to assigned responsibility. Applicable to the Oncology Systems business only: Meets all Vendor Credentialing requirements necessary to gain VMS client site access, unless prohibited by law. These requirements vary by client and may include, but are not limited to: Proof of valid identification (photo, driver’s license, SSN) Criminal background checks Drug screens Immunizations (Hep B, MMR, Varicella, Influenza, Tetanus) Annual TB testing Healthcare trainings Experience Level with Business Tools: Proficient in utilizing business tools such as: E-mail, Microsoft Word, Excel, and PowerPoint. Experience with HCM (e.g., Workday) or equivalent ERP product and productivity software desired. Knowledge Mastered 50-75% of products within the defined professional scope. A seasoned, experienced professional with a full understanding of area of specialization; resolves a wide range of issues in creative ways. Experienced product knowledge to support cross functional teams (i.e. trade shows, sales support, marketing, testing) Job Complexity: Works on problems of diverse scope where analysis of data requires evaluation of identifiable factors. Exercises independent judgment and discretion in solving complex business problems. Interaction: Networks with senior internal and external personnel in own area of expertise. Supervision: Normally receives little or no instruction on day to day work; general instructions on new assignments. Typical Education and Experience: Minimum of Master’s Degree in Medical Physics or related field. 5-8 years of clinical work experience or in a clinical applications related occupation. ABR certified a plus. Minimum 3 years as Instructor Clncl Apps Enrollment in Varian approved Development Program",R$ 6 mil - R$ 17 mil (estimativa da empresa),,De 5.001 a 10.000 funcionários,Biotecnologia e farmacêutica,Farmacêutica e biotecnologia,De US$ 1 a US$ 5 bilhões,4.0,82 %,,5.0,3.6,3.8,4.0,3.6,3.9,,,73,https://www.glassdoor.com.br/Avalia%C3%A7%C3%B5es/Varian-Medical-Systems-Avalia%C3%A7%C3%B5es-E9111.htm,https://www.glassdoor.com.br/Benefits/Varian-Medical-Systems-Benefits-E9111.htm
"LexisNexis
3.9",Senior Software Engineer,São Paulo,Brasil,"Senior Software Engineer

At LexisNexis we develop the legal profession’s most innovative products for data analysis, visualization, and research. We use the latest techniques in machine learning, knowledge modeling, and data visualization to uncover insights about judges’ rulings, build forecasts of likely outcomes, and reveal critical connections in massive datasets spanning the law, news, and finance.
As a senior software engineer on our team, you will work on new product development in a small team environment writing production code in both run-time and build-time environments. You will help propose and build data-driven solutions for high-value customer problems by discovering, extracting, and modeling knowledge from large-scale natural language datasets. You will prototype new ideas, collaborating with other data scientists as well as product designers, data engineers, front-end developers, and a team of expert legal data annotators. You will get the experience of working in a start-up culture with the large datasets and many other resources of an established company.
RESPONSIBILITIES",R$ 6 mil - R$ 17 mil (estimativa da empresa),,Mais de 10.000 funcionários,Consultoria empresarial,Gerenciamento e consultoria,De US$ 1 a US$ 5 bilhões,3.9,79 %,,,3.7,3.6,4.1,3.7,4.2,,,73,https://www.glassdoor.com.br/Avalia%C3%A7%C3%B5es/LexisNexis-Legal-and-Professional-Avalia%C3%A7%C3%B5es-E4146.htm,
"Samsung Electronics
3.6",AI Senior SW Developer,Campinas,Brasil,"Position Summary
At SRBR AI R&D Lab, system reliability and customer experience are essential to guarantee the continuous development of our applied R&D projects and generate innovative services and solutions to impact positively user life worldwide. We are looking for a developer to help us to build a functional and reliable Data-driven system, to help our researchers, data scientists and engineers generate meaningful insights and solutions in the AI R&D Lab.
As an AI Developer you will be responsible for developing, deploying and automating all involved process, identifying and solving technical problems to meet our mission.
Also, as part of your role, you will design and implement software-based solutions to store, organize and from incoming data and provide solutions to manipulate and extract insights from data. All in the context of SRBR AI R&D Lab projects.
Role and Responsibilities
Main responsibilities:",R$ 6 mil - R$ 17 mil (estimativa da empresa),,De 1.001 a 5.000 funcionários,Desenvolvimento de hardware,Tecnologia da informação,Mais de US$ 10 bilhões,3.6,59 %,,3.8,3.3,3.8,3.1,3.0,2.9,,,73,https://www.glassdoor.com.br/Avalia%C3%A7%C3%B5es/Samsung-Electronics-America-Avalia%C3%A7%C3%B5es-E4206.htm,https://www.glassdoor.com.br/Benefits/Samsung-Electronics-America-Benefits-E4206.htm
"Cognite AS
3.9",Implementation Project Manager,São Paulo,Brasil,"At Cognite, the Customer Success team is responsible for engagement management, software implementation and growth of Cognite's impact within our customers' digital transformation efforts. We consist of people with diverse and high-performance backgrounds, ranging from Management Consulting, to Industry and Software development. We seek to continuously improve how we work with our clients, how we work together as a team, and how we develop as individuals.

The Implementation Project Manager is responsible for the on time, on budget delivery of projects for our customers post sale. You create the ultimate cohesive unit for our project teams and the customers you represent. You are responsible for setting expectations and creating and executing both long term and short term plans that will meet your customer’s goals and accelerate Cognite’s footprint in your customers’ technology landscape. You will connect with key stakeholders, assign tasks, address blockers, manage risks and report progress to leadership clearly and concisely.

You will also be the bridge between your customers and Cognite’s Engineering and Product Management teams and advise on development priorities. As part of the broader account teams, you will need to be a good communicator, enjoy working closely with people to solve challenging problems and be able to understand complex technology. You will be expected to quickly understand Cognite's offering so that you can connect the customer’s desired outcome with Cognite’s software and drive successful project deliveries which will ultimately lead to increased adoption and revenue growth.",,,De 501 a 1.000 funcionários,Soluções de software e redes corporativas,Tecnologia da informação,Desconhecido/Não se aplica,3.8,70 %,,,4.0,3.8,4.0,3.4,3.5,,,73,,
Aptima Puerto Rico,Software Engineer,Paraná,Brasil,"Who We Are:
For more than 25 years, Aptima's mission has been to improve and optimize performance in mission-critical, technology-intensive environments. We apply deep expertise in how humans think, learn, and perform to today's challenges. Whether for fighter pilots functioning in the cockpit, medical staff in the ICU, or teams collaborating across distributed networks, our solutions:

Ensure synergy: between humans, the technologies they use, and the organizations within which they operate
Enhance productivity: through human-AI teaming, unobtrusive measurement, data analytics, and intelligent interfaces
Accelerate learning, training, and readiness: with precision learning that is customized, personalized, and efficient

What Makes Us Unique:
Our culture is rooted on three principles that our founders planted, and our employees have embraced ever since— . At our core, Aptima researches, develops, and innovates within an area that engineering firms largely ignore, the Human component. In order to impact the world in meaningful ways, you must bring those innovations to light, and that is precisely what we do.

Entrepreneurial and creative energy run through our veins. When our team chooses to continue their education or professionally publish their work, we cheer then on. Teamwork, collaboration, and a relentless focus on our customers are central tenants of our culture. Work hard. Take care of each other. Lead by example. Accept others for who they are.

So, while the world knows us as a company that is moving humans, technology, and AI forward, we believe we are something more.


You will help to create systems that incorporate novel sensing approaches and computational techniques from the fields of Artificial Intelligence and Machine Learning. You will work with teams of scientists, designers, and engineers to craft solutions to real-world problems, and work throughout the entire engineering lifecycle, including software requirements analysis, detailed software architecture design, implementation, testing, and deployment of software systems.",,,,,,,,,,,,,,,,,,73,,
"Siemens Healthineers
4.1",IT DevOps Engineer,São Paulo,Brasil,"Do you want to join us in helping to fight the world's most threatening diseases and enabling access to care for more people around the world? At Siemens Healthineers, we pioneer breakthroughs in healthcare. For everyone. Everywhere.
We offer you a flexible and dynamic environment with opportunities to go beyond your comfort zone in order to grow personally and professionally. Sound interesting?
Then come and join our global team as IT DevOps Engineer for global SCM Platforms and Applications.
Role description
As an IT DevOps Engineer, you will be working on enterprise IT applications in the SCM area, used by Siemens Healthineers worldwide. Your tasks and responsibilities will include but are not limited to the following:",,,Mais de 10.000 funcionários,Serviços de saúde e hospitais,Cuidados de saúde,Mais de US$ 10 bilhões,4.1,83 %,,4.0,3.8,3.8,4.1,3.6,3.9,,,73,https://www.glassdoor.com.br/Avalia%C3%A7%C3%B5es/Siemens-Healthineers-Avalia%C3%A7%C3%B5es-E1317005.htm,https://www.glassdoor.com.br/Benefits/Siemens-Healthineers-Benefits-E1317005.htm
"Bain & Company
4.5","Senior Manager, Data Science",São Paulo,Brasil,"We offer an 80% working model for our South America Advanced Analytics Group team members with Fridays being a non-working day. Please submit CVs in English to be considered for this role
Company Overview

Bain & Company is one of the world's leading global business consulting firms, serving clients across six continents. It was founded in 1973 on the principle that consultants must measure their success in terms of their clients' financial results. Bain's clients have outperformed the stock market 4 to 1. With offices in all major cities, Bain has worked with over 4,150 major multinational and other corporations from every economic sector, in every region of the world.

A career at Bain & Company will provide the opportunity to learn in a collaborative teaming environment, drive impact to support our 'Results' mission statement. The firm has a passionate and rich culture that offers an unparalleled business experience that can carry throughout a career. We hire dynamic individuals that are dedicated to achieving both personal and professional goals. To learn more about the firm, please visit www.bain.com.

Position Summary

This is an opportunity to be a part of Bain’s expanding data science capability area. This position will be part of the Advanced Analytics Group (Bain’s team of data science, engineering, decision science and primary research experts). Responsibilities will include working closely with the Advanced Analytics Group (AAG) and Bain’s consulting teams to provide high quality results for our clients, some of the most successful and pioneering businesses in the world. This will include helping formulate and driving our evolving strategy on how to best support our clients on large data/heavily analytic initiatives.The person in this role will need to:

Responsibilities & Duties

Qualifications",,,Mais de 10.000 funcionários,Consultoria empresarial,Gerenciamento e consultoria,De US$ 5 a US$ 10 bilhões,4.5,93 %,,4.6,4.6,4.4,4.6,4.3,3.4,,,73,https://www.glassdoor.com.br/Avalia%C3%A7%C3%B5es/Bain-and-Company-Avalia%C3%A7%C3%B5es-E3752.htm,https://www.glassdoor.com.br/Benefits/Bain-and-Company-Benefits-E3752.htm
"Sylvamo
4.2",IT Analytics Platform Architect,Mogi-Guaçu,Brasil,"At Sylvamo, we’re a team on a mission. Joining us, you’ll be helping to sustain forests and renew ecosystems, while delivering on the promise of paper to educate, communicate and entertain the world.

Come grow with us!

Key Accountabilities:
Collaborate in the definition and execution of the vision, mission and strategic plan for Sylvamo Analytics Platforms and Services team in alignment with business aspirations, goals and expected outcomes to build and strengthen competitive advantage.
Coordinating Sylvamo TSA exit efforts and building development and support capabilities for analytics and business intelligence platforms and services.
Coordinate multi-disciplinary teams of skilled IT professionals to deliver value-adding services and solutions. Working with geographically dispersed and diverse teams through effective and efficient collaboration practices.


Sylvamo is an Equal Opportunity/Affirmative Action Employer. All qualified applicants will receive consideration for employment without regard to sex, gender identity, sexual orientation, race, color, religion, national origin, disability, protected veteran status, age, or any other characteristic protected by law.",,,De 5.001 a 10.000 funcionários,Produção de bens de consumo,Manufatura,Desconhecido/Não se aplica,4.2,78 %,,4.6,3.5,4.3,4.2,3.6,4.0,,,73,https://www.glassdoor.com.br/Avalia%C3%A7%C3%B5es/Sylvamo-Avalia%C3%A7%C3%B5es-E6198222.htm,https://www.glassdoor.com.br/Benefits/Sylvamo-Benefits-E6198222.htm
"RELX
3.9",Senior Software Engineer,São Paulo,Brasil,"Senior Software Engineer

At LexisNexis we develop the legal profession’s most innovative products for data analysis, visualization, and research. We use the latest techniques in machine learning, knowledge modeling, and data visualization to uncover insights about judges’ rulings, build forecasts of likely outcomes, and reveal critical connections in massive datasets spanning the law, news, and finance.
As a senior software engineer on our team, you will work on new product development in a small team environment writing production code in both run-time and build-time environments. You will help propose and build data-driven solutions for high-value customer problems by discovering, extracting, and modeling knowledge from large-scale natural language datasets. You will prototype new ideas, collaborating with other data scientists as well as product designers, data engineers, front-end developers, and a team of expert legal data annotators. You will get the experience of working in a start-up culture with the large datasets and many other resources of an established company.
RESPONSIBILITIES",,,Mais de 10.000 funcionários,Serviços de apoio à tecnologia da informação,Tecnologia da informação,Mais de US$ 10 bilhões,3.9,81 %,,,3.5,3.6,3.9,3.4,4.0,,,73,https://www.glassdoor.com.br/Avalia%C3%A7%C3%B5es/RELX-Avalia%C3%A7%C3%B5es-E1023378.htm,
YellowIpe,Data Scientist - Sênior,Brasil,Brasil,"About The YellowIpe
Software Consulting founded with the mission to inspire the connection of technology with people, fostering the best of our professionals through our expertise in finding and attracting the best talent for the best projects.

About The Job
YellowIpe is recruiting Data Scientist for direct integration into a multinational company.

Job requirements",,,De 1 a 50 funcionários,Recrutamento e terceirização,Recursos humanos e pessoal,Menos de US$ 1 milhão,,,,,,,,,,,,73,,
"MARS
4.3",Marketing Product Strategy Analyst,Guararema,Brasil,"One Demand Data & Analytics (ODDA) is a Mars Wrigley program that harnesses the power of data and insights to solve some of the critical business-wide problems we face – unlocking quality growth and operational excellence. ODDA team is being built under Chief Growth officer organization and is led by Global VP Data Analytics & Insights.
Through ODDA, we deliver connected insights across the entire demand ecosystem leveraging machine learning, AI and new cutting-edge technologies, solving complex challenging problems. We empower our Associates with the right data, tools and capabilities so they can take decisive action, maximizing value and making a meaningful impact on our consumers, our customers and our business.
The Marketing Analytics vertical within ODDA seeks to equip Mars Marketing Associates with the capabilities needed to optimize and improve marketing campaigns across Media, Content, Search and CRM and shopper marketing consumer promotions optimization. Marketing vertical is one of key enablers for global Media 2025 program that drives best in biddable, enables integrated consumer journey and drives 100% addressable content. Example of use cases to work on is media mix modelling, cross-media measurement, search optimization, multi-touch attribution, audience building and enabling personalization via AI based content generation and scenario planning to optimize margin after conversion and gross sales value ROI for CP/Shopper Marketing spend by ensuring we have comprehensive ROI capabilities that make us better investors short term and long term, household penetration and many more.",,,Mais de 10.000 funcionários,Produção de alimentos e bebidas,Manufatura,Mais de US$ 10 bilhões,4.3,87 %,,4.3,4.0,4.1,4.4,3.8,3.9,,,73,https://www.glassdoor.com.br/Avalia%C3%A7%C3%B5es/Mars-Avalia%C3%A7%C3%B5es-E2886.htm,https://www.glassdoor.com.br/Benefits/Mars-Benefits-E2886.htm
"LexisNexis
3.9",Senior Software Engineer,São Paulo,Brasil,"Senior Software Engineer

At LexisNexis we develop the legal profession’s most innovative products for data analysis, visualization, and research. We use the latest techniques in machine learning, knowledge modeling, and data visualization to uncover insights about judges’ rulings, build forecasts of likely outcomes, and reveal critical connections in massive datasets spanning the law, news, and finance.
As a senior software engineer on our team, you will work on new product development in a small team environment writing production code in both run-time and build-time environments. You will help propose and build data-driven solutions for high-value customer problems by discovering, extracting, and modeling knowledge from large-scale natural language datasets. You will prototype new ideas, collaborating with other data scientists as well as product designers, data engineers, front-end developers, and a team of expert legal data annotators. You will get the experience of working in a start-up culture with the large datasets and many other resources of an established company.
RESPONSIBILITIES",,,Mais de 10.000 funcionários,Consultoria empresarial,Gerenciamento e consultoria,De US$ 1 a US$ 5 bilhões,3.9,79 %,,,3.7,3.6,4.1,3.7,4.2,,,73,https://www.glassdoor.com.br/Avalia%C3%A7%C3%B5es/LexisNexis-Legal-and-Professional-Avalia%C3%A7%C3%B5es-E4146.htm,
"QuintoAndar
4.1",Data Platform Engineer Specialist,Brasil,Brasil,"Sobre o QuintoAndar:

O QuintoAndar nasceu para fazer algo muito gratificante: abrir portas. Abrimos portas para que a tecnologia fizesse parte do morar. E, por meio dela, simplificamos e desburocratizamos a experiência de quem busca por um novo lar. Assim, nos tornamos a proptech mais valiosa da América Latina, liderando o mercado imobiliário em cerca de seis países e mais de 75 cidades ao redor do globo.
Após conquistar o Brasil com um modelo de negócios pioneiro no mercado de Aluguel e Compra e Vendas de imóveis, expandimos para o mercado internacional ao adquirirmos o Grupo Navent, que detém a classificação número 1 no México (Inmuebles24), Argentina (Zonaprop), Peru (Adondevivir & Urbania) e Equador (Plusvalia) - entre outros. E mais recentemente, lançamos Benvi, nossa marca internacional no México, que chega com o nosso produto e serviço de aluguel de imóveis residenciais.",,,De 1.001 a 5.000 funcionários,Internet e serviços Web,Tecnologia da informação,Desconhecido/Não se aplica,4.1,80 %,,4.2,3.9,3.9,4.1,3.7,3.7,,,73,https://www.glassdoor.com.br/Avalia%C3%A7%C3%B5es/QuintoAndar-Avalia%C3%A7%C3%B5es-E1161693.htm,https://www.glassdoor.com.br/Benefits/QuintoAndar-Benefits-E1161693.htm
"CIAL Dun & Bradstreet
3.6",Full-stack React Developer,São Paulo,Brasil,"Why we work at CIAL Dun&Bradstreet:
CIAL is the Latin American partner of Dun & Bradstreet’s extensive World Wide Network, which enables millions of businesses around the world to make confident decisions with reliable and accessible information. With a presence in 43 countries in Latin America and the Caribbean (as well as data & engineering teams in Zagreb and Tel Aviv), we’re committed to the long-term economic success of the region and its businesses. Our team empowers Latin American companies of all sizes to grow, manage their customers and suppliers, and operate successfully in increasingly transparent, modern economies.

We are at a transformational moment in our company's history. Built on top of 179 years of experience, we are finding new ways to strengthen our award-winning culture, and to accelerate creativity, innovation, and growth. If you're looking to join an international team and make an immediate impact at a company that welcomes bold and diverse thinking, come join us!

Job description:
At CIAL Dun&Bradstreet, we are looking for a full-stack / react developer to help us turn our products into easy-to-use, yet powerful and stable, products for our clients and our internal tools.",,,Desconhecido,,,,3.6,69 %,,4.0,3.1,3.1,3.7,3.0,3.8,,,73,https://www.glassdoor.com.br/Avalia%C3%A7%C3%B5es/CIAL-Dun-and-Bradstreet-Avalia%C3%A7%C3%B5es-E2888884.htm,https://www.glassdoor.com.br/Benefits/CIAL-Dun-and-Bradstreet-Benefits-E2888884.htm
