Company Name,Job Title,Location,Country,Job Description,Salary Estimate,Avg Salary,Size,Industry,Sector,Revenue,Rating,Recommend,CEO,Benefits,Opportunities,Comp Benefits,Culture,Management,WorkLife Balance,Pros,Cons,Num Listings,Reviews URL,Benefits URL
"Roche
4.3",Postdoctoral Scientist (m/f/d) in Personalized Safety,Bâle,Suisse (French),"The Position
The position
Pharmaceutical Sciences (PS) is a global function within Roche Pharma Research and Early Development (pRED) which covers several research areas, including Immunosafety. As part of the Immunosafety group, you will work in close collaboration with scientists from different departments within PS/pRED to generate and integrate molecular, cellular, tissue, and functional data to deliver unique and holistic insights into personalized drug safety and enable informed decisions to bring the best drugs to patients.
In this position, you will develop and/or apply innovative in vitro, in silicon, and in vivo (mouse) models to better investigate the mechanisms underlying cytokine release syndrome (CRS), identify novel biomarkers, and validate their predictive value in clinical trials both retro- and prospectively.
Who you are",,,Plus de 10''000 employés,Biotechnologies et pharmaceutique,Pharmaceutique et biotechnologie,Plus de 10 milliards de dollars US,4.3,88 %,96 %,4.4,3.9,4.1,4.2,3.7,4.1,,,400,https://fr.glassdoor.ch/Avis/Roche-Avis-E3480.htm,https://fr.glassdoor.ch/Benefits/Roche-Benefits-E3480.htm
"Credit Suisse
3.8",Data Scientist for Trade & Market Surveillance Analytics,Zurich,Suisse (French),"Your field of responsibility

Your field of responsibility
The Trade & Market Surveillance Analytics Team is focusing on building strategic and global trade & market surveillance solutions for Financial Crime Compliance within Credit Suisse. We are looking for a highly motivated and passionate Data Scientist to support the team and our stakeholders in studying complex business questions and translating them into fully automated and data driven analytics solutions. Your responsibilities include user engagement, business requirement definition, pipeline engineering, model and front-end development on our strategic big data platform and in close collaboration with peers, business users and stakeholders.
Your future colleagues",,,Plus de 10''000 employés,Investissement et gestion des actifs,Finance,Plus de 10 milliards de dollars US,3.8,77 %,100 %,3.5,3.8,3.6,3.8,3.4,3.8,,,400,https://fr.glassdoor.ch/Avis/Credit-Suisse-Avis-E3141.htm,https://fr.glassdoor.ch/Benefits/Credit-Suisse-Benefits-E3141.htm
"Migros Bank AG
4.2",Data Owner (w/m) 80% – 100%,Wallisellen,Suisse (French),"Bei uns darfst du deine Begeisterung für Daten und Analysen jeden Tag ausleben. Nicht nur das: Du trägst dazu bei, dass wir in dem, was wir tun immer besser werden. Wir suchen dich: Eine Persönlichkeit, die in Daten Möglichkeiten und in Analysen Lösungen sieht und uns so vorwärtsbringt.
Migros Bank
Wallisellen
Industriestrasse 17-19
8304 Wallisellen
Route berechnen

Was du bewegst",,,Entre 1''001 et 5''000 salariés,Investissement et gestion des actifs,Finance,Ne sait pas / non applicable,4.2,99 %,100 %,4.6,3.5,3.4,4.3,3.9,4.5,,,400,https://fr.glassdoor.ch/Avis/Migros-Bank-Avis-E685090.htm,https://fr.glassdoor.ch/Benefits/Migros-Bank-Benefits-E685090.htm
"Roche
4.3","Plasma Protein Binding Scientist, ADME Chapter, PS, pRED",Bâle,Suisse (French),"The Position
In Roche’s Pharmaceutical Research and Early Development organisation (pRED), we make transformative medicines for patients in order to tackle some of the world’s toughest unmet healthcare needs. At pRED, we are united by our mission to transform science into medicines. Together, we create a culture defined by curiosity, responsibility and humility, where our talented people are empowered and inspired to bring forward extraordinary life-changing innovation at speed.
This position is located in ADME, a chapter within Global Pharmaceutical Sciences, where the fate of new chemical entities and biologics is a primary focus.
The ADME Chapter works throughout all stages of compound development, from lead optimization to candidate selection, all clinical development phases, to the filing of new drug applications. We closely collaborate with our therapeutic areas and functions to convert hypotheses into innovative therapeutics.",,,Plus de 10''000 employés,Biotechnologies et pharmaceutique,Pharmaceutique et biotechnologie,Plus de 10 milliards de dollars US,4.3,88 %,96 %,4.4,3.9,4.1,4.2,3.7,4.1,,,400,https://fr.glassdoor.ch/Avis/Roche-Avis-E3480.htm,https://fr.glassdoor.ch/Benefits/Roche-Benefits-E3480.htm
"Novartis
4.1",Principal Scientist I/II - Musculoskeletal Disease Area (80-100%*),Bâle,Suisse (French),"6000+! The number of scientists in the Novartis Institutes for BioMedical Research (NIBR). The Musculoskeletal Disease Area (MSD) at the Novartis Institutes for Biomedical Research (NIBR) is investing in the discovery of novel and transformative therapies for patients affected by neuromuscular, tendon and cartilage diseases.

As part of this effort, MSD is seeking an innovative and highly motivated Principal Scientist to develop, shape and advance novel therapies aimed at prevention and regeneration of neuromuscular, cartilage and tendon diseased tissues.

You will be responsible for leading a state-of-the-art laboratory of experienced scientists, employing ground-breaking technologies to explore disease mechanisms and pathways, identify novel targets, mechanistically dissect their function and provide detailed characterization of mechanism of action of novel molecules, to enable progression of the drug discovery pipeline. This will include the use of complex in vitro assays, patient relevant cellular and ex vivo model systems to evaluate innovative therapeutic modalities (small molecules, biologics, gene therapies) with potential for long-term impact on the disease course.

As a member of the NIBR community, you will also contribute to and benefit from a highly interdisciplinary and collaborative global community with extensive know how and resources in data sciences, chemistry, biologics, cell and gene therapy as well as chemical biology.

Your responsibilities will include",,,Inconnu,,,,,,,,,,,,,,,400,,
"Roche
4.3",Internship / Master student in the analysis of longitudinal high-dimensional biomarkers,Bâle,Suisse (French),"The Position
At Roche, 80,000 people across 150 countries are pushing back the frontiers of healthcare.
We believe it’s urgent to deliver medical solutions right now – even as we develop innovations for the future. We are passionate about transforming patients’ lives and we are fearless in both decision and action. And we believe that good business means a better world.
We commit ourselves to scientific rigor, unassailable ethics, and access to medical innovations for all. We do this today to build a better tomorrow.

Pharmaceutical Sciences (PS) is a global function within Roche Pharma Research and Early Development (pRED). As a team member in Predictive Modelling and Data Analytics (PMDA) chapter of PS, you will work in close collaboration with scientists in pRED, using biostatistics, bioinformatics, and pharmacokinetic (PK) / pharmacodynamics (PD) modelling and simulation tools and methods. The main focus of this position consists in investigating and developing novel methods to work with longitudinal data from high-dimensional biomarkers, collected as part of early phase clinical trials in oncology. Making clinically useful decisions based on such high-dimensional data is challenging. The project focuses on understanding which are the key biomarkers and what role they play: is the drug affecting the biomarker value (i.e. is the marker dose-dependent), is a biomarker prognostic or predictive (or none, or both) of a certain clinical outcome. In any of these cases, how do we quantify the effects that the biomarkers have?",,,Plus de 10''000 employés,Biotechnologies et pharmaceutique,Pharmaceutique et biotechnologie,Plus de 10 milliards de dollars US,4.3,88 %,96 %,4.4,3.9,4.1,4.2,3.7,4.1,,,400,https://fr.glassdoor.ch/Avis/Roche-Avis-E3480.htm,https://fr.glassdoor.ch/Benefits/Roche-Benefits-E3480.htm
"Novartis
4.1","Senior Scientist I/II, Oncology Translational Research",Bâle,Suisse (French),"Oncology Translational Research at Novartis Institutes for Biomedical Research is recruiting an independent scientist with a strong background in cellular and molecular biology to join the Oncology Pathology and Biomarkers group in Basel, Switzerland.
We are seeking a highly motivated scientist with at least 3 years of experience in pre-clinical/translational research within the pharmaceutical industry or in an academic laboratory. You will be responsible for the generation of novel, high quality data to progress research programs to the clinical trial stage. By using a variety of molecular and cell biology approaches you will design, perform, and analyze studies using human tissues, xenograft models and cell lines, applying techniques like immunofluorescence microscopy, qPCR, western blotting, and other cutting-edge technologies. Your work will contribute to the identification of molecular predictors of response to cancer drugs and resistance, and to the discovery of potential combination therapies. While closely interacting with your lab head and colleagues in the group, you will be expected to flexibly contribute to local and global projects as needed and to proactively share knowhow and experience across groups.

Major accountabilities include:",,,Inconnu,,,,,,,,,,,,,,,400,,
"Roche
4.3",Small-Molecule AI Scientist (Artificial Intelligence/Machine Learning),Bâle,Suisse (French),"The Position
In Roche´s Pharmaceutical Research and Early Development organisation (pRED), we make transformative medicines for patients in order to tackle some of the world’s toughest unmet healthcare needs. At pRED, we are united by our mission to transform science into medicines. Together, we create a culture defined by curiosity, responsibility and humility, where our talented people are empowered and inspired to bring forward extraordinary life-changing innovation at speed.
This position is located in Computer-Aided Drug Design (CADD), a department within Small Molecule research, where the computer-aided discovery of chemical starting points and further optimization towards clinical candidates is the primary focus. To ensure excellence in drug design, we push the scientific boundaries in key areas of CADD, implement and democratize new computational tools, and advocate a digital mindset across the organization.",,,Plus de 10''000 employés,Biotechnologies et pharmaceutique,Pharmaceutique et biotechnologie,Plus de 10 milliards de dollars US,4.3,88 %,96 %,4.4,3.9,4.1,4.2,3.7,4.1,,,400,https://fr.glassdoor.ch/Avis/Roche-Avis-E3480.htm,https://fr.glassdoor.ch/Benefits/Roche-Benefits-E3480.htm
"Roche
4.3","Plasma Protein Binding Scientist, ADME Chapter, PS, pRED",Bâle,Suisse (French),"The Position
In Roche’s Pharmaceutical Research and Early Development organisation (pRED), we make transformative medicines for patients in order to tackle some of the world’s toughest unmet healthcare needs. At pRED, we are united by our mission to transform science into medicines. Together, we create a culture defined by curiosity, responsibility and humility, where our talented people are empowered and inspired to bring forward extraordinary life-changing innovation at speed.
This position is located in ADME, a chapter within Global Pharmaceutical Sciences, where the fate of new chemical entities and biologics is a primary focus.
The ADME Chapter works throughout all stages of compound development, from lead optimization to candidate selection, all clinical development phases, to the filing of new drug applications. We closely collaborate with our therapeutic areas and functions to convert hypotheses into innovative therapeutics.",,,Plus de 10''000 employés,Biotechnologies et pharmaceutique,Pharmaceutique et biotechnologie,Plus de 10 milliards de dollars US,4.3,88 %,96 %,4.4,3.9,4.1,4.2,3.7,4.1,,,400,https://fr.glassdoor.ch/Avis/Roche-Avis-E3480.htm,https://fr.glassdoor.ch/Benefits/Roche-Benefits-E3480.htm
"Biogen
4.0","Sr Data Scientist, Computational Behavior Analytics, Digital Biomarkers",Baar,Suisse (French),"Job Description

About this role
Neurologic diseases are complex and can be devastating to patients and there are still significant challenges in their screening, detection, treatment, and monitoring.
At Biogen Digital Health (BDH), we aspire to transform patients’ lives by making personalized & digital medicine in neuroscience a reality. Leveraging data-science and digital technologies, we drive solutions to advance research, clinical care, and patient empowerment.
We stand with our colleagues at Biogen developing pioneering treatments in neuroscience. We believe that now, more than ever, biology and technology should go hand-in-hand to better meet patient needs, while enabling a shift towards more prevention-focused, affordable, and equitable care.",,,Entre 5''001 et 10''000 employés,Biotechnologies et pharmaceutique,Pharmaceutique et biotechnologie,Plus de 10 milliards de dollars US,4.0,72 %,57 %,4.2,3.7,4.1,3.9,3.3,3.8,,,400,https://fr.glassdoor.ch/Avis/Biogen-Avis-E1336.htm,https://fr.glassdoor.ch/Benefits/Biogen-Benefits-E1336.htm
"Google
4.5","Research Scientist, Computer Vision, Augmented Reality",Zurich,Suisse (French),"Minimum qualifications:
PhD in Computer Vision, Machine Learning, a related field, or equivalent practical experience.
Experience with publishing at conferences and journals about 3D body and hand tracking (e.g., CVPR/ICCV/ECCV/NeurIPS/ICLR/ICML/IJCV/PAMI).
Experience with camera calibration, 3D data rendering, and processing in Python.

Preferred qualifications:
Experience programming with C++, Tensorflow, and CUDA.
Experience using multi-camera perception systems.







Google is proud to be an equal opportunity workplace and is an affirmative action employer. We are committed to equal employment opportunity regardless of race, color, ancestry, religion, sex, national origin, sexual orientation, age, citizenship, marital status, disability, gender identity or Veteran status. We also consider qualified applicants regardless of criminal histories, consistent with legal requirements. See also Google's EEO Policy and EEO is the Law. If you have a disability or special need that requires accommodation, please let us know by completing our Accommodations for Applicants form.",,,Plus de 10''000 employés,Services web,Informatique,Plus de 10 milliards de dollars US,4.5,90 %,93 %,4.8,4.3,4.4,4.4,4.2,4.3,,,400,https://fr.glassdoor.ch/Avis/Google-Avis-E9079.htm,https://fr.glassdoor.ch/Benefits/Google-Benefits-E9079.htm
"Philip Morris International
4.1","Sr Scientist - Statistician Neuchatel, Switzerland Life Sciences",Neuchâtel,Suisse (French),"Sr Scientist – Statistician, Neuchatel, Switzerland

Be a part of a revolutionary change.

At PMI, we’ve chosen to do something incredible. We’re totally transforming our business, and building our future on smoke-free products.

With huge change, comes huge opportunity. So, wherever you join us, you’ll enjoy the freedom to dream up and deliver better, brighter solutions and the space to move your career forward in endlessly different directions.

It’s so rare in R&D that everything aligns to create the ideal conditions for outstanding work. Right now, at PMI, that’s exactly what’s happening. R&D is the driving force for our bold new vision: to replace cigarettes with a revolutionary portfolio of alternative products.

Join us and you’ll have the resources, support and technology you need to break new ground and see ideas come to life. You’ll be surrounded by some of the brightest scientists in their fields, with fast access to subject experts and commercial decision-makers.

If you’re creative, courageous and ready to take risks, you can make a huge impact and propel your career in an endless number of directions. Ultimately, by delivering our smoke-free and beyond nicotine future.

This opening is for talent pipelining. If you recognize yourself in the description below and you are curious to better understand our vision, do not hesitate to apply. We will contact you if you are meeting the criteria.

More specifically, you'll


Who we’re looking for


What we offer

Our success depends on the people who come to work every single day with a sense of purpose and an appetite for progress. Join PMI and you too can:



#LIJobs",,,Plus de 10''000 employés,Industrie des biens de consommation,Industrie manufacturière,Plus de 10 milliards de dollars US,4.1,80 %,87 %,4.6,3.6,4.3,3.8,3.4,3.5,,,400,,https://fr.glassdoor.ch/Benefits/Philip-Morris-International-Benefits-E7745.htm
"Philip Morris International
4.1","Laboratory Technician - Biology Neuchatel, Switzerland Life Sciences",Neuchâtel,Suisse (French),"Laboratory Technician – Biology – Neuchatel, Switzerland

Be a part of a revolutionary change.

At PMI, we’ve chosen to do something incredible. We’re totally transforming our business, and building our future on smoke-free products.

With huge change, comes huge opportunity. So, wherever you join us, you’ll enjoy the freedom to dream up and deliver better, brighter solutions and the space to move your career forward in endlessly different directions.

It’s so rare in R&D that everything aligns to create the ideal conditions for outstanding work. Right now, at PMI, that’s exactly what’s happening. R&D is the driving force for our bold new vision: to replace cigarettes with a revolutionary portfolio of alternative products.

Join us and you’ll have the resources, support and technology you need to break new ground and see ideas come to life. You’ll be surrounded by some of the brightest scientists in their fields, with fast access to subject experts and commercial decision-makers.

If you’re creative, courageous and ready to take risks, you can make a huge impact and propel your career in an endless number of directions. Ultimately, by delivering our smoke-free and beyond nicotine future.

This opening is for talent pipelining. If you recognize yourself in the description below and you are curious to better understand our vision, do not hesitate to apply. We will contact you if you are meeting the criteria.

Your ‘day to day’

As a Laboratory Technician – Biology you will be responsible for the well-defined scientific/technical methodologies and work procedures to perform routine biological in vitro analyses and technical activities of limited scope and complexity, apply problem-solving techniques and support/maintain biological test systems as well as test facility infrastructure.
More specifically, you'll

Who we’re looking for


What we offer

Our success depends on the people who come to work every single day with a sense of purpose and an appetite for progress. Join PMI and you too can:


#LIJobs",,,Plus de 10''000 employés,Industrie des biens de consommation,Industrie manufacturière,Plus de 10 milliards de dollars US,4.1,80 %,87 %,4.6,3.6,4.3,3.8,3.4,3.5,,,400,,https://fr.glassdoor.ch/Benefits/Philip-Morris-International-Benefits-E7745.htm
"ServiceNow
4.5",Staff Research Scientist/Engineer,Suisse,Suisse (French),"Company Description

At ServiceNow, our technology makes the world work for everyone, and our people make it possible. We move fast because the world can’t wait, and we innovate in ways no one else can for our customers and communities. By joining ServiceNow, you are part of an ambitious team of change makers who have a restless curiosity and a drive for ingenuity. We know that your best work happens when you live your best life and share your unique talents, so we do everything we can to make that possible. We dream big together, supporting each other to make our individual and collective dreams come true. The future is ours, and it starts with you.
With more than 7,400+ customers, we serve approximately 80% of the Fortune 500, and we're proud to be one of FORTUNE's 100 Best Companies to Work For® and World's Most Admired Companies® 2022.
Learn more on Life at Now blog and hear from our employees about their experiences working at ServiceNow.",,,Plus de 10''000 employés,Solutions logicielles et réseau d''entreprise,Informatique,Entre 1 et 5 milliards de dollars US,4.5,92 %,97 %,,4.3,4.4,4.6,4.3,4.3,,,400,,
"Roche
4.3",Computational Biologist in Ophthalmology,Bâle,Suisse (French),"The Position
At Roche, we believe it’s urgent to deliver medical solutions right now – even as we develop innovations for the future. We are passionate about transforming patients’ lives and we are ambitious in both decision and action. And we believe that good business means a better world. That is why we come to work every single day. We commit ourselves to scientific rigor, unassailable ethics, and access to medical innovations for all. We do this today to build a better tomorrow.
The Ophthalmology Discovery Team in Pharma Research and Early Development (pRED), located in Basel, is part of the Immunology, Inflammation and Ophthalmology (I2O) translational area.
Roche pRED Ophthalmology is in constant expansion in order to deliver the best drugs to the Patients. We are offering a unique opportunity to join our team in the Roche Innovation Center Basel.
We are a community of drug-hunters comprising research expertise in age related macular degeneration, diabetic retinopathy, genomic medicines and dry eye disease. Our responsibility, in collaboration with our clinical colleagues and functions, is to convert hypotheses into innovative medicines for treating ocular diseases of high unmet medical need.",,,Plus de 10''000 employés,Biotechnologies et pharmaceutique,Pharmaceutique et biotechnologie,Plus de 10 milliards de dollars US,4.3,88 %,96 %,4.4,3.9,4.1,4.2,3.7,4.1,,,400,https://fr.glassdoor.ch/Avis/Roche-Avis-E3480.htm,https://fr.glassdoor.ch/Benefits/Roche-Benefits-E3480.htm
"Proton AG
4.3",R&D Engineer,Genève,Suisse (French),"A better internet, where privacy is the default, is possible. Building this better internet might seem daunting or even unthinkable, but at Proton, this is what we do every day.
Proton was founded in 2014 by a group of scientists who met at the European Organization for Nuclear Research (CERN). Our first product, Proton Mail, is now the world’s largest encrypted email service. Subsequent Proton products, such as Proton VPN, Proton Calendar, and Proton Drive, give our users full control over how and with whom their data is shared.
Today, Proton makes privacy universally accessible. Journalists from outlets like The Guardian and The New York Times, some of the world’s largest organizations, and people in more than 180 countries have signed up for over 70 million accounts. Our diverse and dynamic team is made up of more than 400 members representing over 40 different nationalities. While we are based in Geneva, Switzerland, we have offices in Zurich, Prague, London, Vilnius, Skopje, Taipei, and many more employees working remotely around the world.",,,Entre 201 et 500 employés,Services web,Informatique,Ne sait pas / non applicable,4.3,88 %,100 %,3.5,4.3,3.9,4.2,4.0,4.2,,,400,https://fr.glassdoor.ch/Avis/Proton-Avis-E1405328.htm,https://fr.glassdoor.ch/Benefits/Proton-Benefits-E1405328.htm
"Novartis
4.1",Principal Scientist - Oncology Research (80-100%*),Bâle,Suisse (French),"6000+! That’s the number of associates in the Novartis Institutes for BioMedical Research (NIBR). This division is the innovation engine of Novartis, focusing on powerful new technologies that have the potential to help produce therapeutic breakthroughs for patients.

The Oncology Research department at Novartis Institutes for Biomedical Research is recruiting for a Ph.D. level Principal Scientist with a strong background and track record in cancer cell biology. Expertise in the field of radiobiology and/or DNA damage and repair would be desirable.

The candidate will join an Oncology Drug Discovery Research group located in Basel Switzerland, and will be responsible to lead a laboratory and projects in the areas of oncology drug discovery and radioisotope-based therapies. This is an excellent opportunity to join a world class research team at NIBR in Basel, Switzerland.

Through a broad and deep knowledge of cancer biology and in collaboration with peers within the team, the candidate is expected to develop ideas and conduct experiments to understand and validate the effect of radiation caused by radioligand conjugates on various cellular functions including DNA damage repair (DDR) and cell fate, discover combination therapy opportunities, identify molecular predictors of response to cancer drugs, to and/or investigate resistance or survival mechanisms in presence of such drugs.

You will demonstrate strong collaborative team spirit, excellent communication skills and willingness to pro-actively interact across the global organization will be essential to succeed in the role. Excellent mentoring and coaching skills will be a necessary asset to develop lab members scientifically and professionally.

Your responsibilities will include:",,,Inconnu,,,,,,,,,,,,,,,400,,
