Company Name,Job Title,Location,Country,Job Description,Salary Estimate,Avg Salary,Size,Industry,Sector,Revenue,Rating,Recommend,CEO,Benefits,Opportunities,Comp Benefits,Culture,Management,WorkLife Balance,Pros,Cons,Num Listings,Reviews URL,Benefits URL
"Philip Morris International
4.1","Senior Clinical Scientist Neuchatel, Switzerland Life Sciences",Neuenburg,Schweiz (German),"Senior Clinical Scientist – Neuchatel, Switzerland

Be a part of a revolutionary change.

At PMI, we’ve chosen to do something incredible. We’re totally transforming our business, and building our future on smoke-free products. We’re also exploring new categories, looking beyond nicotine to develop a new portfolio of innovative products.

With huge change, comes huge opportunity. So, wherever you join us, you’ll enjoy the freedom to dream up and deliver better, brighter solutions and the space to move your career forward in endlessly different directions.

It’s so rare in R&D that everything aligns to create the ideal conditions for outstanding work. Right now, at PMI, that’s exactly what’s happening. R&D is the driving force for our bold new vision: to replace cigarettes with a revolutionary portfolio of alternative products.

Join us and you’ll have the resources, support and technology you need to break new ground and see ideas come to life. You’ll be surrounded by some of the brightest scientists in their fields, with fast access to subject experts and commercial decision-makers.

If you’re creative, courageous and ready to take risks, you can make a huge impact and propel your career in an endless number of directions. Ultimately, by delivering our smoke-free and beyond nicotine future.

This opening is for talent pipelining. If you recognize yourself in the description below and you are curious to better understand our vision, do not hesitate to apply. We will contact you if you are meeting the criteria.

Your ‘day to day’

As a Senior Clinical Scientist you will act as the scientific leader for clinical studies and projects according to study planning, within the Clinical Science & Epidemiology (CSE) department, being also responsible to develop and review documents in line with ICH/GCP, provide scientific/clinical input and expertise to the team and support the clinical operations. We are conducting GCP clinical studies and now also focusing on consumers’ needs and interests; you will design “out-of-the-box” studies / work on research to support consumer’s claims.

More specifically, you'll


Who we’re looking for


What we offer

Our success depends on the people who come to work every single day with a sense of purpose and an appetite for progress. Join PMI and you too can:



# LIJobs",,,Mehr als 10''000 Mitarbeiter,Konsumgüterproduktion,Produktion,Mehr als 10 Milliarden $ (USD),4.1,80 %,87 %,4.6,3.6,4.3,3.8,3.4,3.5,,,225,,https://de.glassdoor.ch/Benefits/Philip-Morris-International-Benefits-E7745.htm
"Novartis
4.1",Molecular and Computational Safety Scientist – Safety Genetics lab,Basel,Schweiz (German),"6000! That’s the number of associates in the Novartis Institutes for BioMedical Research (NIBR). This division is the innovation engine of Novartis, focusing on powerful new technologies that have the potential to help produce therapeutic breakthroughs for patients.

The Pre-Clinical Safety (PCS) group in NIBR provides world class preclinical safety profiling and assessment for optimal drug discovery, development and commercialization, with state-of-the-art regulatory compliance.

As a molecular and computational safety scientist, you will be involved in a wide range of projects within the Genome Safety section at Novartis, Preclinical Safety (PCS) department. In this role you will collaborate with multi-disciplinary scientists to support the safety of LMW compounds and Cell & Gene Therapy products within the Novartis Research and Development portfolio.

You will develop and apply a broad range of molecular biology and bioinformatic techniques and perform high quality experiments and procedures with a high degree of technical and scientific autonomy. With your biocomputational background, you will also contribute to the qualification, analysis, integration, and interpretation of the results generated, including next-generation sequencing data from internal and external data sources. You have a deep understanding of biological questions and a pro-active attitude towards your cross-disciplinary collaborators (biologists, toxicologists, computational scientists, drug discovery teams).",,,Unbekannt,,,,,,,,,,,,,,,225,,
"Idorsia Pharmaceuticals Ltd.
3.6",Clinical Project Scientist,Basel,Schweiz (German),"About Idorsia Pharmaceuticals Ltd

Idorsia Ltd is reaching out for more - We have more ideas, we see more opportunities and we want to help more patients.
In order to achieve this, we want to develop Idorsia into one of Europe’s leading biopharmaceutical companies, with a strong scientific core.
Headquartered in Switzerland - a European biotech hub - Idorsia is specialized in the discovery and development of small molecules, to transform the horizon of therapeutic options. Idorsia has a broad portfolio of innovative drugs in the pipeline, an experienced team, a fully-functional research center, and a strong balance sheet – the ideal constellation to bringing R&D efforts to business success.
Idorsia was listed on the SIX Swiss Exchange (ticker symbol: IDIA) in June 2017 and has over 1,100 highly qualified specialists dedicated to realizing our ambitious targets.",,,501 bis 1''000 Mitarbeiter,Biotechnologie & Arzneimittel,Pharmazeutika & Biotechnologie,Unbekannt/Nicht zutreffend,3.5,63 %,99 %,3.6,2.5,3.0,3.5,3.4,3.0,,,225,https://de.glassdoor.ch/Bewertungen/Idorsia-Pharmaceuticals-Bewertungen-E1806477.htm,https://de.glassdoor.ch/Benefits/Idorsia-Pharmaceuticals-Benefits-E1806477.htm
"Novartis
4.1",Principal/Senior Principal Pharmacometrics Scientist,Basel,Schweiz (German),"80 quantitative scientists in the Pharmacometrics community @ Novartis support a portfolio of more than 80 clinical development projects in 10 therapeutic areas every day. Quantitative sciences are a critical part of bringing these new medicines to patients. Pharmacometric Scientists bring innovative modeling and simulation skills to every aspect of clinical drug development over a wide range of disease areas and drug modalities. We are dedicated to creating a collaborative and supportive culture where teamwork and learning is emphasized and innovative problem solving is encouraged. Come and join an industry leader where you will have the opportunity to grow and contribute as a quantitative drug development scientist in early- and late-stage projects.
The Senior Principal / Principal Pharmacometrics Scientist leads the planning, execution, and delivery of pharmacometrics strategy on clinical projects within (early/full) clinical development. In this role, you will be responsible for the discussion and implementation of pharmacometrics methodologies that successfully address the Novartis Institutes for Biomedical Research (NIBR) and Global Drug Development (GDD) objectives on the assigned projects. You will provide pharmacometrics support for regulatory submissions and supply to drug development decisions with internal and external partners and work with experienced pharmacometricians to collaborate with cross-functional international teams to develop quantitative strategies and will also have the opportunity to explore innovative pharmacometrics methodologies that optimally address the research and development objectives.



Your responsibilities include, but are not limited to:",,,Unbekannt,,,,,,,,,,,,,,,225,,
"Ridgeline Discovery GmbH
3.6","(Senior) Scientist, Analytical Development",Basel,Schweiz (German),"Matterhorn Biosciences is looking for a (Senior) Scientist, Analytical Development.
https://www.matterhornbiosciences.com/ is a preclinical stage biotechnology company pioneering the discovery and development of novel T cell therapy for cancer treatment. We are an exciting motivated group of scientists who are determined to make a difference for modern human medicine.
As we continue to build the Process Development team, we are seeking a highly motivated scientist to join our team as a (Senior) Scientist, Analytical Development, supporting the development of novel T cell therapies in house. The role will require the precise application of a diverse range of laboratory-based skills. As such, the successful candidate will have significant experience on development and optimization of analytical methods. The ideal candidate should be highly motivated, enthusiastic with a positive “can do” attitude, hands-on, strong organizational skills, able to work independently and enjoy fast-paced, collaborative, and vibrant start-up culture.",,,1 bis 50 Mitarbeiter,Finanzen,weniger als 1 Million $ (USD),,3.6,53 %,100 %,,3.5,3.1,3.7,3.6,2.5,,,225,,
"GITR
3.3",Bioinformatics Scientist,Schlieren,Schweiz (German),"INTRODUCTION:
For our client, inventor and developer of mass spectrometry-based proteomics solutions located in the area of Zurich we are looking for an individual as
Bioinformatics Scientist
(Permanent employment, fulltime). The earliest start date is as soon as possible.

ASSIGNMENT DESCRIPTION:
Develop and implement novel algorithms for analysis for proteomics data
Analyze experimental data to generate actionable insights
Help build machine learning models in collaboration with AI experts",,,Unbekannt,Personalwesen,Unbekannt/Nicht zutreffend,,3.3,N/A,N/A,,2.0,1.0,2.0,2.0,2.0,,,225,,
"Ridgeline Discovery GmbH
3.6","Senior Scientist, Protein Engineering and Production, 100%",Basel,Schweiz (German),"Vector BioPharma AG, a new Basel-based biotech start-up, is recruiting a large team to support the development of gene therapy vectors for a range of applications in pharmaceuticals. We are a technology-driven start-up company providing precision gene delivery solutions that reinvent the way we treat patients. We deploy cutting-edge platform technologies founded in world-class academic research in protein engineering to solve the drug “delivery problem” in a revolutionary way. We use engineered viral vectors to achieve cell and tissue specific expression of genes and regulators at unprecedented efficacy and safety. We are an international team of scientists, engineers and pharmaceutical professionals committed to excellence in science. We value diversity and inclusion and support our people in their personal and career development. Basel, Switzerland is at the intersection of the Swiss, French, and German borders. The city is well-known for its art, culture, and science, and is regarded as a global hub for the pharmaceutical industry. Our labs are located at Basel’s Technology Park, an established incubator with a proven track record in developing successful biotech start-ups.",,,1 bis 50 Mitarbeiter,Finanzen,weniger als 1 Million $ (USD),,3.6,53 %,100 %,,3.5,3.1,3.7,3.6,2.5,,,225,,
"Universal-Job
5.0",Bioinformatics Scientist (m/f/d),Basel,Schweiz (German),"In this role you work on the analysis, integration, and interpretation of multiple types of omics data collected as part of our clinical trials in dermatology and rheumatology. You will be responsible for: - Application of modern biostatistics and machine learning methods to high-throughput molecular and clinical data - Analysis, integration and visualization of different types of omics data, including genomics, transcriptomics and proteomics - Contextualization of results from omics experiments, including correlation with clinical endpoints and phenotypes, generation and comparison of molecular signatures, pathway- and network- level analyses - Communicating with and presenting your work to a diverse audience of biologists, clinicians and data scientists
Motivation
Are you looking to work in a global growth company where you can make a real difference? Then you are right with us!
Firmenprofil
Global Pharma Company.",,,51 bis 200 Mitarbeiter,Personalberatung,Personalwesen,100 bis 500 Millionen $ (USD),5.0,100 %,N/A,,4.0,5.0,5.0,5.0,4.0,,,225,,
"Vifor Pharma
3.1",Senior Scientist Nephrology 80,Schlieren,Schweiz (German),"We are seeking a motivated, creative and innovative Senior Scientist Nephrology to join our dynamic team at our research site in Schlieren, Zurich. In this role you will be responsible for initiating and driving internal and collaborative drug discovery projects in the therapeutic area of nephrology. You will be part of a diverse team committed to building a growing portfolio of nephrology assets from early discovery to clinical stages. Our aim is to develop drugs to improve lives of patients affected by acute and chronic kidney disease for which currently there is no adequate treatment.

Your responsibilities will include, but not be limited to:
Conception of new projects and project leadership in order to contribute to the CSL Vifor drug discovery portfolio in the areas of acute and chronic kidney disease
Combine cell biology and in vivo models expertise with strong project leadership qualities to deliver high quality data-driven packages and enable project decisions
Design, interpret and manage pharmacology studies to evaluate efficacy, pharmacokinetic, pharmacodynamic, tolerability and mechanism of action of novel therapeutics",,,1''001 bis 5''000 Mitarbeiter,Biotechnologie & Arzneimittel,Pharmazeutika & Biotechnologie,1 bis 5 Milliarden $ (USD),3.1,51 %,80 %,3.8,2.8,3.5,2.8,2.5,3.0,,,225,https://de.glassdoor.ch/Bewertungen/Vifor-Pharma-Bewertungen-E441907.htm,https://de.glassdoor.ch/Benefits/Vifor-Pharma-Benefits-E441907.htm
"ABB
4.0","(Senior) Thermal Scientist, e-Mobility (80 – 100%)",Baden,Schweiz (German),"(Senior) Thermal Scientist, e-Mobility (80 – 100%)
Take your next career step at ABB with a global team that is energizing the transformation of society and industry to achieve a more productive, sustainable future. At ABB, we have the clear goal of driving diversity and inclusion across all dimensions: gender, LGBTQ+, abilities, ethnicity and generations. Together, we are embarking on a journey where each and every one of us, individually and collectively, welcomes and celebrates individual differences.

ABB e-Mobility is a worldwide leader in electric vehicle charging infrastructure, with the most comprehensive offering in the market. Our fast DC charging products and solutions enable full charging of light and heavy vehicles within 10-30 min – a game changing technology for mass adaption of clean transportation. The mission of our Innovation Lab in Switzerland is to work on high-risk endeavors, bringing disruptive technologies for eV charging applications from research into product development. By joining us, you will work on advanced cooling concepts for our chargers. Do you want to contribute to a sustainable, green future supporting the reduction of CO2 emissions? Come join our young and multinational team and let’s power the e-Mobility revolution together!",,,Mehr als 10''000 Mitarbeiter,Elektronikherstellung,Produktion,Mehr als 10 Milliarden $ (USD),4.0,82 %,88 %,3.7,3.7,3.5,3.9,3.4,3.8,,,225,https://de.glassdoor.ch/Bewertungen/ABB-Bewertungen-E3076.htm,https://de.glassdoor.ch/Benefits/ABB-Benefits-E3076.htm
"Universal-Job
5.0",Analytical Scientist (m/f/d),Basel,Schweiz (German),"In this position you will join the Powders & Disperse Systems Team and are responsible for: - Plan, design and perform experiments to characterize pharmaceutical micro- and nanosuspensions, including illustration, interpretation and reporting of results - Develop and validate QC methods for particle and powder characterization to analyze drug products, drug substances and excipients - Provide raw data documentation, evaluation and results interpretation of scientific experiments with high focus on quality - Actively contribute to analytical method transfer to other development sites, production or contract laboratories - Contribute to maintenance of infrastructure and equipment
Motivation
Are you looking to work in a global growth company where you can make a real difference? Then you are right with us!
Firmenprofil
Global Pharma Company.",,,51 bis 200 Mitarbeiter,Personalberatung,Personalwesen,100 bis 500 Millionen $ (USD),5.0,100 %,N/A,,4.0,5.0,5.0,5.0,4.0,,,225,,
"Roche
4.3","Plasma Protein Binding Scientist, ADME Chapter, PS, pRED",Basel,Schweiz (German),"The Position
In Roche’s Pharmaceutical Research and Early Development organisation (pRED), we make transformative medicines for patients in order to tackle some of the world’s toughest unmet healthcare needs. At pRED, we are united by our mission to transform science into medicines. Together, we create a culture defined by curiosity, responsibility and humility, where our talented people are empowered and inspired to bring forward extraordinary life-changing innovation at speed.
This position is located in ADME, a chapter within Global Pharmaceutical Sciences, where the fate of new chemical entities and biologics is a primary focus.
The ADME Chapter works throughout all stages of compound development, from lead optimization to candidate selection, all clinical development phases, to the filing of new drug applications. We closely collaborate with our therapeutic areas and functions to convert hypotheses into innovative therapeutics.",,,Mehr als 10''000 Mitarbeiter,Biotechnologie & Arzneimittel,Pharmazeutika & Biotechnologie,Mehr als 10 Milliarden $ (USD),4.3,88 %,96 %,4.4,3.9,4.1,4.2,3.7,4.1,,,225,https://de.glassdoor.ch/Bewertungen/Roche-Bewertungen-E3480.htm,https://de.glassdoor.ch/Benefits/Roche-Benefits-E3480.htm
"Universal-Job
5.0",Scientist (m/f/d),Basel,Schweiz (German),"In this role, you will play a key role in the development of formulations and processes for parenteral dosage forms for proteins from early phase for clinical supply to commercial use. Your activities will include: - Plan, organize, perform and document scientific experiments as drug product functional lead - Develop phase appropriate liquid of lyophilized formulations for biologics, e.g. by using high-throughput methods for biophysical characterization and standard drug product specific analytical methods - Develop efficient and robust processes for the manufacture in sterile facilities, e.g. by applying down-scale models for critical process steps - Provide raw data documentation, evaluation and results interpretation
Motivation
Are you looking to work in a global growth company where you can make a real difference? Then you are right with us!
Firmenprofil
Global Pharma Company.",,,51 bis 200 Mitarbeiter,Personalberatung,Personalwesen,100 bis 500 Millionen $ (USD),5.0,100 %,N/A,,4.0,5.0,5.0,5.0,4.0,,,225,,
"Das Bundesamt für Meteorologie und Klimatologie MeteoSchweiz
3.4",Data Scientist für Wettervorhersagen (w / m),Locarno,Schweiz (German),"MeteoSchweiz Gut zu wissen
Als Mitarbeiter/in im Team Postprocessing und Verifikation entwickeln Sie gemeinsam mit anderen Teammitgliedern probabilistische, nahtlose, flächige Niederschlagsvorhersagen als Datengrundlage für Mobile-App, Warnungen und Impact-Systeme von Partnern (Hydrologie, Massenbewegungen BAFU, Lawinen SLF/WSL, Kantone) mit einem Fokus auf seltene Ereignisse. Dafür arbeiten sie eng mit den Stakeholdern zusammen, damit die erzeugten Daten und Visualisierungen optimal als Entscheidungsgrundlage dienen.
Ihre Aufgaben
Entwicklung, Training und Validierung von Machine-Learning oder Statistik-Algorithmen um probabilistische, nahtlose, flächige Niederschlagsvorhersagen für seltene Ereignisse als Datenprodukte oder Visualisierungen zu erstellen
Konzeption, Realisierung, Betrieb und Dokumentation von ICT-Werkzeugen zur operationellen Erstellung von Wettervorhersagen",,,Unbekannt,,,,3.4,30 %,N/A,,3.3,3.9,2.9,2.3,3.9,,,225,,
"Biogen
4.0","Sr Data Scientist, Computational Behavior Analytics, Digital Biomarkers",Baar,Schweiz (German),"Job Description

About this role
Neurologic diseases are complex and can be devastating to patients and there are still significant challenges in their screening, detection, treatment, and monitoring.
At Biogen Digital Health (BDH), we aspire to transform patients’ lives by making personalized & digital medicine in neuroscience a reality. Leveraging data-science and digital technologies, we drive solutions to advance research, clinical care, and patient empowerment.
We stand with our colleagues at Biogen developing pioneering treatments in neuroscience. We believe that now, more than ever, biology and technology should go hand-in-hand to better meet patient needs, while enabling a shift towards more prevention-focused, affordable, and equitable care.",,,5''001 bis 10''000 Mitarbeiter,Biotechnologie & Arzneimittel,Pharmazeutika & Biotechnologie,Mehr als 10 Milliarden $ (USD),4.0,72 %,57 %,4.2,3.7,4.1,3.9,3.3,3.8,,,225,https://de.glassdoor.ch/Bewertungen/Biogen-Bewertungen-E1336.htm,https://de.glassdoor.ch/Benefits/Biogen-Benefits-E1336.htm
"Roche
4.3","Scientist, Roche Cell and Organoid Biorepository at ITB (Roche Institute for Translational Bioengineering)",Basel,Schweiz (German),"The Position
In Roche’s Pharmaceutical Research and Early Development organisation (pRED), we make transformative medicines for patients in order to tackle some of the world’s toughest unmet healthcare needs. At pRED, we are united by our mission to transform science into medicines. Together, we create a culture defined by curiosity, responsibility and humility, where our talented people are empowered and inspired to bring forward extraordinary life-changing innovation at speed.
You will join the Roche Institute of Translational Bioengineering (ITB), an organisation within pRED whose goal is to harness and advance the use of human model systems in drug discovery and development, as well as personalised medicine. Our interdisciplinary research bridges academic and pharmaceutical research, connecting biologists, engineers, and data scientists.
We partner and collaborate with leading scientific institutions worldwide to tackle grand challenges by assembling, funding, and leading interdisciplinary teams of experts to work on highly ambitious and complex scientific questions.",,,Mehr als 10''000 Mitarbeiter,Biotechnologie & Arzneimittel,Pharmazeutika & Biotechnologie,Mehr als 10 Milliarden $ (USD),4.3,88 %,96 %,4.4,3.9,4.1,4.2,3.7,4.1,,,225,https://de.glassdoor.ch/Bewertungen/Roche-Bewertungen-E3480.htm,https://de.glassdoor.ch/Benefits/Roche-Benefits-E3480.htm
"Philip Morris International
4.1","Sr Scientist - Statistician Neuchatel, Switzerland Life Sciences",Neuenburg,Schweiz (German),"Sr Scientist – Statistician, Neuchatel, Switzerland

Be a part of a revolutionary change.

At PMI, we’ve chosen to do something incredible. We’re totally transforming our business, and building our future on smoke-free products.

With huge change, comes huge opportunity. So, wherever you join us, you’ll enjoy the freedom to dream up and deliver better, brighter solutions and the space to move your career forward in endlessly different directions.

It’s so rare in R&D that everything aligns to create the ideal conditions for outstanding work. Right now, at PMI, that’s exactly what’s happening. R&D is the driving force for our bold new vision: to replace cigarettes with a revolutionary portfolio of alternative products.

Join us and you’ll have the resources, support and technology you need to break new ground and see ideas come to life. You’ll be surrounded by some of the brightest scientists in their fields, with fast access to subject experts and commercial decision-makers.

If you’re creative, courageous and ready to take risks, you can make a huge impact and propel your career in an endless number of directions. Ultimately, by delivering our smoke-free and beyond nicotine future.

This opening is for talent pipelining. If you recognize yourself in the description below and you are curious to better understand our vision, do not hesitate to apply. We will contact you if you are meeting the criteria.

More specifically, you'll


Who we’re looking for


What we offer

Our success depends on the people who come to work every single day with a sense of purpose and an appetite for progress. Join PMI and you too can:



#LIJobs",,,Mehr als 10''000 Mitarbeiter,Konsumgüterproduktion,Produktion,Mehr als 10 Milliarden $ (USD),4.1,80 %,87 %,4.6,3.6,4.3,3.8,3.4,3.5,,,225,,https://de.glassdoor.ch/Benefits/Philip-Morris-International-Benefits-E7745.htm
