Company Name,Job Title,Location,Country,Job Description,Salary Estimate,Avg Salary,Size,Industry,Sector,Revenue,Rating,Recommend,CEO,Benefits,Opportunities,Comp Benefits,Culture,Management,WorkLife Balance,Pros,Cons,Num Listings,Reviews URL,Benefits URL
"New Zealand Police
3.8",Data Scientist,Wellington,New Zealand,"Data Scientists, it starts with you!

Based on Police National Headquarters, Wellington
Band J ( Salary starting from $102,178)
Permanent, full time
Multiple vacancies available
Nationally Advertised Vacancy
JR 3822701",$84K - $145K (Glassdoor Est.),"$124,622",10000+ Employees,National Services & Agencies,Government & Public Administration,$1 to $5 million (USD),3.8,54 %,48 %,4.0,3.6,3.1,3.2,2.9,2.8,,,93,https://www.glassdoor.co.nz/Reviews/New-Zealand-Police-Reviews-E573866.htm,https://www.glassdoor.co.nz/Benefits/New-Zealand-Police-Benefits-E573866.htm
Science New Zealand,Research Technician - Manaaki Whenua,Wellington,New Zealand,"We are looking for a versatile energetic technician, with skills in field and laboratory work and the collation and analysis of data.
The purpose of this role is to provide technical support for scientists leading research on soil carbon and nitrogen cycling. The role includes fieldwork, soil, plant and water sampling, management of field equipment and laboratory analysis of biological, and chemical properties of soil, plants, and water.
This position is permanent full-time, reports to Capability Leader, Land Use and Ecosystems Team, and is based at our Hamilton site.
You will possess a relevant tertiary qualification in soil or agricultural science or related discipline. You will have knowledge of New Zealand soils, including the New Zealand Soil Classification, and an understanding of soil carbon and nitrogen cycling. You will have some experience in conducting fieldwork including soil sampling and an understanding of New Zealand's agricultural systems. Ideally you will have excellent communication skills, be well-organised, and pragmatic with the ability to travel throughout New Zealand, especially the North Island. A full driving license is essential.",$84K - $145K (Glassdoor Est.),"$74,549",1001 to 5000 Employees,,,,,,,,,,,,,,,93,,
Science New Zealand,Research Technologist - Laboratory - Plant & Food Research,Christchurch,New Zealand,"Cropping Systems and Environment
Lincoln, New Zealand
Vacancy number 48741
Salary range: $55,665 to $83,497
Full Time, Fixed Term for 6 months
Are you looking for experience to further your chemistry career contributing to exciting science projects?
What you will be doing | Ngā whāinga matua
Working as part of our Laboratory Operations team, you will support technical delivery of applied and fundamental environmental research. This role has a chemistry focus with the Cropping Systems and Environment laboratories responsible for preparation and analysis of soil, plant and water samples. Working across multiple projects you will be involved in data stewardship, general laboratory work, administration and technical troubleshooting. Liaising with scientists, laboratory colleagues, and other PFR staff nationally, you will provide efficient and timely support across a range of projects whilst ensuring SOPS, safe work practice and containment measures are followed.",$84K - $145K (Glassdoor Est.),"$90,499",1001 to 5000 Employees,,,,,,,,,,,,,,,93,,
Science New Zealand,Environmental Information Technician - NIWA,Christchurch,New Zealand,"NIWA is New Zealand's leading environmental science research institute and the key provider of atmospheric, freshwater, marine research and consultancy services. NIWA's Technology and Innovation portfolio has a vacancy within its Environmental Information Group.
The Environmental Information Group consists of Engineers, Technicians and Scientists who are NIWA's core capability for the development, operation, and monitoring of environmental data systems. We are looking for an enthusiastic and motivated individual to join our team in Christchurch.
The position will provide technical and general environmental information skills to ensure near real time environmental data collection and management systems operate robustly, diagnose operational issues, support field technicians making operational changes, and suggest and implement operational improvements.
You will have a relevant tertiary qualification and/or experience in environmental data measurement systems, telemetry operations, instrumentation, electronics, and the capability to expand on and learn new technical skill sets. A high degree of organisation, excellent people-communication skills, and a current NZ driver's licence are essential. This position may encompass a range of roles and responsibilities, depending on the particular skills and experience of the successful applicant.",$84K - $145K (Glassdoor Est.),"$62,682",1001 to 5000 Employees,,,,,,,,,,,,,,,93,,
Science New Zealand,Physical Oceanographer - NIWA,Wellington,New Zealand,"NIWA is a dynamic research organisation and New Zealand's largest and pre-eminent provider of climate, freshwater and marine science. Our core purpose is to enhance the economic value and sustainable management of New Zealand's aquatic resources and environments, to provide an understanding of climate and the atmosphere, and increase resilience to weather and climate hazards to improve safety and wellbeing of New Zealanders.
What we're looking for
NIWA is seeking an Oceanographer who will have a focus on observational physical oceanography of shelf sea systems including the understanding of processes such as coastal currents, eddies, stratification, mixing, boundary-layers, internal waves, river plumes and shelf-break mechanics. The work will extend to include interdisciplinary understanding related to the physics including projects with biological, ecological, sedimentation, biogeochemical focus.",$84K - $145K (Glassdoor Est.),"$64,175",1001 to 5000 Employees,,,,,,,,,,,,,,,93,,
"EHS Support
4.7",Environmental Scientist (Mid-Level),Remote,New Zealand,"Do you want a career where you can make a real difference? One with an organization where intellectual curiosity, focus, and hard work are rewarded with opportunity? An organization known for doing things differently and providing practical, effective, and long-term solutions? At EHS Support, we take pride in doing important work that has a lasting impact. Here we define success by what our people achieve through the effective application of science, communication, and a lot of hard work. If you’re just looking for a job, we are not your company. On the other hand, if you want to fix real problems…if you want to learn, grow, and evolve…then EHS Support is the company for you.
What are the perks of joining EHS Support? We offer career programming to help you grow your expertise within the industry, work from home positions with equipment provided, diverse projects, relocation assistance opportunities, work abroad programs, performance bonuses and competitive compensation
Location: Work from Home Position (If hired, you can expect up to 20-25 % of your time will comprise short-term and extended travel trips within New Zealand.)
Typical responsibilities will include:",$84K - $145K (Glassdoor Est.),,1 to 50 Employees,,,,4.7,100 %,N/A,,4.5,4.5,5.0,5.0,5.0,,,93,,
Science New Zealand,Climate Applications Scientist - NIWA,Wellington,New Zealand,"Climate Applications Scientist - NIWA
Are you passionate about supporting climate resilience within New Zealand and the Pacific Islands region? Do you have a flare for understanding end-user and climate-sensitive sector needs and turning climate data in to actionable and decision-relevant information? Are you keen to work collaboratively with colleagues from different technical and sectoral disciplines across the Pacific region? If so, then this position provides an exciting opportunity for you.
Based at NIWA in Wellington, New Zealand (Auckland, Hamilton, or Christchurch may be considered)
Permanent, full-time
About NIWA
NIWA is a dynamic research organisation whose purpose is to enhance the economic value and sustainable management of New Zealand's marine and freshwater resources, to provide understanding of climate and atmospheric state and processes, and increase resilience to weather and climate-related hazards to improve safety and wellbeing of New Zealanders. NIWA is also heavily involved in a wide range of initiatives working with colleagues within the Pacific Islands region.",$84K - $145K (Glassdoor Est.),"$88,034",1001 to 5000 Employees,,,,,,,,,,,,,,,93,,
"Jacobs
4.0",Hydrologist and Flood Modeller,Auckland,New Zealand,"Our People & Places Solutions business – reinforces our drive to improve the lives of people everywhere and epitomizes the ""why"" of what we do – the tremendous positive impact and value our solutions bring to our communities and society as a whole. From facilities delivering life-saving therapies and ensuring clean water to enabling the connection of people through all modes of transportation and providing access to technology – we're integrating a multitude of these solution elements to build the smart environments of tomorrow.

Start your Jacobs career with a company that inspires and empowers you to deliver your best work so you can evolve, grow and succeed – today and into tomorrow.


Your Impact:

Our bodies and environment all depend on water, it is the building block that supports all life. Water issues are becoming increasingly prominent as we struggle with disparity between water availability and demands, water pollution, and competition for limited water resources. At Jacobs, our scientists, engineers, and planners are working together with clients to find the right solutions to their water challenges.",$84K - $145K (Glassdoor Est.),,10000+ Employees,Architectural & Engineering Services,"Construction, Repair & Maintenance Services",$10+ billion (USD),4.0,81 %,91 %,4.0,3.8,3.6,4.1,3.7,3.9,,,93,https://www.glassdoor.co.nz/Reviews/Jacobs-Reviews-E913.htm,https://www.glassdoor.co.nz/Benefits/Jacobs-Benefits-E913.htm
Institute of Data,Course Advisor,Auckland,New Zealand,"About Us
The Institute of Data is a Professional Network of Data Scientists, Cyber Security Analysts and Digital Marketers. In partnership with leading universities in the United States, Australia, New Zealand and the government of Singapore and hundreds of employers, we transform careers for a data-driven world.
The Institute of Data operates in the information technology sector. Demand for our training products is driven by the information capability recruitment needs of business. These capabilities, in the areas of security, compliance, operational efficiency, growth and decision making are more important to business now than ever before.
Our courses are unlike those offered at traditional education providers. With remote and in- person, you can up-skill from anywhere. Beyond learning knowledge, process and theory, you will experience the real power of practical training by industry experts – allowing you to confidently practice and work in the industry.",$84K - $145K (Glassdoor Est.),"$57,500",,,,,,,,,,,,,,,,93,,
Potentia,Senior Data Scientist,Auckland,New Zealand,"The opportunity:
An exciting opportunity awaits a high performing Data Scientist who enjoys using a range of data science techniques to better understand electricity and gas markets, often by forecasting prices and their underlying drivers. The successful candidate will help to maintain existing models, build/maintain new models, and perform basic ad hoc analyses as required. They will work quickly and efficiently with a focus on delivering useful outcomes.

Company profile:
Our client is a boutique trading firm which focuses on wholesale electricity and gas markets in the Asia-Pacific region. They are a mix of quantitative finance with a fast-paced start-up culture. Bring your great attitude to work, not your suit and tie.

Responsibilities and Duties






If this sounds like you,",$70K - $111K (Glassdoor Est.),"$88,048",1 to 50 Employees,HR Consulting,Human Resources & Staffing,Unknown / Non-Applicable,,,,,,,,,,,,93,,
Science New Zealand,Science Group Leader - Data Science - Plant & Food Research,Auckland,New Zealand,"Flexible location at any one of PFR sites
Permanent Full Time
Vacancy number 48698
Our Data Science group at Plant and Food Research both lead and support a wide range of science activities across the organisation. The group is home to critical capabilities in statistical analysis and development of data applications, areas that are vital to our mission to create the most sustainable food systems in the world. This role is vital to continue lifting the capability and impact that data brings to our research and the performance of all our teams.
What you will be doing | Ngā whāinga matua",$70K - $111K (Glassdoor Est.),"$87,750",1001 to 5000 Employees,,,,,,,,,,,,,,,93,,
"Dentsu Aegis Network
3.6",Audience Analytics Specialist,Auckland,New Zealand,"The purpose of this role is data analysis/guided deliverable development in support of assessment/strategic deliverables.
Job Title:
Audience Analytics Specialist
Job Description:
Dentsu Media | Auckland | Permanent full time
Flexible working for a balance that suits you, your team, and clients
Additional annual leave after 2 years of service plus additional wellness days each year
Unlimited learning opportunities with our global online learning platform dentsu University
Join a collaborative, entrepreneurial and close-knit team
About us

Auckland
Dentsu Media
Full time
Permanent",$70K - $111K (Glassdoor Est.),"$87,750",5001 to 10000 Employees,Media & Communication,Unknown / Non-Applicable,,3.6,69 %,80 %,,3.5,3.2,3.5,3.3,3.3,,,93,https://www.glassdoor.co.nz/Reviews/Dentsu-International-Reviews-E982213.htm,
"NZ Ministry for Primary Industries
3.9",Senior Technician,Auckland,New Zealand,"Role type: Fixed Term, Full Time (to June 2023)
Location: Auckland
Salary range: $60,331 to $70,977 depending on skills and experience

Kōrero mō te tūranga - About the Role
The Ministry for Primary Industries' Plant Health and Environment Laboratory in Auckland has a vacancy for a fixed-term, full-time Senior Technician in the Bacteriology & Botany team. You'll provide technical support for professional diagnostic and advisory services for plant specimens collected across a range of activities.
Our Bacteriology & Botany team is dedicated, diverse and highly supportive. We operate in a busy and varied environment to deliver our core work programme supporting New Zealand's biosecurity system and our stakeholders. You will provide laboratory maintenance; diagnostic processing for bacteria, fungi, and plant specimens collected during surveillance and investigation activities, or intercepted at the border / post entry quarantine; routine diagnoses; contribute to diagnostic capability development; and data management. All work in the laboratory is done under the international quality management standard ISO 17025.
The position also provides variety and challenge to develop and enhance your technical expertise in plant pathology & botany while working with a team of scientists.

Mōu - About You


Preference will be given to applicants with a strong background in PCR, who have worked within a quality environment, have proven planning and organisational skills, are able to prioritise under pressure and adapt to changing demands.

Mō tō mātou rōpū - About the Team
The Plant Health & Environment Laboratory (PHEL) is the national reference centre for the identification of all suspected exotic, new and emerging pests and diseases of plants, and arthropod pests affecting the environment. PHEL also provide diagnostic services to primary industries to facilitate trade. The laboratory is accredited to ISO 17025.
We have specialised facilities including a Level 3B quarantine glasshouse and Level 3 tissue culture facility, containment laboratories, equipment for molecular and serological procedures, a transmission electron microscope, light microscopes (enabled for remote diagnostics), and reference collections of pests.

Me pēhea te tuku tono - How to ApplyTo view the position description and/or apply online, please click “APPLY FOR THIS JOB” or visit the MPI Careers Site.
To apply for this role you must hold the right to work in New Zealand or be eligible to obtain it – click here to find out more about work visa eligibility and options.
Applications close at midnight on 28 October 2022.
If you have any questions about the role, please email tegan.parry-thompson@mpi.govt.nz

The Ministry for Primary Industries is committed to providing a working environment that embraces and values inclusion and diversity. Your unique talents and experience will help us deliver exceptional services to our communities in Aotearoa. In return you'll enjoy an inclusive and flexible working environment in a diverse team of people while you're growing your career here in NZ and internationally. We actively encourage applications from all backgrounds. If you have any support or access requirements, we encourage you to tell us when you apply so that we can assist you through the recruitment process.",$70K - $111K (Glassdoor Est.),"$55,000",1001 to 5000 Employees,National Services & Agencies,Government & Public Administration,$100 to $500 million (USD),3.9,76 %,65 %,3.3,3.7,3.4,3.8,3.4,4.0,,,93,https://www.glassdoor.co.nz/Reviews/Ministry-for-Primary-Industries-New-Zealand-Reviews-E753127.htm,https://www.glassdoor.co.nz/Benefits/Ministry-for-Primary-Industries-New-Zealand-Benefits-E753127.htm
"Waikato Regional Council
3.1",SENIOR SCIENTIST - WATER,Hamilton,New Zealand,"About us:
We want more good people to come and do great things with us.
We love where we live. That’s why we work so hard to look after our region and the people who live and work in the Waikato region.
Customers sit at the heart of everything we do, and all staff have an important role to play in the delivery of exceptional customer service.
Our work is as diverse as the region we care for; from the tip of the Coromandel Peninsula to the slopes of Ruapehu. We’ve got ambitious goals and there are some tricky issues, but that’s what makes it so interesting.
Looking for flexible ways of working options, at Waikato Regional Council we are committed to working more creatively to ‘get work done’ in a way that is of mutual benefit to you, the organisation, and our communities.",$70K - $111K (Glassdoor Est.),"$77,216",201 to 500 Employees,,,,3.1,60 %,N/A,,3.1,3.0,3.2,2.6,3.4,,,93,https://www.glassdoor.co.nz/Reviews/Waikato-Regional-Council-Reviews-E2320858.htm,
"AgResearch Careers
4.0",Scientist,Waikato,New Zealand,".
Who we are

At AgResearch, our purpose is to use science to enhance the value, productivity, and profitability of New Zealand’s pastoral, agri-food, and agri-technology sector value chains to contribute to economic growth and beneficial environmental and social outcomes for New Zealand. We are committed to the knowledge system of mātauranga Māori on equal footing with Western science and existing structures, that have helped support positive change in farming practices and food production in Aotearoa.
.",$70K - $111K (Glassdoor Est.),,501 to 1000 Employees,Research & Development,Management & Consulting,Unknown / Non-Applicable,3.8,84 %,100 %,4.0,3.2,3.4,3.8,3.2,4.2,,,93,,https://www.glassdoor.co.nz/Benefits/AgResearch-NZ-Benefits-E746833.htm
Science New Zealand,Oceanographic Instrumentation Technician - NIWA,Wellington,New Zealand,"NIWA is a dynamic research organisation and New Zealand's largest and pre-eminent provider of climate, freshwater, and marine science. Our core purpose is to enhance the economic value and sustainable management of New Zealand's aquatic resources and environments, to provide an understanding of climate and the atmosphere, and increase resilience to weather and climate hazards to improve safety and wellbeing of New Zealanders.
This is an exciting opportunity to join New Zealand's internationally renowned environmental research organisation, and work as part of a progressive and innovative team. The Ocean Deployments Team works on science and consulting projects across NIWA, supporting physical oceanography, biogeochemistry, marine geology, fisheries and ecology.
This position will be working with oceanographic equipment with a specific focus on instrumentation, data processing and archiving. Your tasks will include:",$70K - $111K (Glassdoor Est.),"$67,350",1001 to 5000 Employees,,,,,,,,,,,,,,,93,,
"PredictHQ
4.0",Data Scientist,Remote,New Zealand,"Who are we?
PredictHQ is the leading source of demand intelligence, enabling global companies to accurately predict and prepare for demand anomalies. Our vision is to predict the catalyst behind any form of demand.
We cover every major category from conferences and concerts to live, unscheduled events such as extreme weather or airport delays. Our expertise is in verifying, enriching, and adding intelligence to the millions of significant events that impact demand, so companies can act before it's too late.
Our teams are creating advanced machine learning algorithms, using data from thousands of sources around the world, processing it through our modern, microservices based pipeline - and exposing it to customers via a powerful API. Some of the world’s most exciting companies such as Uber, Amazon Alexa, Accor Hotels, and Domino’s Pizza rely on us to learn from the past and predict their future.",$70K - $111K (Glassdoor Est.),,51 to 200 Employees,Enterprise Software & Network Solutions,Information Technology,Unknown / Non-Applicable,4.0,76 %,86 %,,3.4,3.8,4.2,3.7,4.2,,,93,,
"Worley
3.6",Project Administrator,New Zealand,New Zealand,"Company : Worley
Primary Location
: New Zealand
Job
: Administrative Support
Schedule
: Full-time",$70K - $111K (Glassdoor Est.),,10000+ Employees,Energy & Utilities,"Energy, Mining, Utilities",$5 to $10 billion (USD),3.6,72 %,82 %,2.0,3.3,3.2,3.5,3.1,3.5,,,93,,https://www.glassdoor.co.nz/Benefits/Worley-Benefits-E35193.htm
"The University of Auckland
4.2",Technologist | Liquid Chromatography–Mass Spectrometry,Auckland,New Zealand,"Auckland, New Zealand
Full-time
UoA Department Name: Technical Services
Campus: Auckland City Campus
Contract Type: Permanent
Position Number: 55559682
Company Description
Waipapa Taumata Rau | The University of Auckland

Ko te whare Pūtaiao | The Faculty of Science brings together 10 diverse schools and departments to provide outstanding quality teaching and research opportunities. We are the leading Faculty of Science in New Zealand.",$70K - $111K (Glassdoor Est.),"$89,247",5001 to 10000 Employees,Colleges & Universities,Education,$2 to $5 billion (USD),4.2,82 %,85 %,3.9,3.7,3.4,4.1,3.7,4.3,,,93,https://www.glassdoor.co.nz/Reviews/University-of-Auckland-Reviews-E221623.htm,https://www.glassdoor.co.nz/Benefits/University-of-Auckland-Benefits-E221623.htm
"Statistics New Zealand
4.0",Kaitātari Hoahoa – Kaimātai Pūtaiao Raraunga | Design Analyst – Data Scientist,Christchurch,New Zealand,"Mōu | For you
Tatauranga Aotearoa Stats NZ are dedicated to diversity, equity, inclusion, health and wellbeing. We welcome every gender, ethnicity, ability, religion, age and background and encourage people to be their authentic selves.
Starting salary: $76,571- $90,084 negotiable + superannuation
Flexible by default, balance life and work commitments
Develop and grow your career (coaching, training, study support, secondments)
Contribute to meaningful work that makes a difference to all people in Aotearoa
3 extra annual leave days (taken during Christmas office closure), see careers site for other benefits and networks",$70K - $111K (Glassdoor Est.),"$80,000",501 to 1000 Employees,National Services & Agencies,Government & Public Administration,$100 to $500 million (USD),4.0,70 %,75 %,3.5,3.6,3.0,3.9,3.5,4.4,,,93,https://www.glassdoor.co.nz/Reviews/Department-of-Statistics-New-Zealand-Reviews-E696500.htm,https://www.glassdoor.co.nz/Benefits/Department-of-Statistics-New-Zealand-Benefits-E696500.htm
HarperSmith,ENVIRONMENTAL SCIENTIST,Christchurch,New Zealand,"Leading South Island Consultancy with an established client base and strong forward workload are seeking an Environmental Scientist to join their team. The team of environmental specialists offer clients expertise in contaminated land investigation and management, site investigations, environmental monitoring and audits and consents.

The role will be responsible for completing site invesigations, analyzing environmental data, technical report writing and developing relationships with stakeholders.

Candidates with the following skills and qualifications will be considered:
2-5 years relevant working experience in environmental science or contaminated land.
Tertiary qualifications in the relevant subject
Competent in running your own projects
For a confidential discussion, please contact Stephen Smith on 021 664 367 or email a copy of your CV to stephen@harpersmith.co.nz.

All enquiries and applications to Harper Smith Recruitment are treated in strict confidence. Under no circumstances does Harper Smith Recruitment provide information either written or verbally on any candidate to any client without prior approval from the candidate.",$70K - $111K (Glassdoor Est.),"$84,232",1 to 50 Employees,,,,,,,,,,,,,,,93,,
