Company Name,Job Title,Location,Country,Job Description,Salary Estimate,Avg Salary,Size,Industry,Sector,Revenue,Rating,Recommend,CEO,Benefits,Opportunities,Comp Benefits,Culture,Management,WorkLife Balance,Pros,Cons,Num Listings,Reviews URL,Benefits URL
"The Coca-Cola Company
4.0",Data Engineer,Ciudad de México,México,"We are looking for a Data Engineer to join our growing data engineering team on a transformation journey to ""Data as a Product"" delivering business value through features based on customer needs. Will be responsible for expanding and optimizing data pipeline and data flow. The ideal candidate is a passionate, strong aptitude for technology and the interest and drive to enhance data engineering skills. Who enjoys optimizing data systems and building them from the ground up. As a Junior Data Engineer, you will support our software developers, database architects, data analysts, and data scientists on data initiatives and ensure optimal data delivery architecture is consistent with ""Data as a Product"" mindset delivery.
Responsibilities for Data Engineer
Translate business needs to technical specifications
Participate in collaborative software design and development of the analytical products using Azure Data Services (Azure Analysis Services, Synapse Analytics, CosmosDB, Spark/Databricks, PowerBI etc.).",14 k$ - 18 k$ (Est. del Empleador),,Más de 10 000 empleados,Producción de alimentos y bebidas,Manufactura,Más de $10 000 millones (USD),4.0,79 %,85 %,4.1,3.8,4.0,3.9,3.6,3.6,,,145,https://www.glassdoor.com.mx/Evaluaciones/The-Coca-Cola-Company-Evaluaciones-E161.htm,https://www.glassdoor.com.mx/Benefits/The-Coca-Cola-Company-Benefits-E161.htm
"Teradata
3.9",Senior Performance Test Engineer,Ciudad de México,México,"Teradata is seeking a highly skilled performance test engineer with a strong background in database concepts and cloud platform architecture with a proven track record for delivering complex and comprehensive performance analysis deliverables, associated with the complete software development life cycle for products, systems and solutions. Deliverables encompass performance benchmark development pushing performance test assets to CI/CD pipeline, test plans and specifications, test execution, problem isolation and defect reporting. This position requires significant interaction with data scientists, product management, product engineers, test engineers and test engineering management.

The successful candidate is required to apply expert knowledge in cloud architecture and system fundamentals, as well as test methodologies to develop and execute highly complex system level benchmarks which stress the performance of various facets of the Teradata system and warehouse product suite. The candidate will continually seek innovative solutions for coverage, effectiveness and efficiency improvements. The Performance Test team is chartered with providing performance characterization and certification of the warehouse foundation, including platforms, Teradata Database and Teradata Tools and Utilities. The candidate is also required to examine ever increasing customer applications of the integrated Teradata Vantage Platform for Advanced SQL Engine and develop benchmarks to be added to the group’s performance test asset base.


Develop and perform performance benchmark testing in support of Teradata development Life Cycle
Contribute to system test specifications and plans
Perform problem detection, isolation and reporting activities
Provide accurate and timely reporting of project status to senior management
Interface and interact with cross-functional teams including data scientists, product management, test engineers, hardware and software engineers and engineering management

Contribute to new automation and test tool requirements


Solid understanding of Operating System fundamentals
Experience in performance analysis, benchmarking.
Strong understanding on database concepts.

Hands-on experience with AWS/Azure/GC.
Teradata Database knowledge is preferred.
Ability to find root causes of performance bottlenecks.
Knowledge of Jenkins, python/java and SQL.
Proven ability to leverage industry standard test methodologies.

Effective written and oral communication skills with strong ability to communicate complex technical information effectively.
Results oriented with demonstrated ability to manage multiple competing priorities


Bachelor’s degree with 4 years of related work experience in computer science or related discipline or
Master’s degree with 2 years of related work experience in computer science or related discipline or

PhD with internships and/or 0 years.",14 k$ - 18 k$ (Est. del Empleador),,Más de 10 000 empleados,Desarrollo de equipos informáticos,Tecnologías de la información,De $1000 a $5000 millones (USD),3.9,74 %,86 %,4.9,3.5,3.7,4.0,3.4,4.0,,,145,https://www.glassdoor.com.mx/Evaluaciones/Teradata-Evaluaciones-E14638.htm,https://www.glassdoor.com.mx/Benefits/Teradata-Benefits-E14638.htm
"PepsiCo
3.9",Enterprise Data Operations Analyst,México,México,"Responsibilities

Are you looking for a challenging opportunity in an organization with a dynamic, innovative and diverse environment?

If so, your future is at PepsiCo. As a world class company, we seek excellence in everything we do. Therefore, we need talented and innovative people who are passionate about what they do.

For more information you can enter www.pepsico.com

Now we are looking for this position:

DMO Associate Analyst – Customer



We are PepsiCo. We are a diverse organization, spread among 200 countries and united by a shared set of values and goals. That’s why we Perform with Purpose. Together, we blaze new trails, succeed, celebrate and never settle for second best. At PepsiCo, we’re committed to performing well as individuals and in teams, to strengthen the company as a whole.
Our employees are at the heart of PepsiCo. Through the Company's commitment to Talent Sustainability, we continue to support the development of employees. At PepsiCo, you get the best of both worlds: an entrepreneur’s mindset plus global reach and resources. Our collaborative culture and worldwide presence generate a stream of new opportunities to define the future and propel your life’s work. Bring your unique perspective. Bring curiosity. Bring ingenuity and your drive. We will give you a platform to be daring on a global scale.

PepsiCo operates in an environment undergoing immense and rapid change. Big-data and digital technologies are driving business transformation that is unlocking new capabilities and business innovations in areas like eCommerce, mobile experiences and IoT. The key to winning in these areas is being able to leverage enterprise data foundations built on PepsiCo’s global business scale to enable business insights, advanced analytics, and new product development. PepsiCo’s Data Management and Operations team is tasked with the responsibility of developing quality data collection processes, maintaining the integrity of our data foundations and enabling business leaders and data scientists across the company to have rapid access to the data they need for decision-making and innovation.
What PepsiCo Data Management and Operations does:

The DMO Associate Analyst in the customer domain will be responsible for collecting, evaluating, and aligning master data process information into MDG, S4 HANA in accordance with Data Governance Policies & the PepsiCo Global Template (PGT Program). The objective of this role is to execute the business processes implemented for material master data maintenance (workflows, screens, data rules). This role is key in ensuring high quality master data records are created and maintained to support business transactions, reporting, & other data requirements in MDG, S4 HANA, and legacy systems.



Key Accountabilities:
Qualifications:

Skills, Abilities, Knowledge:",14 k$ - 18 k$ (Est. del Empleador),,Más de 10 000 empleados,Producción de alimentos y bebidas,Manufactura,Más de $10 000 millones (USD),3.9,79 %,87 %,4.4,3.8,3.9,3.8,3.6,3.4,,,145,,https://www.glassdoor.com.mx/Benefits/PepsiCo-Benefits-E522.htm
"Worley
3.6",Tecnico de HSE (Control de Accesos),Veracruz,México,"51,000 people. 49 countries. Over 120 office locations.
We’re not just engineers. We’re a global team of data scientists, consultants, construction workers and innovators all working to create a better tomorrow. Every day, we help customers in energy, chemicals and resources get one step closer to solving our planet’s toughest issues. Climate change. The energy transition. Digital transformation. And how we can deliver a more sustainable world.?
Whatever your ambition, there’s a path for you here. And there’s no barrier to your potential career success. For more information, visit Worley.com
General Purpose of Role
Asegurar la correcta integración de los expedientes del personal de acuerdo con los requisitos de seguridad y salud, como prerrequisito para el ingreso y la posterior emisión de credenciales de todo el personal para ingresar al sitio.",14 k$ - 18 k$ (Est. del Empleador),,Más de 10 000 empleados,Electricidad y Servicios públicos,"Energía, minería e infraestructura pública",De $5000 a $10 000 millones (USD),3.6,72 %,82 %,4.0,3.3,3.2,3.5,3.1,3.5,,,145,,https://www.glassdoor.com.mx/Benefits/Worley-Benefits-E35193.htm
"Worley
3.6",Civil Designer Level II,Ciudad de México,México,"51,000 people. 49 countries. Over 120 office locations.
We’re not just engineers. We’re a global team of data scientists, consultants, construction workers and innovators all working to create a better tomorrow. Every day, we help customers in energy, chemicals and resources get one step closer to solving our planet’s toughest issues. Climate change. The energy transition. Digital transformation. And how we can deliver a more sustainable world.?
Whatever your ambition, there’s a path for you here. And there’s no barrier to your potential career success. For more information, visit Worley.com
Deberes y Responsabilidades:

Será responsable generalmente de producir dibujos de croquis y cálculos del ingeniero. Este trabajo será ejecutado bajo supervisión general con algún ejercicio de criterio. Sus responsabilidades primarias incluirán:",14 k$ - 18 k$ (Est. del Empleador),,Más de 10 000 empleados,Electricidad y Servicios públicos,"Energía, minería e infraestructura pública",De $5000 a $10 000 millones (USD),3.6,72 %,82 %,4.0,3.3,3.2,3.5,3.1,3.5,,,145,https://www.glassdoor.com.mx/Evaluaciones/Worley-Evaluaciones-E35193.htm,https://www.glassdoor.com.mx/Benefits/Worley-Benefits-E35193.htm
"Apptegy
4.9",Senior Data Engineer,Monterrey,México,"About Apptegy

Since our start in 2015, we’ve gone from a group of individuals to a community pushing toward the same goal of building a fantastic company with great people, great products, and, most importantly, a great culture.

Apptegy is building products to empower school leaders to run better schools. We are building the first marketing platform for schools. Thrillshare, our publishing platform, makes it easy for schools to share positive stories with their communities and the world.

We are growing quickly and are focused on bringing thoughtful, high-performers together to craft amazing products for our clients. We’ve been able to build an exceptional engineering team that cares about their work and each other.

A Data Engineer at Apptegy is...",14 k$ - 18 k$ (Est. del Empleador),,De 201 a 500 empleados,Desarrollo de equipos informáticos,Tecnologías de la información,Desconocido/no corresponde,4.9,98 %,98 %,4.0,4.7,4.8,5.0,4.8,4.7,,,145,https://www.glassdoor.com.mx/Evaluaciones/Apptegy-Evaluaciones-E1516852.htm,https://www.glassdoor.com.mx/Benefits/Apptegy-Benefits-E1516852.htm
"Altair Engineering
4.2",Business Development Representative,Ciudad de México,México,"Transforming the Future with the Convergence of Simulation and Data
We are looking for our next Business Development Representative in Mexico City
Do you like a challenge, are you a complex thinker who likes to solve problems? If so, then you might be the new Altairian we are searching for. At Altair, your curiosity matters. We pride ourselves on a business culture that enables open, creative thinking, and we deeply value our employees and their contributions towards our clients' success, as well as our own.
Job Summary:
Altair’s Simulation Division is looking build our next generation of sales leaders. We are actively looking to hire recent college graduates who have a history of success in school, athletics and in their past work experience to join our BDR Team!",14 k$ - 18 k$ (Est. del Empleador),"$21,000",De 1001 a 5000 empleados,Desarrollo de equipos informáticos,Tecnologías de la información,De $100 a $500 millones (USD),4.2,84 %,92 %,5.0,3.8,3.6,4.2,3.8,4.2,,,145,https://www.glassdoor.com.mx/Evaluaciones/Altair-Engineering-Evaluaciones-E20320.htm,https://www.glassdoor.com.mx/Benefits/Altair-Engineering-Benefits-E20320.htm
"Worley
3.6",Project Planner II,Ciudad de México,México,"48,000 people. 49 countries. Over 120 office locations.
We’re not just engineers. We’re a global team of data scientists, consultants, construction workers and innovators all working to create a better tomorrow. Every day, we help customers in energy, chemicals and resources get one step closer to solving our planet’s toughest issues. Climate change. The energy transition. Digital transformation. And how we can deliver a more sustainable world.
Whatever your ambition, there’s a path for you here. And there’s no barrier to your potential career success. For more information, visit Worley.com
Position Summary
Responsabilidades:
El candidato deberá tener la capacidad de preparar cronogramas complejos de ingeniería y construcción para propuestas y proyectos; dar mantenimiento a cronogramas complejos; preparar informes para la gerencia con respecto a las actividades de programación del proyecto y asegurar el mantenimiento de todos los demás registros e informes esenciales, trabajará en estrecha colaboración con la dirección de proyectos para mejorar el desempeño en la planificación y ejecución de proyectos",14 k$ - 18 k$ (Est. del Empleador),,Más de 10 000 empleados,Electricidad y Servicios públicos,"Energía, minería e infraestructura pública",De $5000 a $10 000 millones (USD),3.6,72 %,82 %,4.0,3.3,3.2,3.5,3.1,3.5,,,145,https://www.glassdoor.com.mx/Evaluaciones/Worley-Evaluaciones-E35193.htm,https://www.glassdoor.com.mx/Benefits/Worley-Benefits-E35193.htm
"Worley
3.6",Senior Safety Engineer,Ciudad de México,México,"Company : Worley
Primary Location
: MEX-DF-Mexico City
Job
: Safety and Risk
Schedule
: Full-time",14 k$ - 18 k$ (Est. del Empleador),,Más de 10 000 empleados,Electricidad y Servicios públicos,"Energía, minería e infraestructura pública",De $5000 a $10 000 millones (USD),3.6,72 %,82 %,4.0,3.3,3.2,3.5,3.1,3.5,,,145,https://www.glassdoor.com.mx/Evaluaciones/Worley-Evaluaciones-E35193.htm,https://www.glassdoor.com.mx/Benefits/Worley-Benefits-E35193.htm
"Worley
3.6",Senior Superintendent,Veracruz,México,"Company : Worley
Primary Location
: MEX-VCZ-Veracruz
Other Locations
: MEX-VCZ-Xalapa, MEX-DF-Mexico City, MEX-VCZ-Coatzacoalcos, MEX-VCZ-Minatitlán, MEX-VCZ-Boca Del Río
Job
: Construction Site Management",14 k$ - 18 k$ (Est. del Empleador),,Más de 10 000 empleados,Electricidad y Servicios públicos,"Energía, minería e infraestructura pública",De $5000 a $10 000 millones (USD),3.6,72 %,82 %,4.0,3.3,3.2,3.5,3.1,3.5,,,145,,https://www.glassdoor.com.mx/Benefits/Worley-Benefits-E35193.htm
"HSBC
3.8",Risk Analytics and Modelling Manager,México,México,"Some careers have more impact than others. If you’re looking for a career where you can make a real impression, join GSC HSBC and discover how valued you’ll be.

We are currently seeking an experienced professional to join our team in the role of
Risk Analytics and Modelling Manager

Role purpose:
Global Analytics Center (GAC), is a hub of advanced analytics competency, providing high-end analytics services across global businesses and global functions. Set-up in India in 2004, GAC has matured into a shared Centre of Excellence comprising 2000+ professionals with offices in Bangalore, Kolkata, Guangzhou and Krakow. The work done in GAC forms a vital input towards for strategic planning by the senior management for businesses and enables effective decision making along with addressing unforeseen challenges.",14 k$ - 18 k$ (Est. del Empleador),,Más de 10 000 empleados,Banca y Servicios de crédito,Finanzas,Más de $10 000 millones (USD),3.8,74 %,82 %,4.0,3.6,3.5,3.7,3.3,3.6,,,145,https://www.glassdoor.com.mx/Evaluaciones/HSBC-Evaluaciones-E3482.htm,https://www.glassdoor.com.mx/Benefits/HSBC-Benefits-E3482.htm
"Worley
3.6",Senior Civil Engineer,Ciudad de México,México,"51,000 people. 49 countries. Over 120 office locations.
We’re not just engineers. We’re a global team of data scientists, consultants, construction workers and innovators all working to create a better tomorrow. Every day, we help customers in energy, chemicals and resources get one step closer to solving our planet’s toughest issues. Climate change. The energy transition. Digital transformation. And how we can deliver a more sustainable world.
Whatever your ambition, there’s a path for you here. And there’s no barrier to your potential career success. For more information, visit Worley.com
1.- Experiencia de 15 años en analisis y diseño estructural Ing. Basica y Detalle Civil-Planificacion
2.- CivilCad (Civil3D / Inroads deseable); intermedio=16 años para mov. Tierras
3.- Exp. en cuantificacion de volumenes de obra, estimados de HH. Intermedio=16 años
4.- Aplicacion de codigos RCDF, IMCA y MDOC CFE, NRF PEMEX. >16 años > 20 proyectos
5.- Aplicacion de codigos AASHTO, AREA, PIP, ASCE y FM. > 16 años > 12 proyectos
6.- Diseño drenajes pluviales, aceitosos sanitarios y vias ferreas. > 10 proyectos
7.- Preparacion de especificaciones y diseño de terraceria y movimiento de tierras
8.- Revision de mecanica de suelos asociada a terracerias y tecnologias especiales",14 k$ - 18 k$ (Est. del Empleador),,Más de 10 000 empleados,Electricidad y Servicios públicos,"Energía, minería e infraestructura pública",De $5000 a $10 000 millones (USD),3.6,72 %,82 %,4.0,3.3,3.2,3.5,3.1,3.5,,,145,https://www.glassdoor.com.mx/Evaluaciones/Worley-Evaluaciones-E35193.htm,https://www.glassdoor.com.mx/Benefits/Worley-Benefits-E35193.htm
"AstraZeneca
4.2",Software Engineer - Front End,Guadalajara,México,"Leverage technology to impact patients and ultimately save lives

Do you have expertise in, and passion for, information technology? Would you like to apply your expertise to impact the IT strategy in a company that follows the science and turns ideas into life changing medicines? If so, AstraZeneca might be the one for you!

ABOUT ASTRAZENECA
AstraZeneca is a global, science-led, patient-focused biopharmaceutical company that focuses on the discovery, development and commercialisation of prescription medicines for some of the world’s most serious disease. But we’re more than one of the world’s leading pharmaceutical companies. At AstraZeneca we’re dedicated to being a Great Place to Work.",14 k$ - 18 k$ (Est. del Empleador),,Más de 10 000 empleados,Biotecnología e industria farmacéutica,Farmacéutica y biotecnología,Más de $10 000 millones (USD),4.2,88 %,93 %,4.5,3.9,4.0,4.2,3.7,3.9,,,145,https://www.glassdoor.com.mx/Evaluaciones/AstraZeneca-Evaluaciones-E9214.htm,https://www.glassdoor.com.mx/Benefits/AstraZeneca-Benefits-E9214.htm
"Worley
3.6",Senior Project Manager / Mining Sector,Ciudad de México,México,"51,000 people. 49 countries. Over 120 office locations.
We’re not just engineers. We’re a global team of data scientists, consultants, construction workers and innovators all working to create a better tomorrow. Every day, we help customers in energy, chemicals and resources get one step closer to solving our planet’s toughest issues. Climate change. The energy transition. Digital transformation. And how we can deliver a more sustainable world.?
Whatever your ambition, there’s a path for you here. And there’s no barrier to your potential career success. For more information, visit Worley.com
General Purpose of Role
Provides direction and project management to ensure on-schedule completion within or below budget and in accordance with contractual obligations. Plans and defines program goals and devises methods to accomplish them; develops in-depth knowledge of customer objectives, contract terms, and corporate policies.",14 k$ - 18 k$ (Est. del Empleador),,Más de 10 000 empleados,Electricidad y Servicios públicos,"Energía, minería e infraestructura pública",De $5000 a $10 000 millones (USD),3.6,72 %,82 %,4.0,3.3,3.2,3.5,3.1,3.5,,,145,https://www.glassdoor.com.mx/Evaluaciones/Worley-Evaluaciones-E35193.htm,https://www.glassdoor.com.mx/Benefits/Worley-Benefits-E35193.htm
"Oracle
4.5",Fresh Graduate - Software Engineer,Guadalajara,México,"Fresh Graduate - Software Engineer-22000DR4

Applicants are required to read, write, and speak the following languages: English, Spanish
Preferred Qualifications

About Oracle Campus:
Our future success depends on hiring extraordinary, early in career talent who are looking to power next-generation services and solutions. We are hiring bachelor’s and master’s degree graduates with a diverse set of skills and experiences to work in and across multiple teams within Oracle. Our program is intended to enhance your overall learning experience, help build your network, and accelerate your chance to create an impact. Create the future with us!",14 k$ - 18 k$ (Est. del Empleador),,Más de 10 000 empleados,Software empresarial y soluciones de red,Tecnologías de la información,Más de $10 000 millones (USD),4.5,96 %,94 %,4.6,4.2,4.3,4.5,4.2,4.3,,,145,https://www.glassdoor.com.mx/Evaluaciones/Oracle-Evaluaciones-E1737.htm,https://www.glassdoor.com.mx/Benefits/Oracle-Benefits-E1737.htm
"Worley
3.6",Cost Analyst II,Ciudad de México,México,"Descripción - Externa
48,000 people. 49 countries. Over 120 office locations.
We’re not just engineers. We’re a global team of data scientists, consultants, construction workers and innovators all working to create a better tomorrow. Every day, we help customers in energy, chemicals and resources get one step closer to solving our planet’s toughest issues. Climate change. The energy transition. Digital transformation. And how we can deliver a more sustainable world.?
Whatever your ambition, there’s a path for you here. And there’s no barrier to your potential career success. For more information, visit Worley.com
Responsabilidades Generales
Revisión y recopilación de información para elaboración de estimados de costos
Recabar información de Cambios Potenciales.
Emisión del reporte de costos.
Realizar costeo de cambios para obtener benchmark y comparar vs las propuestas de los proveedores, realizar reuniones con proveedores/ PM’s para revisar y aprobar/ rechazar.",14 k$ - 18 k$ (Est. del Empleador),,Más de 10 000 empleados,Electricidad y Servicios públicos,"Energía, minería e infraestructura pública",De $5000 a $10 000 millones (USD),3.6,72 %,82 %,4.0,3.3,3.2,3.5,3.1,3.5,,,145,https://www.glassdoor.com.mx/Evaluaciones/Worley-Evaluaciones-E35193.htm,https://www.glassdoor.com.mx/Benefits/Worley-Benefits-E35193.htm
"Xe
3.5",ML and Data Engineer,Ciudad de México,México,"If you are interested in applying to the role, we ask that you kindly complete the application in English and attach an English version of your resume. Thank you.
At XE, we live currencies. We provide a comprehensive range of currency services and products, including our Currency Converter, Market Analysis, Currency Data API and quick, easy, secure Money Transfers for individuals and businesses. We leverage technology to deliver these services through our website, mobile apps and over the phone.
Last year, we helped nearly 300 million people access information about the currencies that matter to them and over 150,000 people used us to send money overseas. Thousands of businesses relied on us for information about the currency markets, advice on managing their foreign exchange risk or trusted us with their business-critical international payments.
At XE, we share the belief that behind every currency exchange, query or transaction is a person or business trying to accomplish something important, so we work together to develop new and better currency services that put our customers first. We are proud to be part of Euronet Worldwide (Nasdaq: EEFT), a global leader in processing secure electronic financial transactions. Under Euronet, we have brought together our key brands – XE, HiFX and Currency Online– to become the business that XE is today.",14 k$ - 18 k$ (Est. del Empleador),,De 51 a 200 empleados,Internet y Servicios web,Tecnologías de la información,De $5 a $25 millones (USD),3.5,94 %,N/A,,3.4,3.5,3.5,3.7,4.1,,,145,,
