Company Name,Job Title,Location,Country,Job Description,Salary Estimate,Avg Salary,Size,Industry,Sector,Revenue,Rating,Recommend,CEO,Benefits,Opportunities,Comp Benefits,Culture,Management,WorkLife Balance,Pros,Cons,Num Listings,Reviews URL,Benefits URL
"Microsoft
4.4",Software Engineer II,São Paulo,Brasil,"Are you interested in working for one of the most exciting and fast-growing teams in Microsoft? Then look at the Microsoft Defender Engineering team. You will be building cloud solutions in order to meet scales that few companies in the industry are required to support. Leveraging state of the art technologies, you will be instrumental in delivering holistic protection to a user base of tens of thousands of government organizations, enterprises, and SMB businesses around the globe. The Microsoft Defender team is responsible for delivering a constantly evolving set of services and solutions to meet the challenging landscape of our ever-evolving attackers.

This is a combined SWE/SRE (DevOps) team which provides leadership, direction, and accountability for cloud design, service architecture, engineering infrastructure, and data platform development. You will help conduct business reviews and operate our production services. Strong collaboration skills will be required to work closely with other engineering teams to ensure services and systems are highly stable, performant and meet the expectations of internal and external customers and users.",,,Mais de 10.000 funcionários,Desenvolvimento de hardware,Tecnologia da informação,Mais de US$ 10 bilhões,4.4,91 %,,4.2,4.2,4.1,4.4,4.1,4.2,,,73,https://www.glassdoor.com.br/Avalia%C3%A7%C3%B5es/Microsoft-Avalia%C3%A7%C3%B5es-E1651.htm,https://www.glassdoor.com.br/Benefits/Microsoft-Benefits-E1651.htm
"IBM
4.3",Cientista de Dados (Remoto),Rio de Janeiro,Brasil,"Introduction
As a Data Scientist at IBM, you will help transform our clients’ data into tangible business value by analyzing information, communicating outcomes and collaborating on product development. Work with Best in Class open source and visual tools, along with the most flexible and scalable deployment options. Whether it’s investigating patient trends or weather patterns, you will work to solve real world problems for the industries transforming how we live.

Your Role and Responsibilities
Data Scientist is a role for quantitatively adept people with accompanying business skills. A solid foundation typically in statistics, modeling, operations research, computer science and applications, and math. What sets the data scientist apart is strong business acumen, coupled with the ability to communicate findings to both business and IT leaders in a way that can influence how an organization approaches a business challenge. Good data scientists will not just address business problems, they will pick the right problems that have the most value to the organization. A data scientist is effective at deploying an analytics solution, thereby realizing business value. Whereas a traditional data analyst may look only at data from a single source – a CRM system, for example – a data scientist will most likely explore and examine data from multiple disparate sources. The data scientist will extract, transform, and combine all incoming data with the goal of discovering a previously hidden insight, which in turn can provide a competitive advantage or address a pressing business problem. A data scientist does not simply collect and report on data, but also builds statistical models, determines what it means, then recommends ways to apply the data. Data scientists are inquisitive: exploring, asking questions, doing """"what if"""" analysis, questioning existing assumptions and processes. Armed with data, modeling expertise, and analytical results, a top-tier data scientist will then communicate informed conclusions and recommendations across an organization's leadership structure. The employee focuses on individual/team objectives and development of professional effectiveness.



Sólidos conhecimentos de Estatística (Estatísticas Descritivas, Correlação, Testes de Hipóteses, Distribuições de Probabilidades).

Inteligência de Negócios, conceitos de mineração e banco de dados.

Métodos de preparação de dados, modelagem preditiva.

Aplicação e conceitos de Machine Learning.

Experiência em programação em Python e/ou R.


Habilidades de comunicação.

***Todas as vagas são elegíveis para pessoas com deficiência ou reabilitadas.***


Databricks, Hadoop, Spark, Scala, Kafka, SQL, Java e/ou C++

Controle de versão (Git)

Portfólio de projetos pessoais (por exemplo, Github, blog pessoal)

SPSS, SAS ou Knime

Tableau, PowerBI, Looker

Série Temporal, Mineração de Texto e NLP

Redes neurais e Deep Learning (bibliotecas como Keras, PyTorch, TensorFlow, H2O)

Técnicas de Reconhecimento Visual

Experiência em programação matemática (CPLEX, Gurobi, Matlab)

Capacidade de trabalhar com plataformas de nuvem (Azure, IBM Cloud, Google Cloud ou AWS)",,,Mais de 10.000 funcionários,Serviços de apoio à tecnologia da informação,Tecnologia da informação,Mais de US$ 10 bilhões,4.3,90 %,,4.2,4.0,3.8,4.4,3.8,3.9,,,73,https://www.glassdoor.com.br/Avalia%C3%A7%C3%B5es/IBM-Avalia%C3%A7%C3%B5es-E354.htm,https://www.glassdoor.com.br/Benefits/IBM-Benefits-E354.htm
"Uber
4.2",Product Designer - Money,Osasco,Brasil,"Our Design teams are focused not just on the functional, but also on joy and delight. Our work ignites opportunity and changes the way the world moves, and we design for users around the world of all backgrounds and abilities.
About the Role
As a Product Designer on Money team, you will collaborate with a number of cross-functional partners, including Product Managers, Engineers, Data Scientists, Content Strategists, User Researchers, and more in a fast-paced, fun, and multifaceted environment tackling some of the most unique problems our users face!
You'll need to tackle a variety of problems related to Uber’s core payment experience, making it possible for users across the world to pay & get paid across Uber’s growing number of businesses. The problems we’re solving in the payment space are universal, but the payment landscape & payment related needs, attitudes, & behaviors of our users vary greatly across the world, and you’ll help us navigate exactly that. How might you increase efficiency, increase equity, and accessibility while improving the Rider, Eater, or Driver experience at the same time? You'll leverage your diverse skill set to elevate the craft and the quality of the products we ship to our customers.",,,Mais de 10.000 funcionários,Internet e serviços Web,Tecnologia da informação,Mais de US$ 10 bilhões,4.2,79 %,,4.4,3.5,3.9,3.9,3.5,3.6,,,73,https://www.glassdoor.com.br/Avalia%C3%A7%C3%B5es/Uber-Avalia%C3%A7%C3%B5es-E575263.htm,https://www.glassdoor.com.br/Benefits/Uber-Benefits-E575263.htm
Tunts.Rocks,Analytics Engineer,Trabalho remoto,Brasil,"This is a fully-remote, full-time position, exclusive for Brazilian citizens.

A brief overview
Our client is a Norwegian multinational company and the product you are going to be working on helps farmers to maximize their carbon crop yield.

You will work with a multicultural team with different talents, experiences and various skill sets to find creative and inventive solutions and help you grow your career. We work closely with agronomists, data scientists, sales representatives, etc. that come together and help the ""farmer"" (Growers) make the best decisions by analyzing data from models that map the areas where these farms are located.",,,,,,,,,,,,,,,,,,73,,
"Poatek
4.3",Sr. Data Scientist,Porto Alegre,Brasil,"Poatek is a Software Boutique whose purpose is to gather people who love IT in order to develop critical applications and build innovative solutions for international clients. By doing that, we provide consultancy for companies of different segments and impact a large number of users all over the world.
With offices in Porto Alegre, São Paulo, Lisbon, and Miami, our team experiences an international environment while working in a horizontal organization filled with autonomy, freedom, and lots of challenges.
Much more than a job, our people find in our human-centered and result-driven culture the opportunity to grow while being the real owners of their working path. Of course, all of that is in partnership with top performers constantly striving for excellence, bringing diverse perspectives and new ideas.
Equality is a principle here at Poatek. We are committed to building an inclusive team that represents a variety of backgrounds, perspectives, beliefs, and experiences. Therefore we provide equal employment opportunities to all employees and applicants regardless of race, color, religion, gender identity, sexual orientation, national origin, age, or disability.",,,De 51 a 200 funcionários,Serviços de apoio à tecnologia da informação,Tecnologia da informação,De US$ 5 a US$ 25 milhões,4.3,97 %,,4.9,4.3,3.9,4.4,3.9,4.4,,,73,https://www.glassdoor.com.br/Avalia%C3%A7%C3%B5es/PoaTek-Avalia%C3%A7%C3%B5es-E1050614.htm,https://www.glassdoor.com.br/Benefits/PoaTek-Benefits-E1050614.htm
"Semrush
4.3",Senior Data Engineer (Wind Team),Rio Grande do Sul,Brasil,"Hi there!
We are Semrush, a global IT company developing our own product—a platform for digital marketers.
And this is our Data engineer role for those who want to turn ideas into reality using code, algorithms, and maybe a bit of magic.
A bit about the team
The Wind Team is looking for a Data Engineer with knowledge of Python. The product is a unified analytical data warehouse.
We have an ambitious task – to optimize approaches to building data flows at the company level. We need to combine data from different sources and intelligently organize processing and storage to meet the needs of related departments (data consumers): Product Teams, Analytics, Data Scientists, Business Intelligence, Marketing, etc.",,,De 1.001 a 5.000 funcionários,Desenvolvimento de software,Tecnologia da informação,Desconhecido/Não se aplica,4.3,83 %,,,4.2,4.1,4.4,4.1,4.2,,,73,,
"Semrush
4.3",QA Engineer (Amber Team),Rio Grande do Sul,Brasil,"Hi there!

We are Semrush, a global IT company developing our own product – a platform for digital marketers.
And this is our QA Engineer role for those who want to turn ideas into reality using test scripts, automation, and maybe a little magic.
Tasks in the role
Organizing the process of checking data quality.
Developing and executing test plans and scripts.",,,De 1.001 a 5.000 funcionários,Desenvolvimento de software,Tecnologia da informação,Desconhecido/Não se aplica,4.3,83 %,,,4.2,4.1,4.4,4.1,4.2,,,73,,
"Santander
3.9",Data Scientist,São Paulo,Brasil,"Data Scientist
SAO PAULO, Brazil
WHAT YOU WILL BE DOING
Requisitos Imprescindíveis
Bom relacionamento com pares e parceiros;
Pró-ativo e com atitude de dono.
Conhecimento em ferramentas Office (Excel, Power Point);
Desejável conhecimento nas ferramentas ServiceNow ITBM e ITSM
Atividades",,,Mais de 10.000 funcionários,Serviços bancários e de crédito,Financeiro,Mais de US$ 10 bilhões,3.9,74 %,,4.4,3.7,3.9,3.7,3.4,3.4,,,73,https://www.glassdoor.com.br/Avalia%C3%A7%C3%B5es/Santander-Avalia%C3%A7%C3%B5es-E828048.htm,https://www.glassdoor.com.br/Benefits/Santander-Benefits-E828048.htm
"KORE
3.2",Data Engineer,São Paulo,Brasil,"We are looking for a dynamic Data Engineer to help with KORE's data pipeline architecture and to help us get to a new level with our data analytics!

KORE is a recognized global leader in IoT solutions and management capabilities and is consistently recognized as the highest-ranked non-carrier in the Gartner Magic Quadrant for Machine-to-Machine Services worldwide. KORE creates value for customers in the explosive IoT market and is the largest independent IoT connectivity management provider today.

The global market for IoT networking solutions is expected to grow 22% (CAGR) per year through 2022, with the number of IoT devices predicted to grow to 55 billion units by 2025. Come be a part of this dynamic and exciting marketplace as a high-performance team member with KORE!

Responsibilities of this position include:
Skills and Qualifications:

We appreciate the interest of all candidates, but only those individuals selected for an interview will be contacted.

KORE provides equal employment opportunity for all persons, in all facets of employment. We perform pre-employment background checks and drug screening.",,,De 501 a 1.000 funcionários,Serviços de telecomunicações,Telecomunicações,De US$ 100 a US$ 500 milhões,3.2,34 %,,2.0,3.6,3.0,3.2,2.6,3.6,,,73,https://www.glassdoor.com.br/Avalia%C3%A7%C3%B5es/KORE-Avalia%C3%A7%C3%B5es-E443860.htm,https://www.glassdoor.com.br/Benefits/KORE-Benefits-E443860.htm
"Uber
4.2",Engineering Manager - Customer Obsession,Trabalho remoto,Brasil,"About the Role
As an Engineering Manager at Uber, you will be leading a group of engineers working with product managers, data scientists and other engineering teams to build solutions globally.
We are looking for an Engineering Manager for the Customer Obsession team who will be responsible to build, mentor and manage a strong and high-impact cross-geo team across Latin America! Customer Obsession Engineering at Uber is on a mission to build products that delight our customers across all lines of business, globally.
What You’ll Do
Directly own an engineering team passionate about learning and iterating with velocity.",,,Mais de 10.000 funcionários,Internet e serviços Web,Tecnologia da informação,Mais de US$ 10 bilhões,4.2,79 %,,4.4,3.5,3.9,3.9,3.5,3.6,,,73,,https://www.glassdoor.com.br/Benefits/Uber-Benefits-E575263.htm
"IBM
4.3",Data Engineer - Big Data (Remoto),São Paulo,Brasil,"Introduction
At IBM, work is more than a job - it's a calling: To build. To design. To code. To consult. To think along with clients and sell. To make markets. To invent. To collaborate. Not just to do something better, but to attempt things you've never thought possible. Are you ready to lead in this new era of technology and solve some of the world's most challenging problems? If so, lets talk.

Your Role and Responsibilities
In this role, you'll work in our IBM Client Innovation Center (CIC), where we deliver deep technical and industry expertise to a wide range of public and private sector clients around the world. These centers offer our clients locally based skills and technical expertise to drive innovation and adoption of new technology.

As a Big Data Engineer, you will develop, maintain, evaluate, and test big data solutions. You will be involved in data engineering activities like creating pipelines/workflows for Source to Target and implementing solutions that tackle the clients needs.

Your primary responsibilities include:






***Todas as vagas são elegíveis para pessoas com deficiência ou reabilitadas.***

N/A",,,Mais de 10.000 funcionários,Serviços de apoio à tecnologia da informação,Tecnologia da informação,Mais de US$ 10 bilhões,4.3,90 %,,4.2,4.0,3.8,4.4,3.8,3.9,,,73,https://www.glassdoor.com.br/Avalia%C3%A7%C3%B5es/IBM-Avalia%C3%A7%C3%B5es-E354.htm,https://www.glassdoor.com.br/Benefits/IBM-Benefits-E354.htm
"Poatek
4.3",Data Scientist,São Paulo,Brasil,"Poatek is a Software Boutique whose purpose is to gather people who love IT in order to develop critical applications and build innovative solutions for international clients. By doing that, we provide consultancy for companies of different segments and impact a large number of users all over the world.
With offices in Porto Alegre, São Paulo, Lisbon, and Miami, our team experiences an international environment while working in a horizontal organization filled with autonomy, freedom, and lots of challenges.
Much more than a job, our people find in our human-centered and result-driven culture the opportunity to grow while being the real owners of their working path. Of course, all of that is in partnership with top performers constantly striving for excellence, bringing diverse perspectives and new ideas.
Equality is a principle here at Poatek. We are committed to building an inclusive team that represents a variety of backgrounds, perspectives, beliefs, and experiences. Therefore we provide equal employment opportunities to all employees and applicants regardless of race, color, religion, gender identity, sexual orientation, national origin, age, or disability.",,,De 51 a 200 funcionários,Serviços de apoio à tecnologia da informação,Tecnologia da informação,De US$ 5 a US$ 25 milhões,4.3,97 %,,4.9,4.3,3.9,4.4,3.9,4.4,,,73,,https://www.glassdoor.com.br/Benefits/PoaTek-Benefits-E1050614.htm
"Worley
3.6",Digital Battery Electric Vehicle Engineer,Belo Horizonte,Brasil,"Company : Worley
Local Principal
: BRA-MG-Belo Horizonte
Cargo
: Electrical
Horário
: Período integral",,,Mais de 10.000 funcionários,Energia e serviços públicos,"Energia, mineração, utilitários",De US$ 5 a US$ 10 bilhões,3.6,72 %,,3.3,3.3,3.2,3.5,3.1,3.5,,,73,https://www.glassdoor.com.br/Avalia%C3%A7%C3%B5es/Worley-Avalia%C3%A7%C3%B5es-E35193.htm,https://www.glassdoor.com.br/Benefits/Worley-Benefits-E35193.htm
"Worley
3.6",Digital Mine Project Manager,Belo Horizonte,Brasil,"Company : Worley
Local Principal
: BRA-MG-Belo Horizonte
Cargo
: Electrical
Horário
: Período integral",,,Mais de 10.000 funcionários,Energia e serviços públicos,"Energia, mineração, utilitários",De US$ 5 a US$ 10 bilhões,3.6,72 %,,3.3,3.3,3.2,3.5,3.1,3.5,,,73,https://www.glassdoor.com.br/Avalia%C3%A7%C3%B5es/Worley-Avalia%C3%A7%C3%B5es-E35193.htm,https://www.glassdoor.com.br/Benefits/Worley-Benefits-E35193.htm
"Thermo Fisher Scientific
3.8",Sr. Data Analyst (Data Scientist) LATAM,São Paulo,Brasil,"About Thermo Fisher Scientific:
When you’re part of the team at Thermo Fisher Scientific, you’ll do meaningful work, that makes a positive impact on a global scale! Join 100,000 colleagues who bring our Mission to life every single day to enable our customers to make the world healthier, cleaner and safer. You’ll find the resources here to achieve your career goals and help take science a step beyond by developing solutions for some of the world’s toughest challenges. This includes protecting the environment, making sure our food is safe, and helping find cures for cancer.
How will you make an impact?
The Latam Business intelligence team will work to facilitate the decision making in Thermo fisher Scientific and leverage the data driven culture in the company
What will you do?",R$ 6 mil - R$ 17 mil (estimativa da empresa),,Mais de 10.000 funcionários,Biotecnologia e farmacêutica,Farmacêutica e biotecnologia,Mais de US$ 10 bilhões,3.8,77 %,,3.9,3.7,3.6,3.8,3.4,3.5,,,73,https://www.glassdoor.com.br/Avalia%C3%A7%C3%B5es/Thermo-Fisher-Scientific-Avalia%C3%A7%C3%B5es-E658.htm,https://www.glassdoor.com.br/Benefits/Thermo-Fisher-Scientific-Benefits-E658.htm
"Cognite AS
3.9",Implementation Project Manager,São Paulo,Brasil,"At Cognite, the Customer Success team is responsible for engagement management, software implementation and growth of Cognite's impact within our customers' digital transformation efforts. We consist of people with diverse and high-performance backgrounds, ranging from Management Consulting, to Industry and Software development. We seek to continuously improve how we work with our clients, how we work together as a team, and how we develop as individuals.

The Implementation Project Manager is responsible for the on time, on budget delivery of projects for our customers post sale. You create the ultimate cohesive unit for our project teams and the customers you represent. You are responsible for setting expectations and creating and executing both long term and short term plans that will meet your customer’s goals and accelerate Cognite’s footprint in your customers’ technology landscape. You will connect with key stakeholders, assign tasks, address blockers, manage risks and report progress to leadership clearly and concisely.

You will also be the bridge between your customers and Cognite’s Engineering and Product Management teams and advise on development priorities. As part of the broader account teams, you will need to be a good communicator, enjoy working closely with people to solve challenging problems and be able to understand complex technology. You will be expected to quickly understand Cognite's offering so that you can connect the customer’s desired outcome with Cognite’s software and drive successful project deliveries which will ultimately lead to increased adoption and revenue growth.",R$ 6 mil - R$ 17 mil (estimativa da empresa),,De 501 a 1.000 funcionários,Soluções de software e redes corporativas,Tecnologia da informação,Desconhecido/Não se aplica,3.8,70 %,,,4.0,3.8,4.0,3.4,3.5,,,73,,
"codeHB
4.7",BI Developer & Analyst,Trabalho remoto,Brasil,"Responsibilities
A pessoa BI Developer and Analyst irá atuar em projetos de Big Data de clientes internacionais, trabalhando em constante contato com o nosso time de Data Engineers e Data Scientists. Além de trabalhar com grandes volumes de dados, no nosso time você terá a oportunidade de trabalhar com diversos serviços do Microsoft Azure e DevOps, integrando um time de Microsoft MVPs e outros profissionais internacionalmente reconhecidos.
Essa vaga é para trabalhar full-time remoto com o time do Brasil para clientes do Reino Unido.

Required Skills and Experience",R$ 6 mil - R$ 17 mil (estimativa da empresa),,De 1 a 50 funcionários,,,,4.7,95 %,,5.0,4.2,4.0,4.5,4.4,4.4,,,73,,https://www.glassdoor.com.br/Benefits/codeHB-Benefits-E2332055.htm
"Xerox
3.3",Analista Suporte Técnico Sistemas,Betim,Brasil,"City: Betim
State/Province: Minas Gerais
Country: Brazil
Department: Service Delivery
Date: Monday, October 10, 2022
Working time: Full-time
Ref#: 20020640
Individual Contributor",R$ 6 mil - R$ 17 mil (estimativa da empresa),,Mais de 10.000 funcionários,Serviços de apoio à tecnologia da informação,Tecnologia da informação,De US$ 5 a US$ 10 bilhões,3.3,50 %,,3.8,2.9,2.9,3.1,2.8,3.4,,,73,,https://www.glassdoor.com.br/Benefits/Xerox-Benefits-E747.htm
