Company Name,Job Title,Location,Country,Job Description,Salary Estimate,Avg Salary,Size,Industry,Sector,Revenue,Rating,Recommend,CEO,Benefits,Opportunities,Comp Benefits,Culture,Management,WorkLife Balance,Pros,Cons,Num Listings,Reviews URL,Benefits URL
"1G-LINK CONSULTING
4.0","Ingénieur ou jeune docteur en Data Science, Machine Learning ou Intelligence Artificielle (IT)",Bezons,France,"Le collaborateur recherché devra justifier d’une première expérience réussie dans un de ces domaines, et maitrisera idéalement les différentes techniques d’OCR pour la digitalisation de documents scannés dactylographiés ou manuscrits. Des compétences en NLP sont également appréciées. Pour les profils de jeunes docteurs, une thèse dans un des domaines est préférée.

Si vous connaissez certaines de ces technologies, ou êtes curieux de les découvrir, alors rejoignez-nous !

Python

R

Spark SQL

TensorfFlow

Keras

Java


3 ans d’expérience minimum

jeunes docteurs acceptés

Mission basée en Île-de-France

Prenez part au développement de l’entité Produit en mode startup et rejoignez-nous afin d’évoluer au sein d’une équipe jeune et dynamique.",40 k € (Estimation de l'employeur),,Inconnu,,,,4.0,100 %,N/A,,3.0,4.0,5.0,5.0,5.0,,,1093,,
"Groupe Covéa
3.8",Data Scientist F/H - CDI,Chauray,France,"Data Scientist F/H - CDI

Rejoignez une équipe de 6 collaborateurs au sein de l'équipe Data Analysis de la Direction Contrôle Interne Permanent.

Votre mission ?
Dans le cadre d'un remplacement, l'équipe Data Analysis cherche à se développer en intégrant un datascientist pour l’aider à progresser sur ces nouvelles pratiques. Vous aurez pour mission de participer à la sécurisation des risques opérationnels à forts enjeux et de contribuer à la maîtrise des résultats techniques des marques en :





























Envie de choisir votre avenir par passion ou par raison ? Et pourquoi pas les deux ?
, c’est un groupe d’assurances puissant réunissant trois marques complémentaires (MAAF, MMA, GMF).
C’est également qui mettent en commun leur talent et leur enthousiasme pour accompagner nos clients sociétaires et construire le futur de l’assurance.",40 k € (Estimation de l'employeur),,Plus de 10 000 employés,Agences et courtiers d’assurance,Assurance,Entre 5 et 25 millions de dollars US,3.8,82 %,87 %,4.2,3.3,3.6,3.6,3.2,4.0,,,1093,,https://www.glassdoor.fr/Benefits/Groupe-Cov%C3%A9a-Benefits-E847839.htm
"Inetum
3.4",Data Scientist H/F,Courbevoie,France,"Mission
Inetum Capital Market est une entité du groupe Inetum, spécialisée en finance de marchés accompagnant les acteurs majeurs du secteur de la Finance en France et à l’international.
Cultivant la double compétence technique et fonctionnelle, vous intervenez sur des projets innovants à haute valeur ajoutée.
Pour accompagner notre forte croissance, nous recherchons des Data Scientists.
Au sein d’un acteur de la finance de marché vous capturez et analysez tous les types de données (structurés et non structurés) sur les marchés, les clients, les produits et les services de l'entreprise afin d'offrir aux métiers des progrès sur l'existant ainsi que sur l'anticipation des tendances et enjeux futurs.",40 k € (Estimation de l'employeur),,Plus de 10 000 employés,Services d’assistance informatique,Informatique,Entre 1 et 5 milliards de dollars US,3.4,68 %,67 %,2.9,3.2,2.9,3.2,3.1,3.5,,,1093,https://www.glassdoor.fr/Avis/Inetum-Avis-E9028.htm,https://www.glassdoor.fr/Benefits/Inetum-Benefits-E9028.htm
TALENTS IT,Data Analyst - Full remote (H/F) (IT),Montferrier,France,"Talents IT cabinet de recrutement national spécialisé dans les métiers de l'IT et du Digital proche de ses clients et candidats est résolument tourné vers l'humain. Notre équipe soudée et toujours de bonne humeur est là pour vous conseiller et vous accompagner dans votre projet professionnel.

Dans le cadre du développement de notre groupe nous sommes à la recherche d'un candidat pour le poste de Data Analyst (h/f)

Rattaché(e) au responsable et intégrer à l'équipe développement vos missions seront:

trouver des sources de données pertinentes,
extraire les données du système source,
extraire et traduire des données business en données statistiques",40 k € (Estimation de l'employeur),50,Inconnu,,,,,,,,,,,,,,,1093,,
OLOME,Data Analyst et Scientist Junior,Lille,France,"Dès maintenant
IT
CDI
VOIR L'ENTREPRISE

Descriptif du poste
Industry Made Simple
Avec toute l’équipe olome nous avons l’ambition d’apporter le meilleur de la tech (cloud, devops, data, IA) à l’industrie :",40 k € (Estimation de l'employeur),,De 1 à 50 employés,,,,,,,,,,,,,,,1093,,
"Octopus IT
5.0",Data Scientist | Python | Editeur de logiciel en...,Paris,France,"La société
PME créée il y a plus de 10 ans, cet éditeur de logiciel dans le monde de l'immobilier a plus de 50% de croissance chaque année. Leur proposition de valeur ? Accompagner les personnes voulant changer de vie/de métier à se lancer dans le monde de l'entrepreneuriat et à devenir consultant immobilier indépendant.

Cette entreprise est très bien installée sur le marché et est rentable depuis maintenant de nombreuses années. Elle accompagne avec leur suite logiciel plus de 3000 consultants immobiliers chaque jour : CRM, ERP, Appli Mobile, Gestion des payes, ...
Mais c’est aussi une référence de l’estimation immobilière en ligne qui cherche à construire le meilleur moteur d’estimation du web français !",40 k € (Estimation de l'employeur),,Inconnu,,,,5.0,100 %,N/A,,5.0,5.0,5.0,5.0,5.0,,,1093,,
"Airbus
4.0",DATA ANALYST (H/F),Blagnac,France,"Job Description:
Airbus PROTECT rassemble des experts dans les métiers de la safety, de la cybersecurity et de la sustainability. Nous mettons notre expertise au service de notre propre groupe, Airbus, auprès de qui nous agissons en tant que partenaire privilégié, mais également au service de clients externes.
Avec plus de 1.200 collaborateurs expérimentés basés notamment en France, en Angleterre et en Allemagne, nous gérons des contrats de grande envergure avec des entreprises telles que des infrastructures critiques (OIVs), d’autres groupes industriels ou encore des institutions publiques. Notre positionnement et notre stratégie nous permettent de répondre aux normes les plus élevées du marché et de relever les défis de demain en équipe… avec vous !
Votre futur job, si vous l’acceptez…
Airbus Protect SAS
Permanent Contract / CDI / Unbefristet / Contrato indefinido
Professional / Expérimenté(e) / Professionell / Profesional
Information Mgmt and Digital Technology <JF-IM-DI>",40 k € (Estimation de l'employeur),,Plus de 10 000 employés,Aérospatiale et Défense,Aérospatiale et défense,Plus de 10 milliards de dollars US,4.0,86 %,89 %,4.4,3.6,3.8,3.8,3.5,4.0,,,1093,,https://www.glassdoor.fr/Benefits/Airbus-Benefits-E3059.htm
"RSM France
4.0",Data Analyst Junior,Paris,France,"RSM Paris
RSM France à Paris, cabinet d’audit, d’expertise comptable et de conseil, d’environ 500 collaborateurs, intervient sur une clientèle diversifiée de PME, d’ETI et de sociétés cotées, françaises et internationales.

RSM France est membre de RSM International, 6ème réseau mondial d’Audit, d’Expertise et de Conseil accompagne les entreprises de croissance dans leurs enjeux quotidiens. 1250 personnes en France et près de 51 000 à l’international.

RSM France à Paris est organisé autour de 4 pôles opérationnels : Expertise Conseil, Audit, Conseil et Corporate Finance, nous travaillons au quotidien avec une diversité de métiers qui fait notre richesse.
Chez RSM France à Paris, nous mettons en place le « flex office », visant à offrir à chacun la meilleure expérience de travail.
Notre ambition est que chacun puisse être « au bon endroit au bon moment » en fonction de ses contraintes professionnelles : chez le client, au bureau ou à domicile.
Notre flex office repose sur une performance par la confiance, des locaux en plein cœur de Paris, et une digitalisation de nos process.


Postuler à l'offre",40 k € (Estimation de l'employeur),,Plus de 10 000 employés,Gestion comptable et fiscale,Finance,Entre 5 et 10 milliards de dollars US,4.0,76 %,84 %,2.6,4.1,3.5,4.1,3.8,3.5,,,1093,https://www.glassdoor.fr/Avis/RSM-Avis-E691963.htm,https://www.glassdoor.fr/Benefits/RSM-Benefits-E691963.htm
"CHRONOFRESH
4.0",Data Analyst H/F,Paris,France,"Filiale de Chronopost, nous sommes LE spécialiste de la livraison express de produits alimentaires sous température dirigée.
Notre offre permet la livraison de produits alimentaires secs, frais et surgelés à destination des professionnels et particuliers partout en France. Ce service s’appuie notamment sur un réseau de plus de 92 agences équipées en chambres froides.
Déjà près de 5 000 clients nous font confiance. Nous connaissons, depuis notre création en 2015, un fort développement nécessitant de renforcer nos équipes supports comme opérationnelles.
A ce titre, nous recherchons, dans le cadre d’une création de poste, un/une Data Analyst.
Missions",40 k € (Estimation de l'employeur),47,Inconnu,,,,4.0,100 %,N/A,,3.5,4.0,4.0,4.0,3.5,,,1093,,
"Airbus
4.0",#AGGP - Data Scientist - Natural Langage Processing (NLP) m/f,Marignane,France,"Job Description:
When you begin your career with us, we accelerate your networks, locally and internationally, and gain a unique perspective on the world of Airbus. You are part of a global community, so we bring you together once a year for a global graduate conference where you meet your peers, hear from our leaders and learn from the best.
Every year we look for university graduates from around the world to join Airbus. We need people with the aspiration, enthusiasm and the talent to help us move forward and to change the world and your development through our Airbus Global Graduate Experience. You are part of a 2 year programme where you develop your professional skills, but deliver our vision to pioneer sustainable aerospace for a safe and united world. We are hiring the graduates we need to fill the critical roles for our future. By the end of the programme, our aim is that you are ready to progress, having already demonstrated your value. You will have developed your skills in an area that is strategically important for Airbus, you will know about the Airbus business, the opportunities, challenges and needs, and you will have learned more about yourself, and what makes you great.
Above all you will have the opportunity to do your best work in an industry that is literally reshaping how we live in our world.
If you are ready to join and be part of this journey please apply below.





Airbus Helicopters SAS
Permanent Contract / CDI / Unbefristet / Contrato indefinido
Entry Level / Débutant / Anfänger / Recién titulado
Information Mgmt and Digital Technology <JF-IM-DI>",40 k € (Estimation de l'employeur),,Plus de 10 000 employés,Aérospatiale et Défense,Aérospatiale et défense,Plus de 10 milliards de dollars US,4.0,86 %,89 %,4.4,3.6,3.8,3.8,3.5,4.0,,,1093,https://www.glassdoor.fr/Avis/Airbus-Avis-E3059.htm,https://www.glassdoor.fr/Benefits/Airbus-Benefits-E3059.htm
"Julien Cornic, infographiste freelance",data scientist / Freelance,Lille,France,"Poste et missions Vous intégrerez l'équipe d'une dizaine de personne en accomplissant les activités suivantes : Création de modèles de détection de fraude documentaire à partir des métadonnées du document et des données extraites par OCR des documents, Création de modèles de détection d'anomalie sur des données de production Appui au manager pour l'expertise technique Veille Environnement technique : Python et ses principales bibliothèques (numpy, pandas, scikit-learn, scipy, matplotlib), Machine-Learning, Data mining Méthodologie de travail : Agile La visibilité de la mission est de 12 mois. Le télétravail total est envisageable après une période d'intégration d'au moins 1 mois sur site Profil Vous justifiez au minimum de 2 ans années d'expérience réussie sur des projets similaires. Compétences techniques requises : Python et ses principales bibliothèques (numpy, pandas, scikit-learn, scipy, matplotlib) Machine-Learning Data mining Compétences fonctionnelles recherchées : NLP Détection de fraude Détection d'anomalie Analyse comportementale",40 k € (Estimation de l'employeur),"51,25",Inconnu,,,,,,,,,,,,,,,1093,,
"Pôle Emploi
3.7",Ingénieur / Ingénieure en Data Sciences Chémoinformatique (H/F),Saint-Orens,France,"Nous recherchons un scientifique avec une forte compétence en exploration et analyse de données chémoinformatique, diplômé d'un master II en chimie avec pour objectif de mettre en place des modèles prédictifs in-silico ADMET pour accélérer et améliorer le processus de conception et d'ingénierie de nouvelles molécules thérapeutiques chez nos clients. Le candidat retenu travaillera en étroite collaboration avec les chercheurs et les clients de la société pour appliquer des approches d'exploration et d'analyse de données dans le but de résoudre les défis de la découverte des molécules dans les domaines des sciences de la vie : industries pharmaceutiques, agroalimentaires et pétrochimiques. Les responsabilités du scientifique seront : - Collecter, agréger et analyser des données structurées et non structurées issues des industries pharmaceutiques, agroalimentaires et pétrochimiques. - Appliquer et développer des approches innovantes pour la curation, la comparaison, l'analyse, la classification et l'organisation des ensembles de données chémoinformatiques. - Construire des protocoles et des outils chémoinformatiques à partir de sources de données internes et externes, en écrivant du code et en utilisant des technologies d'apprentissage automatique de pointe. - Interagir étroitement avec d'autres scientifiques en interne et avec des clients de la société en externe. - Mettre à jour et rapporter des résultats d'analyse de données pertinents aux collaborateurs en interne ou aux clients en externe. - Rédiger des rapports et des cahiers des charges techniques liés aux projets d'exploration et d'analyse de données en lien avec nos clients. - Maintenir une connaissance approfondie des développements récents en science des données et de l'état de l'art des algorithmes d'intelligence artificielle, machine learning et deep learning en rapport avec la chémoinformatique. - Avoir un engagement actif dans des collaborations académiques. QUALIFICATIONS ET EXIGENCES - Master II en chimie générale ou computationnelle. - Connaissances des problématiques de l'industrie de la chimie. - Expérience avérée du langage chémoinformatique SMARTS de description de molécules. - Bonne connaissance des environnements Conda, Jupyter notebooks et du langage Python et ses bibliothèques chémoinformatiques tel que RDKiT. - Maitrise de l'environnement d'exploration, d'analyse et de visualisation de données KNIME dans le domaine de la chémoinformatique pour l'analyse de similarité-diversité de collections de molécules et la création de modèles décisionnels in-silico. - Expérience dans l'intégration des données dans des bases de données de type relationnelle (SQL). - Capacité à comprendre, concevoir, développer, comparer et appliquer des algorithmes décisionnels pour générer des hypothèses dans le domaine de la chémoinformatique. - Compréhension du processus de R&D pharmaceutique permettant de travailler en étroite collaboration avec nos clients chimistes médicinaux, chémoinformaticiens et biologistes. - Excellentes compétences en communication verbale et écrite en anglais avec fort tropisme pour le travail d'équipe, ainsi que la capacité de travailler de manière indépendante dans un environnement au rythme soutenu.",40 k € (Estimation de l'employeur),23,Plus de 10 000 employés,Management et conseil aux entreprises,Ne sait pas / non applicable,,3.7,76 %,78 %,4.1,2.8,3.1,3.4,3.2,4.3,,,1093,,https://www.glassdoor.fr/Benefits/P%C3%B4le-emploi-Benefits-E240990.htm
"Ekimetrics
4.3",Consultant Junior & Data Scientist (H/F/N),Paris,France,"Ekimetrics est leader européen en data science avec +320 data scientists et +1000 projets depuis 2006.

Présents à Paris, Londres, NY et HK, nous menons des projets dans +50 pays et pour tous les secteurs d’activité : services financiers, Retail, Telecom, Santé, etc.
Notre mission est d’aider les entreprises à auditer leurs opportunités data, enrichir leur capital analytique, et déployer des solutions actionnables permettant de maximiser leur performance marketing et opérationnelle, et ré-énergiser les business models.
Notre focus absolu est de délivrer des gains à court terme, tout en garantissant le développement du capital data de nos clients à long terme.
Nous nous engageons à proposer les approches data science les plus avancées, et à construire des pratiques AI éthiques et durables.

Quelques chiffres clés :
16 années d’expérience en Data Science",40 k € (Estimation de l'employeur),,De 51 à 200 employés,Publicité et relations publiques,Médias et communication,Entre 25 et 100 millions de dollars US,4.3,90 %,93 %,3.8,4.2,3.6,4.5,4.1,3.6,,,1093,https://www.glassdoor.fr/Avis/Ekimetrics-Avis-E631650.htm,https://www.glassdoor.fr/Benefits/Ekimetrics-Benefits-E631650.htm
"Kaisens Data
2.7",Docteur Data science,Paris,France,"Kaisens Data est un éditeur de solutions logicielles en IA / Data science avec une filiale de conseil, qui accompagne les sociétés de CAC40 dans les domaines de l'industrie, l'aéronautique, les banques et les assurances.
Afin d'accélérer notre programme de recherche et développement, nous renforçons notre équipe R&D avec l'embauche d'un docteur Data scientist ou data ingénieur. Poste à pourvoir en CDI immédiatement.
En tant que Docteur Data Scientist / Data ingénieur, vos missions sont:
Assurer des recherches bibliographiques des derniers travaux en IA, Data science et Big data entre autres NLP, NLG, NLU, Deep Learning et scalabilité.
Concevoir des modèles Machine Learning / Deep Learning sur des données projets (textes, images ou vidéo).",40 k € (Estimation de l'employeur),41,Inconnu,,,,2.7,31 %,N/A,1.0,2.3,2.4,2.4,2.5,2.4,,,1093,,https://www.glassdoor.fr/Benefits/kaisens-data-Benefits-E3181239.htm
"Peaks
4.2",Data Analyst H/F,Aix,France,"Qui sommes nous? Peaks Méditerranée, partenaire local en conseil et création de solutions numériques innovantes basée à Aix en Provence rayonne dans le sud de la France.
Riche de consultants passionnés dans leurs domaines et par les nouvelles technologies, nous accompagnons nos partenaires dans leurs projets digitaux pour co-réaliser leurs défis.
« Beyond the Codes » n’est pas qu’un jeu de mots, c’est l’essence même de notre société : engagement sociétal, éco-responsabilité, management humaniste et une passion pour relever les challenges du digital de demain.
Nos expertises : Prestation technologique, Conseil en direction de projet & Centre de formation agréé.
La mission :
Vous travaillerez en collaboration étroite avec les clients, analyser leurs besoins afin d'offrir un service personnalisé.
Extraire, transformer et analyser la data dans le but de prendre des décisions stratégiques.",40 k € (Estimation de l'employeur),,De 51 à 200 employés,Services d’assistance informatique,Informatique,Ne sait pas / non applicable,4.2,82 %,80 %,3.3,3.8,3.4,4.1,4.0,4.1,,,1093,https://www.glassdoor.fr/Avis/Peaks-Avis-E1278304.htm,https://www.glassdoor.fr/Benefits/Peaks-Benefits-E1278304.htm
Madeinvote,Data analyst (CDI),Bordeaux,France,"Descriptif du poste
La mission de Madeinvote est de solliciter en masse et d’analyser les opinons, comportements, intentions… des personnes les plus concernées par les sujets d’études de ses clients.
Avec pour objectif d’apporter aux annonceurs, instituts, marques, collectivités, acteurs du Retail et Real estate, les insights les plus pertinents car basés sur des données de qualité obtenues grâce à sa solution de création de panels-sur mesure sur les médias sociaux.
Dans le cadre de sa croissance, Madeinvote cherche son/sa futur(e) d*ata analyst*, pour travailler en collaboration directe avec les équipes Insights & Opérations.
Tes missions seront :
1/ Scripting de questionnaires : Une fois le questionnaire créé par l’équipe Insight et validé par le client, tu seras chargé(e) de sa programmation et des tests associés sur notre plateforme. Tu seras garant(e) aussi bien de l'aspect fonctionnel du questionnaire (filtres et redirection) que de l’aspect visuel pour le rendre aussi user-friendly que possible.
: Pendant la phase de recrutement des répondants, tu suis de près la participation à nos enquêtes et le respect des quotas fixés. Pour cela, tu interagis de manière quotidienne avec l’équipe Traffic qui gère la diffusion de nos sondages sur les réseaux sociaux.
: Une fois le recrutement des répondants terminé, tu seras chargé(e) de la gestion des données. Tu veilleras à ce qu’elles se transfèrent de manière fluide de notre plateforme de collecte de données vers notre plateforme de reporting.
: Pour répondre au mieux à la problématique client, tu produiras sur notre plateforme de reporting les tableaux et graphiques mettant en avant les résultats de l’étude, de manière à faciliter leur interprétation au sein des dashboards dynamiques fournis à nos clients.
: Tu participeras à la production d’analyses statistiques avancées (régressions, corrélations, AFC, …) pour apporter de la consistance et du relief à l’analyse des résultats d’enquêtes.",40 k € (Estimation de l'employeur),,De 1 à 50 employés,,,,,,,,,,,,,,,1093,,
"SNCF
3.6",Data Analyst (F ou H),Saint-Denis,France,"Premier transporteur ferroviaire de marchandises en France et 3ème en Europe avec le réseau Captrain, Fret SNCF conçoit des solutions de transport nationales et internationales adaptées à chaque secteur d’activité et aux enjeux des clients chargeurs. Fret SNCF génère un chiffre d’affaires de près de 0,7 Milliard € avec environ 5 200 agents. Fret SNCF est engagé dans un programme de transformation avec de nombreux défis à relever. Dans ce contexte, Fret SNCF propose de rejoindre un environnement dynamique en transformation pour relever de nouveaux défis collectifs et permettre d’accompagner sa transformation.
Vos missions
Au sein de la Direction financière, vous intégrez l'équipe de maitrise d'ouvrage transverse Décisionnel / Données de Fret SNCF. Vous participez au développement et à la maintenance des outils de gestion et d'analyse de données en étroite collaboration avec les équipes métiers des différents services de Fret SNCF (direction financière, comptable, direction de la production, etc). Avec les équipes de la Direction des systèmes informatiques, vous contribuez à l'évolution du Décisionnel, outil principal de reporting des activités de FRET SNCF. Vous serez amené à réaliser des études statistiques ponctuelles pour les besoins des services ainsi que pour répondre aux sollicitations d'organismes extérieurs dans le cadre de collecte de données réglementaires.",40 k € (Estimation de l'employeur),,Plus de 10 000 employés,,,,3.6,65 %,65 %,3.8,3.3,3.1,3.6,3.2,3.6,,,1093,https://www.glassdoor.fr/Avis/SNCF-R%C3%A9seau-Avis-E1837572.htm,https://www.glassdoor.fr/Benefits/SNCF-R%C3%A9seau-Benefits-E1837572.htm
"Bayard
4.1",Data analyst(F/H),Montrouge,France,"Société
Acteur majeur dans le secteur des médias, Bayard est un éditeur de référence auprès de trois publics : jeunesse, chrétien et senior. Avec ses 36 millions de lecteurs dans le monde, plus d’une centaine de magazines (ex. J’aime Lire), déjà 8 millions de livres vendus mais aussi une centaine de sites, des applications et livres numériques, Bayard inscrit sa singularité autour d’un projet et des valeurs communes que sont la création, les convictions et la relation que nous entretenons avec nos publics.
L’intégration de nouveaux talents est indispensable pour favoriser cette agilité.
Rejoindre Bayard, c’est rejoindre une entreprise indépendante, à taille humaine, tournée vers l’avenir



Vous menez à bien des analyses statistiques ad hoc permettant d’enrichir la connaissance Client",40 k € (Estimation de l'employeur),,De 1 001 à 5 000 employés,Édition,Médias et communication,Entre 100 et 500 millions de dollars US,4.1,96 %,98 %,3.7,3.5,3.1,4.4,3.6,4.6,,,1093,https://www.glassdoor.fr/Avis/Bayard-Avis-E845889.htm,https://www.glassdoor.fr/Benefits/Bayard-Benefits-E845889.htm
